-- MySQL dump 10.13  Distrib 5.1.73, for debian-linux-gnu (x86_64)
--
-- Host: localhost    Database: mcb_production
-- ------------------------------------------------------
-- Server version	5.1.73-0ubuntu0.10.04.1

/*!40101 SET @OLD_CHARACTER_SET_CLIENT=@@CHARACTER_SET_CLIENT */;
/*!40101 SET @OLD_CHARACTER_SET_RESULTS=@@CHARACTER_SET_RESULTS */;
/*!40101 SET @OLD_COLLATION_CONNECTION=@@COLLATION_CONNECTION */;
/*!40101 SET NAMES utf8 */;
/*!40103 SET @OLD_TIME_ZONE=@@TIME_ZONE */;
/*!40103 SET TIME_ZONE='+00:00' */;
/*!40014 SET @OLD_UNIQUE_CHECKS=@@UNIQUE_CHECKS, UNIQUE_CHECKS=0 */;
/*!40014 SET @OLD_FOREIGN_KEY_CHECKS=@@FOREIGN_KEY_CHECKS, FOREIGN_KEY_CHECKS=0 */;
/*!40101 SET @OLD_SQL_MODE=@@SQL_MODE, SQL_MODE='NO_AUTO_VALUE_ON_ZERO' */;
/*!40111 SET @OLD_SQL_NOTES=@@SQL_NOTES, SQL_NOTES=0 */;

--
-- Table structure for table `calendar_events`
--

DROP TABLE IF EXISTS `calendar_events`;
/*!40101 SET @saved_cs_client     = @@character_set_client */;
/*!40101 SET character_set_client = utf8 */;
CREATE TABLE `calendar_events` (
  `id` int(11) NOT NULL AUTO_INCREMENT,
  `eventId` varchar(255) DEFAULT NULL,
  `startDate` varchar(255) DEFAULT NULL,
  `startTime` varchar(255) DEFAULT NULL,
  `endDate` varchar(255) DEFAULT NULL,
  `endTime` varchar(255) DEFAULT NULL,
  `titleLong` text,
  `titleLink` varchar(255) DEFAULT NULL,
  `locationText` varchar(255) DEFAULT NULL,
  `sponsorText` varchar(255) DEFAULT NULL,
  `contactNameText` varchar(255) DEFAULT NULL,
  `contactEmail` varchar(255) DEFAULT NULL,
  `contactPhone` varchar(255) DEFAULT NULL,
  `eventType` varchar(255) DEFAULT NULL,
  `originatingCalendarName` varchar(255) DEFAULT NULL,
  `start` datetime DEFAULT NULL,
  `end` datetime DEFAULT NULL,
  `created_at` datetime DEFAULT NULL,
  `updated_at` datetime DEFAULT NULL,
  PRIMARY KEY (`id`)
) ENGINE=InnoDB AUTO_INCREMENT=3319 DEFAULT CHARSET=utf8;
/*!40101 SET character_set_client = @saved_cs_client */;

--
-- Dumping data for table `calendar_events`
--

LOCK TABLES `calendar_events` WRITE;
/*!40000 ALTER TABLE `calendar_events` DISABLE KEYS */;
INSERT INTO `calendar_events` VALUES (902,'3697498','11/24/2011',NULL,'11/24/2011',NULL,'Thanksgiving Day',NULL,NULL,'University of Illinois Board of Trustees',NULL,NULL,NULL,'Academic','Illinois Campus Calendar: Holidays','2011-11-24 06:00:00','2011-11-24 06:00:00','2011-11-12 00:31:40','2011-11-12 00:31:40'),(903,'3697500','11/25/2011',NULL,'11/25/2011',NULL,'Day After Thanksgiving - Designated Holiday',NULL,NULL,'University of Illinois Board of Trustees',NULL,NULL,NULL,'Special Event','Illinois Campus Calendar: Holidays','2011-11-25 06:00:00','2011-11-25 06:00:00','2011-11-12 00:31:40','2011-11-12 00:31:40'),(904,'4946968','11/28/2011',NULL,'11/28/2011',NULL,'Instruction resumes',NULL,NULL,'Faculty Senate',NULL,NULL,NULL,'Academic','Illinois Campus Academic Calendar','2011-11-28 06:00:00','2011-11-28 06:00:00','2011-11-12 00:31:40','2011-11-12 00:31:40'),(909,'4946969','12/7/2011',NULL,'12/7/2011',NULL,'Instruction Ends for Fall Semester',NULL,NULL,'Faculty Senate',NULL,NULL,NULL,'Academic','Illinois Campus Academic Calendar','2011-12-07 06:00:00','2011-12-07 06:00:00','2011-11-12 00:31:40','2011-11-12 00:31:40'),(910,'4946970','12/8/2011',NULL,'12/8/2011',NULL,'Reading Day',NULL,NULL,'Faculty Senate',NULL,NULL,NULL,'Academic','Illinois Campus Academic Calendar','2011-12-08 06:00:00','2011-12-08 06:00:00','2011-11-12 00:31:40','2011-11-12 00:31:40'),(912,'4946971','12/9/2011',NULL,'12/9/2011',NULL,'Final Exams Begin',NULL,NULL,'Faculty Senate',NULL,NULL,NULL,'Academic','Illinois Campus Academic Calendar','2011-12-09 06:00:00','2011-12-09 06:00:00','2011-11-12 00:31:40','2011-11-12 00:31:40'),(914,'3697501','12/26/2011',NULL,'12/26/2011',NULL,'Christmas Day Holiday observed',NULL,NULL,'University of Illinois Board of Trustees',NULL,NULL,NULL,'Special Event','Illinois Campus Calendar: Holidays','2011-12-26 06:00:00','2011-12-26 06:00:00','2011-11-12 00:31:40','2011-11-12 00:31:40'),(915,'3697502','12/27/2011',NULL,'12/27/2011',NULL,'Day after Christmas - Designated Holiday',NULL,NULL,'University of Illinois Board of Trustees',NULL,NULL,NULL,'Academic','Illinois Campus Calendar: Holidays','2011-12-27 06:00:00','2011-12-27 06:00:00','2011-11-12 00:31:40','2011-11-12 00:31:40'),(916,'3697503','12/28/2011',NULL,'12/30/2011',NULL,'Reduced Service Day*',NULL,NULL,'University of Illinois Board of Trustees',NULL,NULL,NULL,'Academic','Illinois Campus Calendar: Holidays','2011-12-28 06:00:00','2011-12-30 06:00:00','2011-11-12 00:31:40','2011-11-12 00:31:40'),(917,'3697504','1/2/2012',NULL,'1/2/2012',NULL,'New Year\'s Day - Holiday observed',NULL,NULL,'University of Illinois Board of Trustees',NULL,NULL,NULL,'Academic','Illinois Campus Calendar: Holidays','2012-01-02 06:00:00','2012-01-02 06:00:00','2011-11-12 00:31:40','2011-11-12 00:31:40'),(918,'4946972','1/16/2012',NULL,'1/16/2012',NULL,'M.L.King Holiday',NULL,NULL,'Faculty Senate',NULL,NULL,NULL,'Academic','Illinois Campus Academic Calendar','2012-01-16 06:00:00','2012-01-16 06:00:00','2011-11-12 00:31:40','2011-11-12 00:31:40'),(919,'4946973','1/17/2012',NULL,'1/17/2012',NULL,'First Day of Instruction, Spring Semester',NULL,NULL,'Faculty Senate',NULL,NULL,NULL,'Academic','Illinois Campus Academic Calendar','2012-01-17 06:00:00','2012-01-17 06:00:00','2011-11-12 00:31:40','2011-11-12 00:31:40'),(944,'4946974','3/17/2012',NULL,'3/17/2012',NULL,'Spring Vacation Begins',NULL,NULL,'Faculty Senate',NULL,NULL,NULL,'Academic','Illinois Campus Academic Calendar','2012-03-17 05:00:00','2012-03-17 05:00:00','2011-11-12 00:31:42','2011-11-12 00:31:42'),(945,'4946975','3/26/2012',NULL,'3/26/2012',NULL,'Instruction resumes',NULL,NULL,'Faculty Senate',NULL,NULL,NULL,'Academic','Illinois Campus Academic Calendar','2012-03-26 05:00:00','2012-03-26 05:00:00','2011-11-12 00:31:42','2011-11-12 00:31:42'),(973,'4946966','11/11/2011',NULL,'11/11/2011',NULL,'Veteran\'s Day',NULL,NULL,'Faculty Senate',NULL,NULL,NULL,'Academic','Illinois Campus Academic Calendar','2011-11-11 06:00:00','2011-11-11 06:00:00','2011-11-12 00:34:12','2011-11-12 00:34:12'),(974,'5926305','11/11/2011','12:00 pm','11/11/2011','1:00 pm','Biochemistry Seminar:  Dr. Jeffrey Brodsky, University of Pittsburgh, PA:  \"ER protein quality control and conformational disease\"','http://www.pitt.edu/~biohome/Dept/Frame/Faculty/brodsky.htm','B102 CLSL','Dr. Steven Blanke','Cara Day','caraday@illinois.edu','333-2013','Seminar','Biochemistry Department Seminars','2011-11-11 18:00:00','2011-11-11 07:00:00','2011-11-12 01:14:43','2011-11-12 01:14:43'),(975,'4941540','11/14/2011','12:00 pm','11/14/2011',NULL,'Cell &  Developmental Biology Seminar:   Dr. Anna Huttenlocher, University of Wisconsin-Madison, Department of Medical Microbiology and Immunology, \"Cell motility in zebrafish; implications to human disease\"',NULL,'B102 CLSL','Cell & Developmental Biology','Elaine Rodgers, Lisa Stubbs','erodgers@life.illinois.edu','217-265-5511','Seminar','Cell and Developmental Biology (CDB) Departmental Seminars','2011-11-14 18:00:00','2011-11-14 06:00:00','2011-11-12 01:14:43','2011-11-12 01:14:43'),(976,'8954687','11/14/2011','5:00 pm','11/14/2011','6:00 pm','MCB Undergraduate Research Workshop',NULL,'218 Mechanical Engineering Building','MCB Advising Program',NULL,NULL,NULL,NULL,'MCB Undergraduate Events','2011-11-14 23:00:00','2011-11-14 12:00:00','2011-11-12 01:14:43','2011-11-12 01:14:43'),(977,'7805954','11/16/2011','4:00 pm','11/16/2011',NULL,'Ning Sun (Zhao Lab) - \"Optimized TAL effector nucleases (TALENs) for use in treatment of sickle cell disease\"',NULL,'116 RAL','Biochemistry',NULL,NULL,NULL,'Seminar','Biochemistry Department Graduate Seminars','2011-11-16 22:00:00','2011-11-16 06:00:00','2011-11-12 01:14:43','2011-11-12 01:14:43'),(978,'7805958','11/16/2011','4:00 pm','11/16/2011',NULL,'Hua Zhou (Jakobsson Lab) - \"Distance matrix based evolutionary correlation \"',NULL,'116 RAL','Biochemistry',NULL,NULL,NULL,'Seminar','Biochemistry Department Graduate Seminars','2011-11-16 22:00:00','2011-11-16 06:00:00','2011-11-12 01:14:43','2011-11-12 01:14:43'),(979,'5591697','11/17/2011','4:00 pm','11/17/2011',NULL,'Microbiology Seminar:  Dr. Stephanie Seveau,  \"Novel role for the pore-forming toxin listeriolysin O in host cell invasion by Listeria monocytogenes\"',NULL,'B102, Chemical and Life Sciences Laboratory, 601 South Goodwin Avenue','Dr. Brenda Wilson, Associate Professor','Diane Tsevelekos','microsem@life.illinois.edu','333-1736','Seminar','Microbiology Department','2011-11-17 22:00:00','2011-11-17 06:00:00','2011-11-12 01:14:43','2011-11-12 01:14:43'),(980,'10995109','11/17/2011','5:00 pm','11/17/2011','6:00 pm','Careers in Genetics',NULL,'140 Burill Hall','MCB Advising Program',NULL,NULL,NULL,NULL,'MCB Undergraduate Events','2011-11-17 23:00:00','2011-11-17 12:00:00','2011-11-12 01:14:43','2011-11-12 01:14:43'),(981,'1432517','11/18/2011','12:00 pm','11/18/2011','1:00 pm','Biochemistry Seminar:  Dr. Aimee Edinger, University of California-Irvine, Cancer Research Institute, Irvine, CA: \"Starving cancer cells to death\"','http://www.cri.bio.uci.edu/Faculty/edinger_a.html','B102 CLSL','Dr. Rutilio Fratti','Cara Day','caraday@illinois.edu','333-2013','Seminar','Biochemistry Department Seminars','2011-11-18 18:00:00','2011-11-18 07:00:00','2011-11-12 01:14:43','2011-11-12 01:14:43'),(982,'4946967','11/19/2011','1:00 pm','11/19/2011',NULL,'Thanksgiving Break Begins',NULL,NULL,'Faculty Senate',NULL,NULL,NULL,'Academic','Illinois Campus Academic Calendar','2011-11-19 19:00:00','2011-11-19 06:00:00','2011-11-12 01:14:43','2011-11-12 01:14:43'),(983,'7800422','11/28/2011','12:00 pm','11/28/2011','1:00 pm','CDB Student & Postdoc Seminar, Edwin Arauz & Dr. Labib Rouhana',NULL,'B102 CLSL','Cell & Developmental Biology Department','Shannon Croft','shannon9@life.illinois.edu','(217) 333-6118','Lecture','Cell and Developmental Biology (CDB) Student & Postdoc Seminars','2011-11-28 18:00:00','2011-11-28 07:00:00','2011-11-12 01:14:44','2011-11-12 01:14:44'),(984,'5591698','12/1/2011','4:00 pm','12/1/2011',NULL,'Microbiology Seminar:  Dr. Ronald Breaker, \"New and Mysterious Riboswitches and Ribozymes\"',NULL,'B102, Chemical and Life Sciences Laboratory, 601 South Goodwin Avenue','Dr. Carin Vanderpool, Assistant Professor','Diane Tsevelekos','microsem@life.illinois.edu','333-1736','Seminar','Microbiology Department','2011-12-01 22:00:00','2011-12-01 06:00:00','2011-11-12 01:14:44','2011-11-12 01:14:44'),(985,'7759157','12/2/2011','12:00 pm','12/2/2011','1:00 pm','Biochemistry Seminar: Dr. Michael T. Green, Penn State, \"TBA\"','http://www.chem.psu.edu/directory/mtg10','B102 CLSL','Dr. Stephen G. Sligar','Cara L. Day','caraday@illinois.edu','217.333.2013','Seminar','Biochemistry Department Seminars','2011-12-02 18:00:00','2011-12-02 07:00:00','2011-11-12 01:14:44','2011-11-12 01:14:44'),(986,'8344291','12/5/2011','12:00 pm','12/5/2011','1:00 pm','CDB Student & Postdoc Seminar, Christopher Bolt & Dr. Arindam Chakraborty',NULL,'B102 CLSL','Cell & Developmental Biology Department','Shannon Croft','shannon9@life.illinois.edu','(217) 333-6118','Lecture','Cell and Developmental Biology (CDB) Student & Postdoc Seminars','2011-12-05 18:00:00','2011-12-05 07:00:00','2011-11-12 01:14:44','2011-11-12 01:14:44'),(987,'5591699','12/8/2011','4:00 pm','12/8/2011',NULL,'Microbiology Seminar:  Dr. Julie Pfieffer, \"Complex interactions in the gut:  Enteric viruses, bacteria, mucosa, and immunity\"',NULL,'B102, Chemical and Life Sciences Laboratory, 601 South Goodwin Avenue','Dr. Joanna Shisler, Associate Professor','Diane Tsevelekos','microsem@life.illinois.edu','333-1736','Seminar','Microbiology Department','2011-12-08 22:00:00','2011-12-08 06:00:00','2011-11-12 01:14:44','2011-11-12 01:14:44'),(988,'7800424','12/12/2011','12:00 pm','12/12/2011','1:00 pm','CDB Student & Postdoc Seminar, Frank Echtenkemp & Dr. James Sikes',NULL,'B102 CLSL','Cell & Developmental Biology Department','Shannon Croft','shannon9@life.illinois.edu','(217) 333-6118','Lecture','Cell and Developmental Biology (CDB) Student & Postdoc Seminars','2011-12-12 18:00:00','2011-12-12 07:00:00','2011-11-12 01:14:44','2011-11-12 01:14:44'),(989,'7805966','1/18/2012','4:00 pm','1/18/2012',NULL,'Dr. David Kranz',NULL,NULL,'Biochemistry',NULL,NULL,NULL,'Seminar','Biochemistry Department Graduate Seminars','2012-01-18 22:00:00','2012-01-18 06:00:00','2011-11-12 01:14:44','2011-11-12 01:14:44'),(992,'1432512','1/27/2012','12:00 pm','1/27/2012','1:00 pm','Biochemistry Seminar:  Dr. Scott Emr, Cornell University-Weill Institute for Cell & Molecular Biology, Ithaca, NY: \"TBD\"','http://bmcb.cornell.edu/faculty/emr.html','B102 CLSL','Dr. Rutilio Fratti','Cara Day','caraday@illinois.edu','333-2013','Seminar','Biochemistry Department Seminars','2012-01-27 18:00:00','2012-01-27 07:00:00','2011-11-12 01:14:44','2011-11-12 01:14:44'),(993,'7800425','1/30/2012','12:00 pm','1/30/2012','1:00 pm','CDB Student & Postdoc Seminar, Yu Chen & Dr. Ernest Blackwell',NULL,'B102 CLSL','Cell & Developmental Biology Department','Shannon Croft','shannon9@life.illinois.edu','(217) 333-6118','Lecture','Cell and Developmental Biology (CDB) Student & Postdoc Seminars','2012-01-30 18:00:00','2012-01-30 07:00:00','2011-11-12 01:14:45','2011-11-12 01:14:45'),(995,'7932619','2/8/2012','4:00 pm','2/8/2012',NULL,'Fiona Groninger-Poe (Gerlt Lab) -',NULL,'116 RAL','Biochemistry',NULL,NULL,NULL,'Seminar','Biochemistry Department Graduate Seminars','2012-02-08 22:00:00','2012-02-08 06:00:00','2011-11-12 01:14:45','2011-11-12 01:14:45'),(997,'7800427','2/13/2012','12:00 pm','2/13/2012','1:00 pm','CDB Student & Postdoc Seminar, Nidhi Nidhi & Dr. Rachel Roberts-Galbraith',NULL,'B102 CLSL','Cell & Developmental Biology Department','Shannon Croft','shannon9@life.illinois.edu','(217) 333-6118','Lecture','Cell and Developmental Biology (CDB) Student & Postdoc Seminars','2012-02-13 18:00:00','2012-02-13 07:00:00','2011-11-12 01:14:45','2011-11-12 01:14:45'),(1004,'7800423','2/27/2012','12:00 pm','2/27/2012','1:00 pm','CDB Student & Postdoc Seminar, Min Zeng',NULL,'B102 CLSL','Cell & Developmental Biology Department','Shannon Croft','shannon9@life.illinois.edu','(217) 333-6118','Lecture','Cell and Developmental Biology (CDB) Student & Postdoc Seminars','2012-02-27 18:00:00','2012-02-27 07:00:00','2011-11-12 01:14:46','2011-11-12 01:14:46'),(1032,'12201291','12/15/2011','4:00 pm','12/15/2011',NULL,'Microbiology Seminar:  Dr. Mary Lidstrom, \"Methanotroyphy revisited:  global analysis of carbon assimilatory pathways in methanotrophic bacteria\"',NULL,'B102 Chemical & Life Sciences Laboratory, 601 S. Goodwin Ave., Urbana','Dr. William Metcalf, Professor','Diane Tsevelekos','microsem@illinois.edu','333-1736','Seminar','Microbiology Department','2011-12-15 22:00:00','2011-12-15 06:00:00','2011-12-03 06:10:13','2011-12-03 06:10:13'),(1033,'7800426','2/6/2012','12:00 pm','2/6/2012','1:00 pm','CDB Student & Postdoc Seminar, Anika Jain',NULL,'B102 CLSL','Cell & Developmental Biology Department','Shannon Croft','shannon9@life.illinois.edu','(217) 333-6118','Lecture','Cell and Developmental Biology (CDB) Student & Postdoc Seminars','2012-02-06 18:00:00','2012-02-06 19:00:00','2011-12-03 06:10:14','2011-12-03 06:10:14'),(1034,'12913203','1/16/2012',NULL,'1/16/2012',NULL,'Martin Luther King Jr. Day - Designated Holiday',NULL,NULL,'University of Illinois Board of Trustees',NULL,NULL,NULL,'Holiday','Illinois Campus Calendar: Holidays','2012-01-16 06:00:00','2012-01-16 06:00:00','2011-12-03 06:10:14','2011-12-03 06:10:14'),(1035,'11249851','1/23/2012','12:00 pm','1/23/2012',NULL,'Cell &  Developmental Biology Seminar:    Dr. Patrick Varga-Weisz, Babraham Institute, Cambridge, UK,  \"Chromatin replication, chromatin remodeling and epigenetic stability\"',NULL,'B102 CLSL','Cell & Developmental Biology','Elaine Rodgers, Fei Wang','erodgers@life.illinois.edu','217-265-5511','Seminar','Cell and Developmental Biology (CDB) Departmental Seminars','2012-01-23 18:00:00','2012-01-23 06:00:00','2011-12-05 17:10:13','2011-12-05 17:10:13'),(1047,'4944250','4/11/2012','12:00 pm','4/11/2012',NULL,'Cell &  Developmental Biology Seminar:   Dr. Johannes Walter, Harvard Medical School, Department of Biological Chemistry & Molecular Pharmacology, \"The mechanism and regulation of vertebrate DNA replication:  from cell extracts to single molecules\"',NULL,'B102 CLSL','Cell & Developmental Biology','Elaine Rodgers, Lisa Stubbs','erodgers@life.illinois.edu','217-265-5511','Seminar','Cell and Developmental Biology (CDB) Departmental Seminars','2012-04-11 17:00:00','2012-04-11 05:00:00','2011-12-13 17:10:14','2011-12-13 17:10:14'),(1051,'4942249','2/1/2012','12:00 pm','2/1/2012',NULL,'Cell &  Developmental Biology Seminar:   Dr. Arnold Kriegstein, The Eli & Edythe Broad Center of Regeneration Medicine & Stem Cell Research at UCSF, \"Creating neuronal diversity in the human Neocortex\"',NULL,'B102 CLSL','Cell & Developmental Biology','Elaine Rodgers, Fei Wang','erodgers@life.illinois.edu','217-265-5511','Seminar','Cell and Developmental Biology (CDB) Departmental Seminars','2012-02-01 18:00:00','2012-02-01 06:00:00','2012-01-31 06:10:14','2012-01-31 06:10:14'),(1052,'7935371','2/8/2012','4:00 pm','2/8/2012',NULL,'Michael Gregory (Sligar Lab) - \"CYP17: Interrogating the Gatekeeper of Androgen Biosynthesis\"',NULL,'116 RAL','Biochemistry',NULL,NULL,NULL,'Seminar','Biochemistry Department Graduate Seminars','2012-02-08 22:00:00','2012-02-08 06:00:00','2012-02-08 20:00:30','2012-02-08 20:00:30'),(1053,'13299908','2/10/2012','12:00 pm','2/10/2012',NULL,'Herbert E. Carter Lecture: \"Nuclear Receptors and Regulation of Nutrient Metabolism: From Worms to Man\"','http://mcb.illinois.edu/departments/biochemistry/carter/','B102 CLSL','Dr. Maria Spies','Cara L. Day','caraday@illinois.edu',NULL,'Seminar','Biochemistry Department Seminars','2012-02-10 18:00:00','2012-02-10 06:00:00','2012-02-08 20:00:30','2012-02-08 20:00:30'),(1054,'7935369','2/15/2012','4:00 pm','2/15/2012',NULL,'Aaron Knowlton - Weber Fellow - (Hergenrother Lab) - \"Activation of the miRNA Pathway for the Personalized Treatment of Cancer \"',NULL,'116 RAL','Biochemistry',NULL,NULL,NULL,'Seminar','Biochemistry Department Graduate Seminars','2012-02-15 22:00:00','2012-02-15 06:00:00','2012-02-08 20:00:30','2012-02-08 20:00:30'),(1055,'7935370','2/15/2012','4:00 pm','2/15/2012',NULL,'Bijoy Desai (Gerlt Lab) - \"Mechanistic studies on orotidine 5\'-monophosphate decarboxylase\"',NULL,'116 RAL','Biochemistry',NULL,NULL,NULL,'Seminar','Biochemistry Department Graduate Seminars','2012-02-15 22:00:00','2012-02-15 06:00:00','2012-02-08 20:00:30','2012-02-08 20:00:30'),(1056,'7615793','2/17/2012','12:00 pm','2/17/2012','1:00 pm','Biochemistry Seminar: Dr. Adrian Keatinge-Clay, University of Texas at Austin, \"Employing Polyketide Synthases in the Biocatalysis of Chiral Building Blocks\"','http://keatinge-clay.cm.utexas.edu/research/','B102 CLSL','Dr. Satish Nair','Cara L. Day','caraday@illinois.edu','217.333.2013','Seminar','Biochemistry Department Seminars','2012-02-17 18:00:00','2012-02-17 19:00:00','2012-02-08 20:00:30','2012-02-08 20:00:30'),(1057,'8344297','2/20/2012','12:00 pm','2/20/2012','1:00 pm','CDB Student & Postdoc Seminar, Younguk Sun',NULL,'B102 CLSL','Cell & Developmental Biology Department','Shannon Croft','shannon9@life.illinois.edu','(217) 333-6118','Lecture','Cell and Developmental Biology (CDB) Student & Postdoc Seminars','2012-02-20 18:00:00','2012-02-20 19:00:00','2012-02-08 20:00:30','2012-02-08 20:00:30'),(1058,'7935378','2/22/2012','4:00 pm','2/22/2012',NULL,'Zhanar Abil (Zhao Lab) - \"Gene Targeting of CFTR Using an Engineered Tal-Effector Nuclease \"',NULL,'116 RAL','Biochemistry',NULL,NULL,NULL,'Seminar','Biochemistry Department Graduate Seminars','2012-02-22 22:00:00','2012-02-22 06:00:00','2012-02-08 20:00:30','2012-02-08 20:00:30'),(1059,'13260966','3/1/2012','4:00 pm','3/1/2012',NULL,'Microbiology Seminar:  Dr. Jeffrey Barrick, \"Experimental studies of tempo and mode in bacterial genome evolution\"',NULL,'B102 Chemical & Life Sciences Laboratory, 601 S. Goodwin Ave., Urbana','Dr. Cari Vanderpool, Assistant Professor','Diane Tsevelekos','microsem@illinois.edu','333-1736','Seminar','Microbiology Department','2012-03-01 22:00:00','2012-03-01 06:00:00','2012-02-08 20:00:30','2012-02-08 20:00:30'),(1060,'11703533','3/7/2012','12:00 pm','3/7/2012',NULL,'Cell &  Developmental Biology Seminar:    Dr. Vlad Denic, Harvard University, Molecular and Cellular Biology, \"The Mechanism of Tail-Anchored Protein Insertion into the ER Membrane\"',NULL,'B102 CLSL','Cell & Developmental Biology','Elaine Rodgers','erodgers@life.illinois.edu','217-265-5511','Seminar','Cell and Developmental Biology (CDB) Departmental Seminars','2012-03-07 18:00:00','2012-03-07 06:00:00','2012-02-08 20:00:31','2012-02-08 20:00:31'),(1061,'13263750','5/3/2012','2:00 pm','5/3/2012',NULL,'Microbiology Seminar:  Dr. Michael McInerney, \"Syntrophy, the paradigm for anaerobic metabolic cooperation\"',NULL,'B102 Chemical & Life Sciences Laboratory, 601 S. Goodwin Ave., Urbana','Dr. Bruce Fouke, Associate Professor in Geology/Microbiology Affilliate','Diane Tsevelekos','microsem@illinois.edu','333-1736','Seminar','Microbiology Department','2012-05-03 19:00:00','2012-05-03 05:00:00','2012-02-08 20:00:31','2012-02-08 20:00:31'),(1062,'15402582','2/9/2012','12:00 pm','2/9/2012',NULL,'2012 C. Ladd Prosser Lecture presented by William Gilly, Professor, Cell and Developmental Biology, Marine and Organismal Biology at Stanford Univ., \"Changing Views of Ocean Oxygen and Humboldt Squid: Climate Change and Half Mile Down\"','http://www-marine.stanford.edu/gilly.html','B102 CLSL','Dept. of MIP','Penny Morman','morman@illinois.edu','217-333-8275','Lecture','Molecular and Integrative Physiology (MIP) Department Seminar Series','2012-02-09 18:00:00','2012-02-09 06:00:00','2012-02-08 20:00:31','2012-02-08 20:00:31'),(1063,'14690528','2/9/2012','4:00 pm','2/9/2012',NULL,'School of Molecular & Cellular Biology Seminar:  Dr. Bo Li, \"Mapping the biosynthesis of sulfur-containing cyclic peptides in bacteria\"',NULL,'B102 Chemical & Life Sciences Laboratory, 601 S. Goodwin Ave., Urbana','Dr. James Imlay, Professor, Department of Microbiology','Diane Tsevelekos','microsem@illinois.edu','333-1736','Seminar','Microbiology Department','2012-02-09 22:00:00','2012-02-09 06:00:00','2012-02-08 20:00:31','2012-02-08 20:00:31'),(1064,'15134325','2/13/2012','2:00 pm','2/13/2012','3:00 pm','School of Molecular & Cellular Biology Seminar: Dr. Hong Jin, MRC Laboratory of Molecular Biology, \"Structural basis of translational termination\"',NULL,'B102 CLSL','Dr. Satish Nair','Cara L. Day','caraday@illinois.edu','217.333.2013','Seminar','Biochemistry Department Seminars','2012-02-13 20:00:00','2012-02-13 21:00:00','2012-02-08 20:00:31','2012-02-08 20:00:31'),(1066,'15060839','2/15/2012','5:00 pm','2/15/2012','6:05 pm','Careers in MCB: Biotechnology',NULL,'161 Noyes lab','MCB Advising Program',NULL,NULL,NULL,NULL,'MCB Undergraduate Events','2012-02-15 23:00:00','2012-02-16 00:05:00','2012-02-08 20:00:31','2012-02-08 20:00:31'),(1069,'14690495','2/16/2012','4:00 pm','2/16/2012',NULL,'School of Molecular & Cellular Biology Seminar:  Dr. Paula Welander, \"Hopanoids and Sterols:  Ancient Fats in Modern Bacteria\"',NULL,'B102 Chemical & Life Sciences Laboratory, 601 S. Goodwin Ave., Urbana','Dr. James Imlay, Professor, Department of Microbiology','Diane Tsevelekos','microsem@illinois.edu','333-1736','Seminar','Microbiology Department','2012-02-16 22:00:00','2012-02-16 06:00:00','2012-02-08 20:00:31','2012-02-08 20:00:31'),(1070,'16001921','2/20/2012',NULL,'2/20/2012',NULL,'Cancer Research Forum and Poster Prize Competition Abstract submission/registration deadline','http://chicago.medicine.uic.edu/cms/One.aspx?portalId=506244&pageId=15020443',NULL,'Cancer Research Forum',NULL,NULL,NULL,NULL,'MCB Events','2012-02-20 06:00:00','2012-02-20 06:00:00','2012-02-08 20:00:31','2012-02-08 20:00:31'),(1071,'14690530','2/21/2012','12:00 pm','2/21/2012',NULL,'School of Molecular & Cellular Biology Seminar:  Dr. Jue Wang, \"Post Genomic Insights into Nutrient Stress and Genomic Integrity\"',NULL,'*Room 612, Institute for Genomic Biology, 1206 West Gregory Drive, Urbana','Dr. James Imlay, Professor, Department of Microbiology','Diane Tsevelekos','microsem@illinois.edu','333-1736','Seminar','Microbiology Department','2012-02-21 18:00:00','2012-02-21 06:00:00','2012-02-08 20:00:31','2012-02-08 20:00:31'),(1072,'15416757','3/27/2012','5:00 pm','3/27/2012','6:00 pm','MCB Undergraduate Research Workshop',NULL,'217 Noyes Lab','MCB Advising Program',NULL,NULL,NULL,NULL,'MCB Undergraduate Events','2012-03-27 22:00:00','2012-03-27 23:00:00','2012-02-08 20:00:31','2012-02-08 20:00:31'),(1073,'15416758','4/16/2012','5:00 pm','4/16/2012','6:00 pm','MCB Undergraduate Research Workshop',NULL,'161 Noyes lab','MCB Advising Program',NULL,NULL,NULL,NULL,'MCB Undergraduate Events','2012-04-16 22:00:00','2012-04-16 23:00:00','2012-02-08 20:00:31','2012-02-08 20:00:31'),(1092,'13260970','4/12/2012','4:00 pm','4/12/2012',NULL,'Microbiology Seminar:  Dr. Ken Jarrell, \"Surface structures of the archaeum Methanococcus maripaludis\"',NULL,'B102 Chemical & Life Sciences Laboratory, 601 S. Goodwin Ave., Urbana','Dr. Peter Orlean,','Diane Tsevelekos','microsem@illinois.edu','333-1736','Seminar','Microbiology Department','2012-04-12 21:00:00','2012-04-12 05:00:00','2012-02-09 20:10:16','2012-02-09 20:10:16'),(1093,'16007595','2/15/2012','2:00 pm','2/15/2012','3:00 pm','School of Molecular & Cellular Biology Seminar: Dr. Liang Feng, Rockefeller University, Lab of Molecular Neurobiology and Biophysics, \"When ion channel meets transporter: structure and mechanisms of a eukaryotic CLC C1-/H+ exchange transporter\"',NULL,'B102 CLSL','Dr. Robert Gennis','Cara L. Day','caraday@illinois.edu','217.333.2013','Seminar','Biochemistry Department Seminars','2012-02-15 20:00:00','2012-02-15 21:00:00','2012-02-09 23:10:15','2012-02-09 23:10:15'),(1095,'15134328','2/16/2012','2:00 pm','2/16/2012','3:00 pm','School of Molecular & Cellular Biology Seminar: Dr. David Gruenwald, Technical University Delft, \"Imaging mRNA transport to and through the nuclear pore complex\"',NULL,'B102 CLSL','Dr. Taekjip Ha','Cara L. Day','caraday@illinois.edu','217.333.2013','Seminar','Biochemistry Department Seminars','2012-02-16 20:00:00','2012-02-16 21:00:00','2012-02-14 16:10:15','2012-02-14 16:10:15'),(1096,'16315377','2/23/2012','4:00 pm','2/23/2012','5:00 pm','School of Molecular & Cellular Biology Seminar: Dr. Auinash Kalsotra, Baylor College of Medicine, \"MicroRNA regulation of alternative splicing networks during heart development and disease\"',NULL,'B102 CLSL','Dr. Mary Schuler','Cara L. Day','caraday@illinois.edu','217.333.2013','Seminar','Biochemistry Department Seminars','2012-02-23 22:00:00','2012-02-23 23:00:00','2012-02-14 20:10:14','2012-02-14 20:10:14'),(1097,'7934351','2/22/2012','4:00 pm','2/22/2012',NULL,'Salehe Ghasempur (Gerlt Lab) - \"Mining Enolase Superfamily for New Functions\"',NULL,'116 RAL','Biochemistry',NULL,NULL,NULL,'Seminar','Biochemistry Department Graduate Seminars','2012-02-22 22:00:00','2012-02-22 06:00:00','2012-02-16 15:10:15','2012-02-16 15:10:15'),(1098,'15672566','2/16/2012','12:00 pm','2/16/2012',NULL,'Kai G, PhD-NIDDK, National Institutes of Health at Bethesda, MD. - \"Epigenetic Regulation of Adipogenesis and Nuclear Receptor Action\"','http://www2.niddk.nih.gov/NIDDKLabs/IntramuralFaculty/GeKai.htm','B102 CLSL','J. Kim Kemper, PhD, Dept. of Mol. & Int. Physiology','Penny Morman','morman@illinois.edu','217-333-8275','Seminar','Molecular and Integrative Physiology (MIP) Department Seminar Series','2012-02-16 18:00:00','2012-02-16 06:00:00','2012-02-16 17:10:14','2012-02-16 17:10:14'),(1099,'16405834','2/23/2012','12:00 pm','2/23/2012',NULL,'Rodney W. Johnson, PhD, Professor and Director, Division of Nutritional Sciences, UIUC- \"From inflammation to sickness and cognitive dysfunction: When the immune system subjugates the brain\"','http://www.nutrsci.illinois.edu/faculty/profile.cfm?id=56','B102 CLSL','Dept. of Molecular & Int. Physiology','Penny Morman','morman@illinois.edu','217-333-8275','Seminar','Molecular and Integrative Physiology (MIP) Department Seminar Series','2012-02-23 18:00:00','2012-02-23 06:00:00','2012-02-16 20:10:15','2012-02-16 20:10:15'),(1100,'7935374','2/29/2012','4:00 pm','2/29/2012',NULL,'Swami Srinivas (Cronana Lab) - \"Identification of Free Fatty Acid Exporters in E. coli \"',NULL,'116 RAL','Biochemistry',NULL,NULL,NULL,'Seminar','Biochemistry Department Graduate Seminars','2012-02-29 22:00:00','2012-02-29 06:00:00','2012-02-17 21:10:14','2012-02-17 21:10:14'),(1104,'16623296','2/29/2012','4:00 pm','2/29/2012','5:00 pm','Understanding the IB and MCB Majors',NULL,'135 Burrill Hall','MCB Advising Program',NULL,NULL,NULL,NULL,'MCB Undergraduate Events','2012-02-29 22:00:00','2012-02-29 23:00:00','2012-02-21 17:10:14','2012-02-21 17:10:14'),(1105,'16623297','3/12/2012','5:00 pm','3/12/2012',NULL,'Writing a Winning Science Resume',NULL,'161 Noyes lab','MCB Advising Program',NULL,NULL,NULL,NULL,'MCB Undergraduate Events','2012-03-12 22:00:00','2012-03-12 05:00:00','2012-02-21 17:10:15','2012-02-21 17:10:15'),(1106,'16623298','3/14/2012','5:00 pm','3/14/2012',NULL,'Job Fair 101: Strategies for Success',NULL,'161 Noyes lab','MCB Advising Program',NULL,NULL,NULL,NULL,'MCB Undergraduate Events','2012-03-14 22:00:00','2012-03-14 05:00:00','2012-02-21 17:10:15','2012-02-21 17:10:15'),(1107,'16623300','3/27/2012','5:00 pm','3/27/2012',NULL,'Undergraduate Research Information Session',NULL,'217 Noyes Lab','MCB Advising Program',NULL,NULL,NULL,NULL,'MCB Undergraduate Events','2012-03-27 22:00:00','2012-03-27 05:00:00','2012-02-21 17:10:15','2012-02-21 17:10:15'),(1109,'16623302','4/16/2012','5:00 pm','4/16/2012',NULL,'Undergraduate Research Information Session',NULL,'161 Noyes lab','MCB Advising Program',NULL,NULL,NULL,NULL,'MCB Undergraduate Events','2012-04-16 22:00:00','2012-04-16 05:00:00','2012-02-21 17:10:15','2012-02-21 17:10:15'),(1110,'7935375','2/29/2012','4:00 pm','2/29/2012',NULL,'Pei Wang (Huang Lab) - \"Molecular basis of RNA repair by bacterial Pnkp/Hen1\"',NULL,'116 RAL','Biochemistry',NULL,NULL,NULL,'Seminar','Biochemistry Department Graduate Seminars','2012-02-29 22:00:00','2012-02-29 06:00:00','2012-02-21 22:10:15','2012-02-21 22:10:15'),(1111,'16578103','3/8/2012','4:00 pm','3/8/2012',NULL,'Microbiology Seminar:  Dr. Melinda Faulkner, \"Regulating Oxidative Stress and Iron Homeostasis in Bacillus subtilis\"',NULL,'B102 Chemical & Life Sciences Laboratory, 601 S. Goodwin Ave., Urbana','Dr. Brenda Wilson, Professor','Diane Tsevelekos','microsem@illinois.edu','333-1736','Seminar','Microbiology Department','2012-03-08 22:00:00','2012-03-08 06:00:00','2012-02-23 15:10:14','2012-02-23 15:10:14'),(1112,'13260969','4/5/2012','4:00 pm','4/5/2012',NULL,'Microbiology Seminar:  Dr. Avital Tidhar, \"The Role of the NlpD Lipoprotein in Yersinia pestis Virulence\"',NULL,'B102 Chemical & Life Sciences Laboratory, 601 S. Goodwin Ave., Urbana','Dr. James Slauch, Professor','Diane Tsevelekos','microsem@illinois.edu','333-1736','Seminar','Microbiology Department','2012-04-05 21:00:00','2012-04-05 05:00:00','2012-02-24 16:10:14','2012-02-24 16:10:14'),(1115,'16904511','3/8/2012','12:00 pm','3/8/2012',NULL,'Sheng Zhong, PhD. - Dept. of Bioengineering, UIUC - \"Epigenomic comparison of pluripotent stem cells\"','http://www.bioen.illinois.edu/people/profile.asp?szhong','B102 CLSL','Dept. of MIP - J. Kim Kemper','Penny Morman','morman@illinois.edu','217-333-8275','Seminar','Molecular and Integrative Physiology (MIP) Department Seminar Series','2012-03-08 18:00:00','2012-03-08 06:00:00','2012-02-28 16:10:14','2012-02-28 16:10:14'),(1116,'16912984','4/17/2012','5:00 pm','4/17/2012',NULL,'Careers in MCB: Cytotechnology & Clinical Laboratory Science',NULL,'161 Noyes lab','MCB Advising Program',NULL,NULL,NULL,NULL,'MCB Undergraduate Events','2012-04-17 22:00:00','2012-04-17 05:00:00','2012-02-28 19:10:14','2012-02-28 19:10:14'),(1117,'9474711','3/9/2012','12:00 pm','3/9/2012','1:00 pm','Biochemistry Seminar: Dr. Choukri Ben-Mamoun, Yale University, New Haven, CT; \"New Approaches to Malaria Functional Analysis and Therapy\"','http://bbs.yale.edu/people/choukri_benmamoun.profile','B102 CLSL Auditorium','Dr. Satish Nair','Cara Day','caraday@illinois.edu','(217) 333-2013','Seminar','Biochemistry Department Seminars','2012-03-09 18:00:00','2012-03-09 19:00:00','2012-02-28 23:10:14','2012-02-28 23:10:14'),(1119,'16955443','3/15/2012','12:00 pm','3/15/2012',NULL,'Debabrata Chakravarti, PhD, Assoc. Professor & Assoc. Director, Division of Reproductive Biology Research at Northwestern University - \"Transcriptional Dysregulation in Cancer and Reproductive Diseases\"','http://www.biology.northwestern.edu/igp/faculty/chakravarti/index.html','B102 CLSL','Dept. of MIP','Penny Morman','morman@illinois.edu','217-333-8275','Seminar','Molecular and Integrative Physiology (MIP) Department Seminar Series','2012-03-15 17:00:00','2012-03-15 05:00:00','2012-02-29 18:10:14','2012-02-29 18:10:14'),(1120,'175120','3/28/2012','12:00 pm','3/28/2012',NULL,'Cell &  Developmental Biology Seminar:   Dr. Jeanne Lawrence, University of Massachusetts Medical School, Department of Cell Biology, \"Chromosome silencing by XIST RNA: implications for the repeat genome\"',NULL,'B102 CLSL','Cell & Developmental Biology','Elaine Rodgers, Lisa Stubbs','erodgers@life.illinois.edu','217-265-5511','Seminar','Cell and Developmental Biology (CDB) Departmental Seminars','2012-03-28 17:00:00','2012-03-28 05:00:00','2012-03-02 16:25:08','2012-03-02 16:25:08'),(1122,'7932618','3/14/2012','4:00 pm','3/14/2012',NULL,'Neha Garg (Nair & van der Donk Labs) - \"Two novel peptide antibiotics from Geobacillus thermodenitrificans\"',NULL,'116 RAL','Biochemistry',NULL,NULL,NULL,'Seminar','Biochemistry Department Graduate Seminars','2012-03-14 21:00:00','2012-03-14 05:00:00','2012-03-02 19:25:08','2012-03-02 19:25:08'),(1123,'13260967','3/29/2012','4:00 pm','3/29/2012',NULL,'Microbiology Seminar:  Dr. Gregory Velicer, \"Who is my neighbor?  Social interactions and spatial structure of cooperative bacteria from global to cellular scales\"',NULL,'B102 Chemical & Life Sciences Laboratory, 601 S. Goodwin Ave., Urbana','Dr. Rachel Whitaker, Assistant Professor','Diane Tsevelekos','microsem@illinois.edu','333-1736','Seminar','Microbiology Department','2012-03-29 21:00:00','2012-03-29 05:00:00','2012-03-02 22:10:08','2012-03-02 22:10:08'),(1124,'7935379','3/14/2012','4:00 pm','3/14/2012',NULL,'Yi Yu (van der Donk Lab) - \"Studies on a Promiscuous New Member of the Lantipeptide Synthetase Family \"',NULL,'116 RAL','Biochemistry',NULL,NULL,NULL,'Seminar','Biochemistry Department Graduate Seminars','2012-03-14 21:00:00','2012-03-14 05:00:00','2012-03-06 15:20:07','2012-03-06 15:20:07'),(1125,'16726288','3/14/2012','12:00 pm','3/14/2012',NULL,'Cell &  Developmental Biology Seminar:    Dr. Marty Shankland, University of Texas-- Austin, Section of Molecular Cell & Developmental Biology, \"Establishing symmetry: Pax genes and the development of spiralian embryos\"\"',NULL,'B102 CLSL','Cell & Developmental Biology',NULL,'erodgers@life.illinois.edu','217-265-5511','Seminar','Cell and Developmental Biology (CDB) Departmental Seminars','2012-03-14 17:00:00','2012-03-14 05:00:00','2012-03-07 16:55:08','2012-03-07 16:55:08'),(1127,'17313662','3/15/2012','10:00 am','3/15/2012','11:00 am','School of Molecular & Cellular Biology Seminar: Dr. Aviva Joseph, Delft University of Technology, \"Out of the box approaches in the fight against HIV-1: T cells, B cells and HIV-1 genome export inhibition\"',NULL,'B102 CLSL','Dr. Joanna Shisler','Cara L. Day','caraday@illinois.edu','217.333.2013','Seminar','Biochemistry Department Seminars','2012-03-15 15:00:00','2012-03-15 16:00:00','2012-03-08 17:35:08','2012-03-08 17:35:08'),(1128,'17495246','3/15/2012','4:00 pm','3/15/2012',NULL,'Microbiology Seminar:  Dr. Gary Olsen \"Rampant Interspecies Gene Transfer:  Condon usage evidence for a shared Escherichia coli/Salmonella enterica pangenome\"',NULL,'B102 Chemical & Life Sciences Laboratory, 601 S. Goodwin Ave., Urbana','Dr. Cari Vanderpool, Assistant Professor','Diane Tsevelekos','microsem@illinois.edu','333-1736','Seminar','Microbiology Department','2012-03-15 21:00:00','2012-03-15 05:00:00','2012-03-12 15:25:08','2012-03-12 15:25:08'),(1132,'16623301','4/5/2012','5:00 pm','4/5/2012','6:00 pm','Medical School Advice from the Experts',NULL,'165 Noyes lab','MCB Advising Program',NULL,NULL,NULL,NULL,'MCB Undergraduate Events','2012-04-05 22:00:00','2012-04-05 23:00:00','2012-03-19 20:55:08','2012-03-19 20:55:08'),(1133,'17908903','3/27/2012','2:00 pm','3/27/2012',NULL,'Sayee Anakk, PhD., Baylor College of Medicine at Houston, TX - Title - \"Bile Acid Signaling: Beyond Digestion\"',NULL,'B102 CLSL','Department of MIP','Penny Morman','morman@illinois.edu','217-333-8275','Seminar','Molecular and Integrative Physiology (MIP) Department Seminar Series','2012-03-27 19:00:00','2012-03-27 05:00:00','2012-03-21 19:20:08','2012-03-21 19:20:08'),(1135,'16575241','3/30/2012','12:00 pm','3/30/2012','1:00 pm','Biochemistry Seminar:  Dr. J. Fernando Bazan, NeuroScience (CSO), formerly Genentech (Sr. Scientist), \"Cytokine receptor complexes, from the first to (nearly) the last - evolution, structures and mechanisms\"','http://publicationslist.org/jfbazan','B102 CLSL','Dr. David Kranz','Cara L. Day','caraday@illinois.edu','217.333.2013','Seminar','Biochemistry Department Seminars','2012-03-30 17:00:00','2012-03-30 18:00:00','2012-03-22 14:35:08','2012-03-22 14:35:08'),(1136,'7935384','3/28/2012','4:00 pm','3/28/2012',NULL,'Shyamal Subramanyan (Maria Spies Lab) - \'Keeping RAD51in Check\'',NULL,'116 RAL','Biochemistry',NULL,NULL,NULL,'Seminar','Biochemistry Department Graduate Seminars','2012-03-28 21:00:00','2012-03-28 05:00:00','2012-03-23 15:00:09','2012-03-23 15:00:09'),(1138,'7935380','3/28/2012','4:00 pm','3/28/2012',NULL,'Rujani Murali (Gennis Lab) - \"Cytochrome bd-type oxygen reductases\"',NULL,'116 RAL','Biochemistry',NULL,NULL,NULL,'Seminar','Biochemistry Department Graduate Seminars','2012-03-28 21:00:00','2012-03-28 05:00:00','2012-03-23 15:45:08','2012-03-23 15:45:08'),(1140,'7935372','5/2/2012','4:00 pm','5/2/2012',NULL,'Emilia Calvaresi - Carter Fellow - (Hergenrother Lab) - \"Targeting Cancer\'s Sweet Tooth \' Development of Novel Anti-Glycolytic  Therapeutics to Exploit the Warburg Effect.\"',NULL,'116 RAL','Biochemistry',NULL,NULL,NULL,'Seminar','Biochemistry Department Graduate Seminars','2012-05-02 21:00:00','2012-05-02 05:00:00','2012-03-23 19:35:08','2012-03-23 19:35:08'),(1143,'18160828','3/29/2012','12:00 pm','3/29/2012',NULL,'Kush Paul, PhD, Dept. of MIP, UIUC - \"Disruption of dopamine mediated inhibitory response in Fragile X mice\" and Zachary Smith (Kim Kemper Lab) - \"Regulation of Hepatic Autophagy by FXR\"',NULL,'B102 CLSL','Dept. of MIP Graduate Students','Penny Morman','morman@illinois.edu','217-333-8275','Seminar','Molecular and Integrative Physiology (MIP) Department Seminar Series','2012-03-29 17:00:00','2012-03-29 05:00:00','2012-03-27 13:50:07','2012-03-27 13:50:07'),(1144,'18160947','4/5/2012','12:00 pm','4/5/2012',NULL,'Jing Yang, PhD., Associate Professor, Department of Comparative Biosciences, College of Vet. Med., - \"Regulation of early embryonic development by B56 epsilon, a regulatory subunit of PP2A\"','http://illinois.edu/ds/search?search=jing+yang&search_type=all&skinId=&cx=&cof=&t=1&q=jing+yang','B102 CLSL','Dept. of MIP - Dr. Milan Bagchi','Penny Morman','morman@illinois.edu','217-333-8275','Seminar','Molecular and Integrative Physiology (MIP) Department Seminar Series','2012-04-05 17:00:00','2012-04-05 05:00:00','2012-03-27 14:00:08','2012-03-27 14:00:08'),(1147,'6876233','4/18/2012','12:00 pm','4/18/2012',NULL,'Cell &  Developmental Biology Seminar:    Dr. Andrew Dillin, Salk Institute for Biological Studies, \"Humoral control of proteostasis\"',NULL,'B102 CLSL','Cell & Developmental Biology','Elaine Rodgers, Fei Wang','erodgers@life.illinois.edu','217-265-5511','Seminar','Cell and Developmental Biology (CDB) Departmental Seminars','2012-04-18 17:00:00','2012-04-18 05:00:00','2012-03-29 17:15:08','2012-03-29 17:15:08'),(1148,'4944254','5/2/2012','12:00 pm','5/2/2012',NULL,'Cell &  Developmental Biology Seminar:   Dr. Wei Guo, University of Pennsylvania, Department of Biology,  \"Molecular Basis of Polarized Exocytosis and Cell Migration\"',NULL,'B102 CLSL','Cell & Developmental Biology','Elaine Rodgers, Lisa Stubbs','erodgers@life.illinois.edu','217-265-5511','Seminar','Cell and Developmental Biology (CDB) Departmental Seminars','2012-05-02 17:00:00','2012-05-02 05:00:00','2012-04-02 14:40:08','2012-04-02 14:40:08'),(1149,'7935376','4/18/2012','4:00 pm','4/18/2012',NULL,'Daniel Wichelecki (Gerlt Lab) - \"Functional Discovery in the Enolase Superfamily: The Mannonate Dehydratase Subgroup\"',NULL,'116 RAL','Biochemistry',NULL,NULL,NULL,'Seminar','Biochemistry Department Graduate Seminars','2012-04-18 21:00:00','2012-04-18 05:00:00','2012-04-02 16:10:08','2012-04-02 16:10:08'),(1150,'7935382','4/11/2012','4:00 pm','4/11/2012',NULL,'Sheena Smith - Herbert E. Carter Fellow - (Kranz Lab) - \"Engineering and characterization of human single-chain T-cell receptors.\"',NULL,'116 RAL','Biochermistry',NULL,NULL,NULL,'Seminar','Biochemistry Department Graduate Seminars','2012-04-11 21:00:00','2012-04-11 05:00:00','2012-04-02 16:15:08','2012-04-02 16:15:08'),(1153,'7935383','4/11/2012','4:00 pm','4/11/2012',NULL,'Adrienne Barry (Leckband Lab) - \"Regulation of Cell-Cell Interactions: Adhesion, Signaling, and Mechanics\"',NULL,'116 RAL','Biochemistry',NULL,NULL,NULL,'Seminar','Biochemistry Department Graduate Seminars','2012-04-11 21:00:00','2012-04-11 05:00:00','2012-04-04 13:45:07','2012-04-04 13:45:07'),(1154,'4944251','4/25/2012','12:00 pm','4/25/2012',NULL,'Cell &  Developmental Biology Seminar:   Dr. Nicholas Dyson, Harvard University, Department of Medicine,  \"Control of cell proliferation by pRB and E2F proteins\"',NULL,'B102 CLSL','Cell & Developmental Biology','Elaine Rodgers, Lisa Stubbs','erodgers@life.illinois.edu','217-265-5511','Seminar','Cell and Developmental Biology (CDB) Departmental Seminars','2012-04-25 17:00:00','2012-04-25 05:00:00','2012-04-04 16:45:08','2012-04-04 16:45:08'),(1155,'18531263','4/12/2012','12:00 pm','4/12/2012',NULL,'Kenneth S. Korach, PhD, Chief, Laboratory of Reproductive and Developmental Toxicology, NIEHS/NIH-\"Biological Models for Dissecting the Functional Roles of the Estrogen Receptor\"','http://www.niehs.nih.gov/research/atniehs/labs/lrdt/receptor/index.cfm','B102 CLSL','MIP Graduate Student Seminar','Penny s. Morman','morman@illinois.edu','217-333-8275','Seminar','Molecular and Integrative Physiology (MIP) Department Seminar Series','2012-04-12 17:00:00','2012-04-12 05:00:00','2012-04-04 17:05:08','2012-04-04 17:05:08'),(1156,'18531264','4/19/2012','12:00 pm','4/19/2012',NULL,'Klaus Beyenbach, PhD, Department of Biomedical Sciences, Cornell University-\"Inducing Kidney Failure in Specifically Mosquitoes\"','http://www.vet.cornell.edu/biosci/faculty/beyenbach/','B102 CLSL','Departments of Molecular & Integrative Physiology and Comparative Biosciences, College of Veterinary Medicine','Penny S. Morman','morman@illinois.edu','217-333-8275','Seminar','Molecular and Integrative Physiology (MIP) Department Seminar Series','2012-04-19 17:00:00','2012-04-19 05:00:00','2012-04-04 17:10:08','2012-04-04 17:10:08'),(1158,'13263749','4/26/2012','4:00 pm','4/26/2012',NULL,'Microbiology Seminar:  Dr. Kenneth Nealson, \"The Global Ocean Study:  A metageomic look at the surface picoplankton\"',NULL,'B102 Chemical & Life Sciences Laboratory, 601 S. Goodwin Ave., Urbana','Dr. Bruce Fouke, Associate Professor in Geology/Microbiology Affilliate','Diane Tsevelekos','microsem@illinois.edu','333-1736','Seminar','Microbiology Department','2012-04-26 21:00:00','2012-04-26 05:00:00','2012-04-04 19:10:08','2012-04-04 19:10:08'),(1160,'13758308','4/13/2012','12:00 pm','4/13/2012','1:00 pm','Biochemistry Seminar:  Dr. Eduardo Perozo, University of Chicago, Chicago,  IL; \"Gating transitions at the K+ channel selectivity filter\"','http://bmb.bsd.uchicago.edu/Faculty_and_Research/01_Faculty/01_Faculty_Alphabetically.php?faculty_id=224','B102 CLSL','Dr. Emad Tajkhorshid','Cara L. Day','caraday@illinois.edu','217.333.2013','Seminar','Biochemistry Department Seminars','2012-04-13 17:00:00','2012-04-13 18:00:00','2012-04-05 13:45:09','2012-04-05 13:45:09'),(1161,'7935377','4/18/2012','4:00 pm','4/18/2012',NULL,'Irisbel Guzman Sanchez (Gruebele Lab) - \"Multistep Kinetics of the U1A\'SL2 RNA Complex Dissociation\"',NULL,'116 RAL','Biochemistry',NULL,NULL,NULL,'Seminar','Biochemistry Department Graduate Seminars','2012-04-18 21:00:00','2012-04-18 05:00:00','2012-04-09 14:05:08','2012-04-09 14:05:08'),(1162,'18536857','4/19/2012','2:00 pm','4/19/2012',NULL,'Microbiology Seminar:  Dr. Max Dow \"Cyclic di-GMP as a sceond messenger linking cell-cell signaling to virulence in the phytopathogen Xanthomonas campestris\"',NULL,'B102 Chemical & Life Sciences Laboratory, 601 S. Goodwin Ave., Urbana','Dr. Stephan Farrand, Professor','Diane Tsevelekos','microsem@illinois.edu','333-1736','Seminar','Microbiology Department','2012-04-19 19:00:00','2012-04-19 05:00:00','2012-04-09 14:50:08','2012-04-09 14:50:08'),(1163,'7805961','4/25/2012','4:00 pm','4/25/2012',NULL,'Seyed Torabi (Lu Lab) - \"In vitro Selection and Application of Functional DNAs\"',NULL,'116 RAL','Biochemistry',NULL,NULL,NULL,'Seminar','Biochemistry Department Graduate Seminars','2012-04-25 21:00:00','2012-04-25 05:00:00','2012-04-10 14:15:08','2012-04-10 14:15:08'),(1164,'7742566','4/19/2012','4:00 pm','4/19/2012','5:00 pm','Ada Doisy Lectures in BIOCHEMISTRY: Dr. Joanne Chory, Salk Institute, La Jolla, CA; \"Steroid hormone signaling in plants:  A new paradigm\"','http://www.salk.edu/faculty/chory.html','MSB Auditorium','Dr. Susan Martinis','Cara Day','caraday@illinois.edu','217.333.2013','Seminar','Biochemistry Department Seminars','2012-04-19 21:00:00','2012-04-19 22:00:00','2012-04-10 18:45:08','2012-04-10 18:45:08'),(1165,'7742567','4/20/2012','12:00 pm','4/20/2012','1:00 pm','Ada Doisy Lectures in BIOCHEMISTRY: Dr. Roger N. Beachy, Donald Danforth Plant Science Center, St. Louis, MO; \"Science and Translational Biology in Food and Agriculture and Policies that Set the Agenda\"','http://www.danforthcenter.org/science/laboratories/roger_beachy/','MSB Auditorium','Dr. Susan Martinis','Cara Day','caraday@illinois.edu','217.333.2013','Seminar','Biochemistry Department Seminars','2012-04-20 17:00:00','2012-04-20 18:00:00','2012-04-10 18:45:08','2012-04-10 18:45:08'),(1167,'13758311','5/4/2012','12:00 pm','5/4/2012','1:00 pm','Biochemistry Seminar: Dr. Ella Chan, Oregon Health & Science University, \"2010 Anne A. Johnson Work Award Seminar: Adaptor-mediated proteolytic control during the bacterial oxidative stress response\"',NULL,'B102 CLSL','Dr. Raven H. Huang','Cara L. Day','caraday@illinois.edu','217.333.2013','Seminar','Biochemistry Department Seminars','2012-05-04 17:00:00','2012-05-04 18:00:00','2012-04-10 18:55:08','2012-04-10 18:55:08'),(1170,'7935381','4/25/2012','4:00 pm','4/25/2012',NULL,'Preeti Sharma (Kranz Lab) - \"Engineering a soluble form of the receptor for Staphylococcal enterotoxin A (SEA)\"',NULL,'116 RAL','Biochemistry',NULL,NULL,NULL,'Seminar','Biochemistry Department Graduate Seminars','2012-04-25 21:00:00','2012-04-25 05:00:00','2012-04-13 13:50:08','2012-04-13 13:50:08'),(1318,'18478148','9/14/2012','12:00 pm','9/14/2012','1:00 pm','Biochemistry Seminar: Dr. Victor Munoz, Spain National Research Council (CSIC) Professor, University of Maryland Adjunct Professor, \"The Downhill Folding Scenario: Resolving Protein Folding Motions and Landscapes with Nanosecond, Single-Molecule, and Atomic Resolutions\"','http://www.chem.umd.edu/directory/facultydirectory/victormuoz','B102 CLSL','Dr. Martin Gruebele','Cara L. Day','caraday@illinois.edu','217.333.2013','Seminar','Biochemistry Department Seminars','2012-09-14 17:00:00','2012-09-14 18:00:00','2012-04-17 01:42:48','2012-04-17 01:42:48'),(1321,'19198691','5/14/2012','12:00 pm','5/14/2012',NULL,'MCB Director\'s Distinguished Seminar: \"Synapses with minds of their own,\" by Michael Friedlander',NULL,'B102 CLSL','School of MCB',NULL,NULL,NULL,NULL,'MCB Events','2012-05-14 17:00:00','2012-05-14 05:00:00','2012-04-19 17:35:08','2012-04-19 17:35:08'),(1322,'16120495','4/27/2012','12:00 pm','4/27/2012','1:00 pm','Biochemistry Seminar: Dr. Michael T. Green, Penn State University, \"Understanding C-H bond activation in heme proteins: the role of thiolate ligation in cytochrome P450\"','http://research.chem.psu.edu/mtggroup/Home.html','B102 CLSL','Dr. Yi Lu','Cara L. Day','caraday@illinois.edu','217.333.2013','Seminar','Biochemistry Department Seminars','2012-04-27 17:00:00','2012-04-27 18:00:00','2012-04-20 19:15:08','2012-04-20 19:15:08'),(1343,'4946976','5/2/2012',NULL,'5/2/2012',NULL,'Instruction Ends for Spring Semester',NULL,NULL,'Faculty Senate',NULL,NULL,NULL,'Academic','Academic Dates','2012-05-02 05:00:00','2012-05-02 05:00:00','2012-04-24 20:10:08','2012-04-24 20:10:08'),(1344,'4946977','5/3/2012',NULL,'5/3/2012',NULL,'Reading Day',NULL,NULL,'Faculty Senate',NULL,NULL,NULL,'Academic','Academic Dates','2012-05-03 05:00:00','2012-05-03 05:00:00','2012-04-24 20:10:08','2012-04-24 20:10:08'),(1345,'4946978','5/4/2012',NULL,'5/4/2012',NULL,'Final Exams Begin',NULL,NULL,'Faculty Senate',NULL,NULL,NULL,'Academic','Academic Dates','2012-05-04 05:00:00','2012-05-04 05:00:00','2012-04-24 20:10:08','2012-04-24 20:10:08'),(1346,'15689566','5/14/2012','8:30 am','5/14/2012',NULL,'Instruction Begins, Summer Session 1',NULL,NULL,'U-C Senate',NULL,NULL,NULL,'Academic','Academic Dates','2012-05-14 13:30:00','2012-05-14 05:00:00','2012-04-24 20:10:08','2012-04-24 20:10:08'),(1347,'3697506','5/28/2012',NULL,'5/28/2012',NULL,'Memorial Day',NULL,NULL,'University of Illinois Board of Trustees',NULL,NULL,NULL,'Academic','Holidays','2012-05-28 05:00:00','2012-05-28 05:00:00','2012-04-24 20:10:08','2012-04-24 20:10:08'),(1348,'15689568','6/9/2012',NULL,'6/9/2012',NULL,'End of Summer Session 1',NULL,NULL,'U-C Senate',NULL,NULL,NULL,'Academic','Academic Dates','2012-06-09 05:00:00','2012-06-09 05:00:00','2012-04-24 20:10:08','2012-04-24 20:10:08'),(1350,'11892807','7/4/2012',NULL,'7/4/2012',NULL,'Independence Day Holiday',NULL,NULL,'University of Illinois Board of Trustees',NULL,NULL,NULL,'Holiday','Holidays','2012-07-04 05:00:00','2012-07-04 05:00:00','2012-04-24 20:10:09','2012-04-24 20:10:09'),(1351,'18442995','8/4/2012',NULL,'8/4/2012',NULL,'End of Summer Session 2',NULL,NULL,'U-C Senate',NULL,NULL,NULL,'Academic','Academic Dates','2012-08-04 05:00:00','2012-08-04 05:00:00','2012-04-24 20:10:09','2012-04-24 20:10:09'),(1353,'15689573','9/3/2012',NULL,'9/3/2012',NULL,'Labor Day',NULL,NULL,'Laborers',NULL,NULL,NULL,'Academic','Academic Dates','2012-09-03 05:00:00','2012-09-03 05:00:00','2012-04-24 20:10:09','2012-04-24 20:10:09'),(1354,'11892810','9/3/2012',NULL,'9/3/2012',NULL,'Labor Day',NULL,NULL,'University of Illinois Board of Trustees',NULL,NULL,NULL,'Holiday','Holidays','2012-09-03 05:00:00','2012-09-03 05:00:00','2012-04-24 20:10:09','2012-04-24 20:10:09'),(1355,'15689575','11/17/2012',NULL,'11/17/2012',NULL,'Thanksgiving Break Begins',NULL,NULL,'U-C Senate',NULL,NULL,NULL,'Academic','Academic Dates','2012-11-17 06:00:00','2012-11-17 06:00:00','2012-04-24 20:10:09','2012-04-24 20:10:09'),(1356,'11892813','11/22/2012',NULL,'11/22/2012',NULL,'Thanksgiving Day',NULL,NULL,'University of Illinois Board of Trustees',NULL,NULL,NULL,'Holiday','Holidays','2012-11-22 06:00:00','2012-11-22 06:00:00','2012-04-24 20:10:09','2012-04-24 20:10:09'),(1357,'11892815','11/23/2012',NULL,'11/23/2012',NULL,'Day After Thanksgiving - Designated Holiday',NULL,NULL,'University of Illinois Board of Trustees',NULL,NULL,NULL,'Special Event','Holidays','2012-11-23 06:00:00','2012-11-23 06:00:00','2012-04-24 20:10:09','2012-04-24 20:10:09'),(1358,'15689576','11/26/2012',NULL,'11/26/2012',NULL,'Instruction resumes',NULL,NULL,'U-C Senate',NULL,NULL,NULL,'Academic','Academic Dates','2012-11-26 06:00:00','2012-11-26 06:00:00','2012-04-24 20:10:09','2012-04-24 20:10:09'),(1360,'15689581','12/14/2012',NULL,'12/14/2012',NULL,'Final Exams Begin',NULL,NULL,'U-C Senate',NULL,NULL,NULL,'Academic','Academic Dates','2012-12-14 06:00:00','2012-12-14 06:00:00','2012-04-24 20:10:09','2012-04-24 20:10:09'),(1362,'15689583','1/21/2013',NULL,'1/21/2013',NULL,'M.L.King Holiday',NULL,NULL,'University of Illinois Board of Trustees',NULL,NULL,NULL,'Academic','Academic Dates','2013-01-21 06:00:00','2013-01-21 06:00:00','2012-04-24 20:10:10','2012-04-24 20:10:10'),(1363,'3697505','1/21/2013',NULL,'1/21/2013',NULL,'Martin Luther King Jr. Day - Designated Holiday',NULL,NULL,'University of Illinois Board of Trustees',NULL,NULL,NULL,'Academic','Holidays','2013-01-21 06:00:00','2013-01-21 06:00:00','2012-04-24 20:10:10','2012-04-24 20:10:10'),(1364,'15689584','3/16/2013','1:00 pm','3/16/2013',NULL,'Spring Vacation Begins',NULL,NULL,'U-C Senate',NULL,NULL,NULL,'Academic','Academic Dates','2013-03-16 18:00:00','2013-03-16 05:00:00','2012-04-24 20:10:10','2012-04-24 20:10:10'),(1365,'15689586','3/25/2013','7:00 am','3/25/2013',NULL,'Instruction resumes',NULL,NULL,'U-C Senate',NULL,NULL,NULL,'Academic','Academic Dates','2013-03-25 12:00:00','2013-03-25 05:00:00','2012-04-24 20:10:10','2012-04-24 20:10:10'),(1371,'15689569','6/11/2012',NULL,'6/11/2012',NULL,'First Day of Instruction, Summer Term 2',NULL,NULL,'U-C Senate',NULL,NULL,NULL,'Academic','Academic Dates','2012-06-11 05:00:00','2012-06-11 05:00:00','2012-05-29 13:20:08','2012-05-29 13:20:08'),(1372,'15689572','8/27/2012',NULL,'8/27/2012',NULL,'First Day of Instruction, Fall Semester',NULL,NULL,'U-C Senate',NULL,NULL,NULL,'Academic','Academic Dates','2012-08-27 05:00:00','2012-08-27 05:00:00','2012-05-29 13:25:08','2012-05-29 13:25:08'),(1373,'20358097','6/5/2012','12:00 pm','6/5/2012',NULL,'Cell &  Developmental Biology Seminar:   Dr. Brigitte Gailliot, University of Geneva, Switzerland,  \"Hydra, a model system for stem cells, regeneration and aging studies\"',NULL,'B102 CLSL','Cell & Developmental Biology','Elaine Rodgers; Lisa Stubbs','erodgers@life.illinois.edu','217-265-5511','Seminar','Cell and Developmental Biology (CDB) Departmental Seminars','2012-06-05 17:00:00','2012-06-05 05:00:00','2012-05-29 15:30:08','2012-05-29 15:30:08'),(1380,'21350880','12/24/2012',NULL,'12/24/2012',NULL,'December 24',NULL,NULL,'Office of the Chancellor',NULL,NULL,NULL,'Holiday','Holidays','2012-12-24 06:00:00','2012-12-24 06:00:00','2012-06-06 21:45:08','2012-06-06 21:45:08'),(1381,'21350881','12/25/2012',NULL,'12/25/2012',NULL,'Christmas Day Holiday',NULL,NULL,'U-C Senate',NULL,NULL,NULL,'Holiday','Holidays','2012-12-25 06:00:00','2012-12-25 06:00:00','2012-06-06 21:45:08','2012-06-06 21:45:08'),(1382,'21350882','12/26/2012',NULL,'12/26/2012',NULL,'Day after Christmas - Designated Holiday',NULL,NULL,'U-C Senate',NULL,NULL,NULL,'Holiday','Holidays','2012-12-26 06:00:00','2012-12-26 06:00:00','2012-06-06 21:45:08','2012-06-06 21:45:08'),(1383,'21350883','12/27/2012',NULL,'12/27/2012',NULL,'Reduced Service Day*',NULL,NULL,'U-C Senate',NULL,NULL,NULL,'Holiday','Holidays','2012-12-27 06:00:00','2012-12-27 06:00:00','2012-06-06 21:45:08','2012-06-06 21:45:08'),(1384,'21350884','12/28/2012',NULL,'12/28/2012',NULL,'Reduced Service Day*',NULL,NULL,'U-C Senate',NULL,NULL,NULL,'Holiday','Holidays','2012-12-28 06:00:00','2012-12-28 06:00:00','2012-06-06 21:50:08','2012-06-06 21:50:08'),(1385,'21350885','12/31/2012',NULL,'12/31/2012',NULL,'Reduced Service Day*',NULL,NULL,'U-C Senate',NULL,NULL,NULL,'Holiday','Holidays','2012-12-31 06:00:00','2012-12-31 06:00:00','2012-06-06 21:50:08','2012-06-06 21:50:08'),(1398,'21558117','10/8/2012','12:00 pm','10/8/2012','1:00 pm','CDB Student & Postdoc Seminar, Stephanie Tsang & Dr. Jim Collins',NULL,'B102 CLSL','Cell & Developmental Biology Department','Shannon Croft','shannon9@life.illinois.edu','(217) 333-6118','Lecture','Cell and Developmental Biology (CDB) Student & Postdoc Seminars','2012-10-08 17:00:00','2012-10-08 18:00:00','2012-06-12 19:49:29','2012-06-12 19:49:29'),(1399,'21558106','10/15/2012','12:00 pm','10/15/2012','1:00 pm','CDB Student & Postdoc Seminar, Jason Wever & Dr. Vidisha Tripathi',NULL,'B102 CLSL','Cell & Developmental Biology Department','Shannon Croft','shannon9@life.illinois.edu','(217) 333-6118','Lecture','Cell and Developmental Biology (CDB) Student & Postdoc Seminars','2012-10-15 17:00:00','2012-10-15 18:00:00','2012-06-12 19:49:29','2012-06-12 19:49:29'),(1404,'21566491','11/19/2012','12:00 pm','11/19/2012','1:00 pm','No Seminar',NULL,'B102 CLSL','Cell & Developmental Biology Department','Shannon Croft','shannon9@life.illinois.edu','(217) 333-6118','Lecture','Cell and Developmental Biology (CDB) Student & Postdoc Seminars','2012-11-19 18:00:00','2012-11-19 19:00:00','2012-06-12 19:49:29','2012-06-12 19:49:29'),(1409,'21563683','12/24/2012','12:00 pm','12/24/2012','1:00 pm','No Seminar',NULL,'B102 CLSL','Cell & Developmental Biology Department','Shannon Croft','shannon9@life.illinois.edu','(217) 333-6118','Lecture','Cell and Developmental Biology (CDB) Student & Postdoc Seminars','2012-12-24 18:00:00','2012-12-24 19:00:00','2012-06-12 19:49:30','2012-06-12 19:49:30'),(1410,'21566492','12/31/2012','12:00 pm','12/31/2012','1:00 pm','No Seminar',NULL,'B102 CLSL','Cell & Developmental Biology Department','Shannon Croft','shannon9@life.illinois.edu','(217) 333-6118','Lecture','Cell and Developmental Biology (CDB) Student & Postdoc Seminars','2012-12-31 18:00:00','2012-12-31 19:00:00','2012-06-12 19:49:30','2012-06-12 19:49:30'),(1411,'21566493','1/7/2013','12:00 pm','1/7/2013','1:00 pm','No Seminar',NULL,'B102 CLSL','Cell & Developmental Biology Department','Shannon Croft','shannon9@life.illinois.edu','(217) 333-6118','Lecture','Cell and Developmental Biology (CDB) Student & Postdoc Seminars','2013-01-07 18:00:00','2013-01-07 19:00:00','2012-06-12 19:49:30','2012-06-12 19:49:30'),(1412,'21566494','1/14/2013','12:00 pm','1/14/2013','1:00 pm','No Seminar',NULL,'B102 CLSL','Cell & Developmental Biology Department','Shannon Croft','shannon9@life.illinois.edu','(217) 333-6118','Lecture','Cell and Developmental Biology (CDB) Student & Postdoc Seminars','2013-01-14 18:00:00','2013-01-14 19:00:00','2012-06-12 19:49:30','2012-06-12 19:49:30'),(1413,'21566495','1/21/2013','12:00 pm','1/21/2013','1:00 pm','No Seminar',NULL,'B102 CLSL','Cell & Developmental Biology Department','Shannon Croft','shannon9@life.illinois.edu','(217) 333-6118','Lecture','Cell and Developmental Biology (CDB) Student & Postdoc Seminars','2013-01-21 18:00:00','2013-01-21 19:00:00','2012-06-12 19:49:30','2012-06-12 19:49:30'),(1421,'21566486','3/18/2013','12:00 pm','3/18/2013','1:00 pm','No Seminar',NULL,'B102 CLSL','Cell & Developmental Biology Department','Shannon Croft','shannon9@life.illinois.edu','(217) 333-6118','Lecture','Cell and Developmental Biology (CDB) Student & Postdoc Seminars','2013-03-18 17:00:00','2013-03-18 18:00:00','2012-06-12 19:49:30','2012-06-12 19:49:30'),(1444,'21558100','9/24/2012','12:00 pm','9/24/2012','1:00 pm','CDB Student & Postdoc Seminar, Lisa Moore & Dr. David Forsthoefel',NULL,'B102 CLSL','Cell & Developmental Biology Department','Shannon Croft','shannon9@life.illinois.edu','(217) 333-6118','Lecture','Cell and Developmental Biology (CDB) Student & Postdoc Seminars','2012-09-24 17:00:00','2012-09-24 18:00:00','2012-06-18 15:00:09','2012-06-18 15:00:09'),(1465,'21558116','10/29/2012','12:00 pm','10/29/2012','1:00 pm','CDB Student & Postdoc Seminar, Christopher Bolt & Dr. Ryan King',NULL,'B102 CLSL','Cell & Developmental Biology Department','Shannon Croft','shannon9@life.illinois.edu','(217) 333-6118','Lecture','Cell and Developmental Biology (CDB) Student & Postdoc Seminars','2012-10-29 17:00:00','2012-10-29 18:00:00','2012-06-18 18:10:08','2012-06-18 18:10:08'),(1467,'21558119','11/12/2012','12:00 pm','11/12/2012','1:00 pm','CDB Student & Postdoc Seminar, Frank Echtenkamp & Dr. Arindam Chakraborty',NULL,'B102 CLSL','Cell & Developmental Biology Department','Shannon Croft','shannon9@life.illinois.edu','(217) 333-6118','Lecture','Cell and Developmental Biology (CDB) Student & Postdoc Seminars','2012-11-12 18:00:00','2012-11-12 19:00:00','2012-06-18 18:10:09','2012-06-18 18:10:09'),(1489,'22533947','1/1/2013',NULL,'1/1/2013',NULL,'New Year\'s Day',NULL,NULL,'University of Illinois Board of Trustees',NULL,NULL,NULL,'Holiday','Holidays','2013-01-01 06:00:00','2013-01-01 06:00:00','2012-07-03 19:10:08','2012-07-03 19:10:08'),(1499,'23407380','9/6/2012','4:00 pm','9/6/2012',NULL,'Microbiology Seminar:  Dr. Stephen Bell, \"DNA replication and cell division in Sulfolobus species\"',NULL,'B102 Chemical & Life Sciences Laboratory, 601 S. Goodwin Ave., Urbana','Dr. Rachel Whitaker, Assistant Professor of Microbiology','Diane Tsevelekos','microsem@illinois.edu','333-1736','Seminar','Microbiology Department','2012-09-06 21:00:00','2012-09-06 05:00:00','2012-07-23 18:35:08','2012-07-23 18:35:08'),(1501,'23407439','9/20/2012','4:00 pm','9/20/2012',NULL,'Microbiology Seminar:  Dr. Eric Skaar, \"The Battle for Metal Between Bacterial Pathogens and their Hosts\"',NULL,'B102 Chemical & Life Sciences Laboratory, 601 S. Goodwin Ave., Urbana','Dr. James Slauch, Professor of Microbiology','Diane Tsevelekos','microsem@illinois.edu','333-1736','Seminar','Microbiology Department','2012-09-20 21:00:00','2012-09-20 05:00:00','2012-07-23 19:00:09','2012-07-23 19:00:09'),(1505,'23407575','10/18/2012','4:00 pm','10/18/2012',NULL,'Microbiology Seminar:  Dr. Helene Marquis, \"Regulated transport of virulence factors across the cell wall of Listeria\"',NULL,'B102 Chemical & Life Sciences Laboratory, 601 S. Goodwin Ave., Urbana','Dr. Brenda Wilson, Professor of Microbiology','Diane Tsevelekos','microsem@illinois.edu','333-1736','Seminar','Microbiology Department','2012-10-18 21:00:00','2012-10-18 05:00:00','2012-07-23 22:00:09','2012-07-23 22:00:09'),(1514,'23407573','10/4/2012','4:00 pm','10/4/2012',NULL,'Microbiology Seminar:  Dr. Aaron Mitchell, \"Candida gene regulation during infection\"',NULL,'B102 Chemical & Life Sciences Laboratory, 601 S. Goodwin Ave., Urbana','Dr. Peter Orlean, Professor of Microbiology','Diane Tsevelekos','microsem@illinois.edu','333-1736','Seminar','Microbiology Department','2012-10-04 21:00:00','2012-10-04 05:00:00','2012-07-31 14:10:08','2012-07-31 14:10:08'),(1557,'15368681','9/7/2012','1:15 pm','9/7/2012','5:00 pm','8th Annual CBI-TP Symposium, Prof. Alice Ting, (MIT) \"Enzyme-based reporters for electron microscopy and proteomic mapping of living cells\" & CBI Trainees, Michael Brothers, Steven Caliari, Ryan Cobb, Patrick Knerr, Sheena Smith',NULL,'B102 Chemical & LIfe Sciences Lab','Chemistry-Biology Interface Training Program and the Department of Chemistry','Nan Holda','holda@illinois.edu','244-5450','Symposium','Training Program at the Chemistry Biology Interface - Seminars','2012-09-07 18:15:00','2012-09-07 22:00:00','2012-08-03 21:30:09','2012-08-03 21:30:09'),(1558,'23401854','8/29/2012','4:00 pm','8/29/2012','5:00 pm','Biochemistry Seminar: Dr. Jacques Beckmann, UNIL \"Mirror phenotypes associated with gene dosage at the 16p11.2 locus: the quest for the gene(s)\"','http://www.unil.ch/dgm/page18809_en.html','B102 CLSL','Dr. Susan Martinis','Cara L. Day','caraday@illinois.edu','217.333.2013','Seminar','Biochemistry Department Seminars','2012-08-29 21:00:00','2012-08-29 22:00:00','2012-08-03 22:00:09','2012-08-03 22:00:09'),(1559,'23407440','9/27/2012','4:00 pm','9/27/2012',NULL,'Microbiology Seminar:  Dr. Jorge Escalante, \"Impact of Lysine Acylation on Bacterial Cell Physiology\"',NULL,'B102 Chemical & Life Sciences Laboratory, 601 S. Goodwin Ave., Urbana','Dr. James Imlay, Professor of Microbiology','Diane Tsevelekos','microsem@illinois.edu','333-1736','Seminar','Microbiology Department','2012-09-27 21:00:00','2012-09-27 05:00:00','2012-08-06 15:00:09','2012-08-06 15:00:09'),(1560,'23407379','8/30/2012','4:00 pm','8/30/2012',NULL,'Microbiology Seminar:  Dr. Sherwood Casjens, \"The interchangeable parts of dsDNA bacteriophages:  their roles in DNA packaging and delivery\"',NULL,'B102 Chemical & Life Sciences Laboratory, 601 S. Goodwin Ave., Urbana','Dr. Douglas Mitchell, Assistant Professor of Chemistry; Affiliate of Microbiology','Diane Tsevelekos','microsem@illinois.edu','333-1736','Seminar','Microbiology Department','2012-08-30 21:00:00','2012-08-30 05:00:00','2012-08-06 19:00:09','2012-08-06 19:00:09'),(1569,'23806929','11/1/2012','12:00 pm','11/1/2012',NULL,'Douglas L. Oliver, PhD, University of Connecticut Health Center - \"Synaptic Organizaion and Parallel Pathways in the Auditory Midbrain\"','http://facultydirectory.uchc.edu/profile?profileId=2917#tabs-4','B102 CLSL','Dept. of MIP',NULL,NULL,'217-333-1735','Seminar','Molecular and Integrative Physiology (MIP) Department Seminar Series','2012-11-01 17:00:00','2012-11-01 05:00:00','2012-08-08 15:40:09','2012-08-08 15:40:09'),(1571,'23806930','11/8/2012','12:00 pm','11/8/2012',NULL,'Cheng-Ming Chiang, PhD, UT Southwestern Medical Center at Dallas, TX - \"Epigenetic Control of Chromatin-Dependent Transcription: Lessons from p53, AP-1, Brd4, and HPV','http://www.utsouthwestern.edu/fis/faculty/95126/cheng-ming-chiang.html','B102 CLSL','Dept. of MIP-J. Kim Kemper',NULL,NULL,'217-333-1735','Seminar','Molecular and Integrative Physiology (MIP) Department Seminar Series','2012-11-08 18:00:00','2012-11-08 06:00:00','2012-08-08 18:30:08','2012-08-08 18:30:08'),(1572,'21653047','9/7/2012','12:00 pm','9/7/2012','1:00 pm','Biochemistry Seminar: Dr. Frances M. Brodsky, University of California, San Francisco  \"Diversity of Clathrin Function in Migration, Mitosis and Metabolism\"','http://cancer.ucsf.edu/people/brodsky_frances.php','B102 CLSL','Dr. David Kranz','Cara L. Day','caraday@illinois.edu','217.333.2013','Seminar','Biochemistry Department Seminars','2012-09-07 17:00:00','2012-09-07 18:00:00','2012-08-10 19:35:09','2012-08-10 19:35:09'),(1573,'20976133','9/26/2012','12:00 pm','9/26/2012',NULL,'Cell &  Developmental Biology Seminar:   Dr. Blanche Capel, Duke University, \"The Battle of the Sexes: A Transcriptional Network Underlying Mammalian Sex Determination\"',NULL,'B102 CLSL','Cell & Developmental Biology','Elaine Rodgers; Lisa Stubbs','erodgers@life.illinois.edu','217-265-5511','Seminar','Cell and Developmental Biology (CDB) Departmental Seminars','2012-09-26 17:00:00','2012-09-26 05:00:00','2012-08-14 14:30:08','2012-08-14 14:30:08'),(1574,'21863807','9/19/2012','12:00 pm','9/19/2012',NULL,'Cell &  Developmental Biology Seminar:   Dr. Matthew Harris, Children\'s Hospital, Boston, MA, \"Monsters from the shallows: post-embryonic development and evolutionary change\"',NULL,'B102 CLSL','Cell & Developmental Biology','Elaine Rodgers; Lisa Stubbs','erodgers@life.illinois.edu','217-265-5511','Seminar','Cell and Developmental Biology (CDB) Departmental Seminars','2012-09-19 17:00:00','2012-09-19 05:00:00','2012-08-14 14:40:09','2012-08-14 14:40:09'),(1575,'23943163','10/4/2012','12:00 pm','10/4/2012',NULL,'Kyekyoon Kim, Professor, Electrical & Computer Engr., UIUC - \"Controlled release of therapeutics and cells mediated by precision micro/nano particles\"','http://www.ece.illinois.edu/directory/profile.asp?kevinkim','B102 CLSL','Dept. of MIP',NULL,NULL,'217-333-1735','Seminar','Molecular and Integrative Physiology (MIP) Department Seminar Series','2012-10-04 17:00:00','2012-10-04 05:00:00','2012-08-14 18:50:09','2012-08-14 18:50:09'),(1576,'23806927','10/18/2012','12:00 pm','10/18/2012',NULL,'Gail S. Prins, PhD, Professor of Urology and Physiology, Univ. of IL at Chicago - \"Hormonal Regulation of Prostate Stem Cells: Implications for Prostate Cancer Risk\"','http://urol.uic.edu/dept/prins.php',NULL,'Dept. of MIP',NULL,NULL,'217-333-1735','Seminar','Molecular and Integrative Physiology (MIP) Department Seminar Series','2012-10-18 17:00:00','2012-10-18 05:00:00','2012-08-14 20:05:09','2012-08-14 20:05:09'),(1577,'23136716','9/5/2012','12:00 pm','9/5/2012',NULL,'Cell &  Developmental Biology Seminar:   Dr.  Supriya Prasanth, UIUC, \"Pre-Replicative Complex: Linking DNA replication initiation to chromatin organization\"',NULL,'B102 CLSL','Cell & Developmental Biology','Elaine Rodgers; Lisa Stubbs','erodgers@life.illinois.edu','217-265-5511','Seminar','Cell and Developmental Biology (CDB) Departmental Seminars','2012-09-05 17:00:00','2012-09-05 05:00:00','2012-08-15 16:20:09','2012-08-15 16:20:09'),(1578,'23136717','9/11/2012','10:30 am','9/11/2012',NULL,'Cell &  Developmental Biology Seminar:   Dr.  K.V. Prasanth, UIUC, \"Long Noncoding RNAs: Regulators of Gene Expression\"',NULL,'B102 CLSL','Cell & Developmental Biology','Elaine Rodgers; Lisa Stubbs','erodgers@life.illinois.edu','217-265-5511','Seminar','Cell and Developmental Biology (CDB) Departmental Seminars','2012-09-11 15:30:00','2012-09-11 05:00:00','2012-08-15 16:20:09','2012-08-15 16:20:09'),(1579,'20976134','9/10/2012','12:00 pm','9/10/2012',NULL,'Cell &  Developmental Biology Seminar:   Dr. Michael Levin, Tufts University, Dept. of Biology, \"Endogeneous bioelectric controls of growth and form: molecular mechanisms and biomedical opportunities\"\"',NULL,'B102 CLSL','Cell & Developmental Biology','Elaine Rodgers; Lisa Stubbs','erodgers@life.illinois.edu','217-265-5511','Seminar','Cell and Developmental Biology (CDB) Departmental Seminars','2012-09-10 17:00:00','2012-09-10 05:00:00','2012-08-16 14:15:09','2012-08-16 14:15:09'),(1584,'21558098','9/17/2012','12:00 pm','9/17/2012','1:00 pm','CDB Student & Postdoc Seminar, Yijie Geng',NULL,'B102 CLSL','Cell & Developmental Biology Department','Shannon Croft','shannon9@life.illinois.edu','(217) 333-6118','Lecture','Cell and Developmental Biology (CDB) Student & Postdoc Seminars','2012-09-17 17:00:00','2012-09-17 18:00:00','2012-08-21 20:30:09','2012-08-21 20:30:09'),(1586,'23407382','9/13/2012','4:00 pm','9/13/2012',NULL,'Microbiology Seminar:  Dr. Mark Mandel, \"Identification of factors that mediate host specificity in a model mutualism\"',NULL,'B102 Chemical & Life Sciences Laboratory, 601 S. Goodwin Ave., Urbana','Dr. Cari Vanderpool, Assistant Professor of Microbiology','Diane Tsevelekos','microsem@illinois.edu','333-1736','Seminar','Microbiology Department','2012-09-13 21:00:00','2012-09-13 05:00:00','2012-08-22 16:00:12','2012-08-22 16:00:12'),(1587,'21653046','9/21/2012','12:00 pm','9/21/2012','1:00 pm','Biochemistry Seminar: Dr. David A. Bernlohr, University of Minnesota, Minneapolis, MN \"Oxidative Stress and Mitochondrial Dysfunction in Obesity and Diabetes\"','http://www.cbs.umn.edu/bmbb/contacts/david-bernlohr','B102 CLSL','Dr. Jongsook Kim Kemper','Cara L. Day','caraday@illinois.edu','217.333.2013','Seminar','Biochemistry Department Seminars','2012-09-21 17:00:00','2012-09-21 18:00:00','2012-08-22 22:10:09','2012-08-22 22:10:09'),(1592,'23804152','9/6/2012','12:00 pm','9/6/2012',NULL,'Eric Bolton, Assistant Prof. Department of MIP, UIUC - \"Androgen Receptor Signaling in Health and Disease\"','http://mcb.illinois.edu/faculty/profile/boltonec','B102 CLSL','Dept. of Molecular & Integrative Physiology',NULL,NULL,'217-333-1735','Seminar','Molecular and Integrative Physiology (MIP) Department Seminar Series','2012-09-06 17:00:00','2012-09-06 05:00:00','2012-08-27 16:50:09','2012-08-27 16:50:09'),(1597,'24328848','10/5/2012','12:00 pm','10/5/2012','1:00 pm','Biochemistry Seminar: Dr. Stewart H. Shuman, Sloan-Kettering Institute, New York, \"RNA repair: hiding in plain sight\"','http://www.mskcc.org/research/lab/stewart-shuman','B102 CLSL','Dr. Raven Huang','Cara L. Day','caraday@illinois.edu','217.333.2013','Seminar','Biochemistry Department Seminars','2012-10-05 17:00:00','2012-10-05 18:00:00','2012-08-31 22:10:09','2012-08-31 22:10:09'),(1598,'23673404','9/5/2012','4:00 pm','9/5/2012',NULL,'Dr. John Gerlt - \"Enzyme Function Initiative:   Discovering Novel Enzymes, Metabolites, and Biology\"',NULL,'Room 116 CLSL','Department of Biochemistry',NULL,NULL,NULL,'Seminar','Biochemistry Department Graduate Seminars','2012-09-05 21:00:00','2012-09-05 05:00:00','2012-09-04 14:15:09','2012-09-04 14:15:09'),(1638,'24072944','9/12/2012','4:00 pm','9/12/2012',NULL,'Dr. John Cronan - \"Avant-Garde Pathways of Cofactor Synthesis\"',NULL,'116 RAL','Department of Biochemistry',NULL,NULL,NULL,'Seminar','Biochemistry Department Graduate Seminars','2012-09-12 21:00:00','2012-09-12 05:00:00','2012-09-04 15:50:09','2012-09-04 15:50:09'),(1640,'21963670','9/28/2012','12:00 pm','9/28/2012','1:00 pm','Biochemistry Seminar: Dr. Emad Tajkhorshid, University of Illinois  \"Visualizing the Highly Dynamical Role of the Cellular Membrane in Recognition, Signaling, and Transport Phenomena at sub-Angstrom Resolution\"','http://mcb.illinois.edu/faculty/profile/tajkhors','B102 CLSL','Dr. Stephen Sligar','Cara L. Day','caraday@illinois.edu','217.333.2013','Seminar','Biochemistry Department Seminars','2012-09-28 17:00:00','2012-09-28 18:00:00','2012-09-10 13:45:09','2012-09-10 13:45:09'),(1645,'24548619','9/27/2012','12:00 pm','9/27/2012',NULL,'MIP Grad Student Seminar - Itamar Livant (J. Sweedler Lab) - \"Characterization of D-amino acid-containing peptides\" and Samuel Irving (Martha Gillette Lab) - \"Clock-to-Clock Coupling in the Brain\"',NULL,'B102 CLSL','Dept of MIP',NULL,NULL,'217-333-1735','Seminar','Molecular and Integrative Physiology (MIP) Department Seminar Series','2012-09-27 17:00:00','2012-09-27 05:00:00','2012-09-10 20:35:09','2012-09-10 20:35:09'),(1646,'15689579','12/12/2012',NULL,'12/12/2012',NULL,'Last Day of Instruction, Fall Semester',NULL,NULL,'U-C Senate',NULL,NULL,NULL,'Academic','Academic Dates','2012-12-12 06:00:00','2012-12-12 06:00:00','2012-09-11 16:00:09','2012-09-11 16:00:09'),(1647,'15689582','1/14/2013',NULL,'1/14/2013',NULL,'First Day of Instruction, Spring Semester',NULL,NULL,'U-C Senate',NULL,NULL,NULL,'Academic','Academic Dates','2013-01-14 06:00:00','2013-01-14 06:00:00','2012-09-11 16:00:09','2012-09-11 16:00:09'),(1648,'18897234','10/19/2012','12:00 pm','10/19/2012','1:00 pm','Biochemistry Seminar: Dr. Mei Hong, Iowa State University, \"Structure, Dynamics, and Mechanism of Membrane Peptides and Proteins from Solid-State NMR\"','http://www.public.iastate.edu/~hongweb/','B102 CLSL','Dr. Emad Tajkhorshid','Cara L. Day','caraday@illinois.edu','217.333.2013','Seminar','Biochemistry Department Seminars','2012-10-19 17:00:00','2012-10-19 18:00:00','2012-09-13 18:15:08','2012-09-13 18:15:08'),(1651,'21558105','10/1/2012','12:00 pm','10/1/2012','1:00 pm','CDB Student & Postdoc Seminar, Dr. Vivian Tang',NULL,'B102 CLSL','Cell & Developmental Biology Department','Shannon Croft','shannon9@life.illinois.edu','(217) 333-6118','Lecture','Cell and Developmental Biology (CDB) Student & Postdoc Seminars','2012-10-01 17:00:00','2012-10-01 18:00:00','2012-09-17 16:50:08','2012-09-17 16:50:08'),(1652,'21558112','10/22/2012','12:00 pm','10/22/2012','1:00 pm','CDB Student & Postdoc Seminar, Sara Cook & Edwin Arauz',NULL,'B102 CLSL','Cell & Developmental Biology Department','Shannon Croft','shannon9@life.illinois.edu','(217) 333-6118','Lecture','Cell and Developmental Biology (CDB) Student & Postdoc Seminars','2012-10-22 17:00:00','2012-10-22 18:00:00','2012-09-17 16:50:08','2012-09-17 16:50:08'),(1656,'23673408','10/3/2012','4:00 pm','10/3/2012',NULL,'Keith R. Westcott Biosciences Fellow: Neal Andruska (Shapiro Lab) - Identification of a Novel Small Molecule Inhibitor of Estrogen Receptor &#945; (ER&#945;) with Promising Therapeutic Potential that Links a New Pathway to ER&#945; Action',NULL,'116 RAL','Department of Biochemistry',NULL,NULL,NULL,'Seminar','Biochemistry Department Graduate Seminars','2012-10-03 21:00:00','2012-10-03 05:00:00','2012-09-20 17:50:08','2012-09-20 17:50:08'),(1657,'23673409','10/3/2012','4:00 pm','10/3/2012',NULL,'Keith R. Westcott Biosciences Fellow: Katie Whalen (A. Spies/Wraight) - Elucidating Enzyme Dynamics with Small Molecules: Evidence and Application with Glutamate Racemase',NULL,'116 RAL','Department of Biochemistry',NULL,NULL,NULL,'Seminar','Biochemistry Department Graduate Seminars','2012-10-03 21:00:00','2012-10-03 05:00:00','2012-09-24 18:40:09','2012-09-24 18:40:09'),(1658,'23407574','10/11/2012','4:00 pm','10/11/2012',NULL,'Microbiology Seminar:  Dr. Scott Dawson, \"Emerging insights into host attachment by Giardia\'s complex cytoskeletal structure, the ventral disc\"',NULL,'B102 Chemical & Life Sciences Laboratory, 601 S. Goodwin Ave., Urbana','Dr. Rachel Whitaker, Assistant Professor of Microbiology','Diane Tsevelekos','microsem@illinois.edu','333-1736','Seminar','Microbiology Department','2012-10-11 21:00:00','2012-10-11 05:00:00','2012-09-25 14:55:09','2012-09-25 14:55:09'),(1659,'23424751','10/25/2012','4:00 pm','10/25/2012',NULL,'Microbiology Seminar:  Dr. Peggy Cotter, \"Contact dependent growth inhibition (CDI) in Burkholderia:  why do the do that?\"',NULL,'B102 Chemical & Life Sciences Laboratory, 601 S. Goodwin Ave., Urbana','Dr. Steven Blanke, Professor of Microbiology','Diane Tsevelekos','microsem@illinois.edu','333-1736','Seminar','Microbiology Department','2012-10-25 21:00:00','2012-10-25 05:00:00','2012-09-25 16:45:08','2012-09-25 16:45:08'),(1660,'23673411','10/10/2012','4:00 pm','10/10/2012',NULL,'Zhanar Abil (Zhao Lab) - One-Step Modular Assembly of PUF Proteins for Specific Recognition of Endogenous RNA Sequences',NULL,'116 RAL','Department of Biochemistry',NULL,NULL,NULL,'Seminar','Biochemistry Department Graduate Seminars','2012-10-10 21:00:00','2012-10-10 05:00:00','2012-09-26 20:20:09','2012-09-26 20:20:09'),(1668,'23673410','10/10/2012','4:00 pm','10/10/2012',NULL,'Salehe Ghasempur (Gerlt Lab) - \"Mining enolase superfamily for new functions: D-glucarate dehydratase related proteins and L-lyxonate dehydratases\"',NULL,'116 RAL','Department of Biochemistry',NULL,NULL,NULL,'Seminar','Biochemistry Department Graduate Seminars','2012-10-10 21:00:00','2012-10-10 05:00:00','2012-10-02 19:25:09','2012-10-02 19:25:09'),(1673,'25075428','10/9/2012','12:00 pm','10/9/2012',NULL,'Microbiology Special Interest Seminar:  \"Genome Evolution, Diversity, and Interactions in Microbial Communities\"',NULL,'B102 Chemical & Life Sciences Laboratory, 601 S. Goodwin Ave., Urbana','Dr. William Metcalf, Professor','Diane Tsevelekos','microsem@illinois.edu','333-1736','Seminar','Microbiology Department','2012-10-09 17:00:00','2012-10-09 05:00:00','2012-10-04 16:10:08','2012-10-04 16:10:08'),(1675,'25050187','11/14/2012','12:00 pm','11/14/2012',NULL,'Cell &  Developmental Biology Seminar:   Dr. Robert Roeder, Rockefeller University, \"Transcriptional Regulatory Mechanisms in Animal Cells\"',NULL,'B102 CLSL','Cell & Developmental Biology','Elaine Rodgers; Philip Newmark','erodgers@life.illinois.edu','217-265-5511','Seminar','Cell and Developmental Biology (CDB) Departmental Seminars','2012-11-14 18:00:00','2012-11-14 06:00:00','2012-10-10 15:45:08','2012-10-10 15:45:08'),(1679,'25251666','10/24/2012','5:00 pm','10/24/2012','6:00 pm','How to Conduct a Job or Internship Search',NULL,'161 Noyes Lab','MCB Advising',NULL,NULL,NULL,NULL,'MCB Undergraduate Events','2012-10-24 22:00:00','2012-10-24 23:00:00','2012-10-12 15:05:09','2012-10-12 15:05:09'),(1681,'25251672','11/8/2012','5:00 pm','11/8/2012','6:00 pm','Undergraduate Research Information Session',NULL,'217 Noyes Lab','MCB Advising',NULL,NULL,NULL,NULL,'MCB Undergraduate Events','2012-11-08 23:00:00','2012-11-09 00:00:00','2012-10-12 15:40:09','2012-10-12 15:40:09'),(1682,'21863808','11/7/2012','12:00 pm','11/7/2012',NULL,'Cell &  Developmental Biology Seminar:   Dr. Christopher Wright, Vanderbilt University, Cell & Developmental Biology,\"Plasticity in the Pancreas: New Diabetes Therapies?\"',NULL,'B102 CLSL','Cell & Developmental Biology','Elaine Rodgers; Lisa Stubbs','erodgers@life.illinois.edu','217-265-5511','Seminar','Cell and Developmental Biology (CDB) Departmental Seminars','2012-11-07 18:00:00','2012-11-07 06:00:00','2012-10-15 14:25:09','2012-10-15 14:25:09'),(1690,'23673413','10/24/2012','4:00 pm','10/24/2012',NULL,'Paween Mahinthichaichan (Gennis/Tajkhorshid Lab) - \"Comparative Investigation of O(2) Substrate Delivery Pathways in Cytochrome c Oxidases\"',NULL,'116 RAL','Department of Biochemistry',NULL,NULL,NULL,'Seminar','Biochemistry Department Graduate Seminars','2012-10-24 21:00:00','2012-10-24 05:00:00','2012-10-16 21:30:09','2012-10-16 21:30:09'),(1691,'23673412','10/24/2012','4:00 pm','10/24/2012',NULL,'Bijoy Desai (Gerlt Lab) - \"Conformational Changes in Orotidine-5\'-monophosphate decarboxylase: How Instrinsic Binding Energy of Remote Phosphate Group is Used to Activate the Enzyme\"',NULL,'116 RAL','Department of Biochemistry',NULL,NULL,NULL,'Seminar','Biochemistry Department Graduate Seminars','2012-10-24 21:00:00','2012-10-24 05:00:00','2012-10-16 21:35:08','2012-10-16 21:35:08'),(1692,'21566488','4/1/2013','12:00 pm','4/1/2013','1:00 pm','CDB Student & Postdoc Seminar, Harini Iyer & Christina Plaisier',NULL,'B102 CLSL','Cell & Developmental Biology Department','Shannon Croft','shannon9@life.illinois.edu','(217) 333-6118','Lecture','Cell and Developmental Biology (CDB) Student & Postdoc Seminars','2013-04-01 17:00:00','2013-04-01 18:00:00','2012-10-17 16:20:08','2012-10-17 16:20:08'),(1693,'21566489','4/8/2013','12:00 pm','4/8/2013','1:00 pm','CDB Student & Postdoc Seminar, Rachel Waldemer & Xinying Zong',NULL,'B102 CLSL','Cell & Developmental Biology Department','Shannon Croft','shannon9@life.illinois.edu','(217) 333-6118','Lecture','Cell and Developmental Biology (CDB) Student & Postdoc Seminars','2013-04-08 17:00:00','2013-04-08 18:00:00','2012-10-17 16:20:08','2012-10-17 16:20:08'),(1697,'25363579','3/25/2013','12:00 pm','3/25/2013','1:00 pm','CDB Student & Postdoc Seminar, Min Zeng & James Chu',NULL,'B102 CLSL','Cell & Developmental Biology Department','Shannon Croft','shannon9@life.illinois.edu','(217) 333-6118','Lecture','Cell and Developmental Biology (CDB) Student & Postdoc Seminars','2013-03-25 17:00:00','2013-03-25 18:00:00','2012-10-17 16:25:09','2012-10-17 16:25:09'),(1699,'21566473','1/28/2013','12:00 pm','1/28/2013','1:00 pm','CDB Student & Postdoc Seminar, Xiang Deng & Rajashekar Iyer',NULL,'B102 CLSL','Cell & Developmental Biology Department','Shannon Croft','shannon9@life.illinois.edu','(217) 333-6118','Lecture','Cell and Developmental Biology (CDB) Student & Postdoc Seminars','2013-01-28 18:00:00','2013-01-28 19:00:00','2012-10-17 16:30:08','2012-10-17 16:30:08'),(1703,'21566484','2/25/2013','12:00 pm','2/25/2013','1:00 pm','CDB Student & Postdoc Seminar, Ambika Nadkarni & Amir Saberi',NULL,'B102 CLSL','Cell & Developmental Biology Department','Shannon Croft','shannon9@life.illinois.edu','(217) 333-6118','Lecture','Cell and Developmental Biology (CDB) Student & Postdoc Seminars','2013-02-25 18:00:00','2013-02-25 19:00:00','2012-10-17 16:45:08','2012-10-17 16:45:08'),(1704,'25363585','2/4/2013','12:00 pm','2/4/2013','1:00 pm','CDB Student & Postdoc Seminar, James Kemp & Dr. Mee SupYoon',NULL,'B102 CLSL','Cell & Developmental Biology Department','Shannon Croft','shannon9@life.illinois.edu','(217) 333-6118','Lecture','Cell and Developmental Biology (CDB) Student & Postdoc Seminars','2013-02-04 18:00:00','2013-02-04 19:00:00','2012-10-17 16:50:08','2012-10-17 16:50:08'),(1705,'23424765','11/29/2012','4:00 pm','11/29/2012',NULL,'Microbiology Seminar:  Dr. Petra Levin, \"Big Enough:  Insights Into the Molecular Basis of Cell Size Homeostasis\"',NULL,'B102 Chemical & Life Sciences Laboratory, 601 S. Goodwin Ave., Urbana','Dr. Cari Vanderpool, Assistant Professor of Microbiology','Diane Tsevelekos','microsem@illinois.edu','333-1736','Seminar','Microbiology Department','2012-11-29 22:00:00','2012-11-29 06:00:00','2012-10-17 18:15:09','2012-10-17 18:15:09'),(1706,'25405547','11/7/2012','5:00 pm','11/7/2012',NULL,'Careers in MCB: Conversations with Alumni',NULL,'161 Noyes Lab','MCB Advising',NULL,NULL,NULL,NULL,'MCB Undergraduate Events','2012-11-07 23:00:00','2012-11-07 06:00:00','2012-10-19 14:55:09','2012-10-19 14:55:09'),(1707,'21558118','11/5/2012','12:00 pm','11/5/2012','1:00 pm','CDB Student & Postdoc Seminar, Dr. Labib Rouhana',NULL,'B102 CLSL','Cell & Developmental Biology Department','Shannon Croft','shannon9@life.illinois.edu','(217) 333-6118','Lecture','Cell and Developmental Biology (CDB) Student & Postdoc Seminars','2012-11-05 18:00:00','2012-11-05 19:00:00','2012-10-19 18:05:08','2012-10-19 18:05:08'),(1708,'23806928','10/25/2012','12:00 pm','10/25/2012',NULL,'MIP Graduate student seminar - Lily Mahapatra (David Shapiro lab) \"Targeting c-Myc and MDR1 in Cancer Through Small Molecule Inhibitors of IMP-1\" and Congcong Chen (Eric Bolton lab) -\"Retinoic Acid-Regulated Prostate Cell Proliferation\"',NULL,'B102 CLS','Dept. of MIP',NULL,NULL,'217-333-1735','Seminar','Molecular and Integrative Physiology (MIP) Department Seminar Series','2012-10-25 17:00:00','2012-10-25 05:00:00','2012-10-22 16:10:08','2012-10-22 16:10:08'),(1712,'19388548','11/9/2012','12:00 pm','11/9/2012','1:00 pm','Prof.  Dane Wittrup, MIT, \"Multitasking Anti-Cancer Biotherapeutics\"',NULL,'B102 Chemical & LIfe Sciences Lab','Chemistry-Biology Interface Training Program and the Department of Biochemistry','Nan Holda','holda@illinois.edu','244-5450','Lecture','Training Program at the Chemistry Biology Interface - Seminars','2012-11-09 18:00:00','2012-11-09 19:00:00','2012-10-29 17:50:08','2012-10-29 17:50:08'),(1713,'19193115','11/9/2012','12:00 pm','11/9/2012','1:00 pm','CBI/Biochemistry Seminar: Prof. K. Dane Wittrup (MIT), \"Multitasking Anti-Cancer Biotherapeutics\"','http://web.mit.edu/kdw-lab/people/wittrup.htm','B102 CLSL','Sheena Smith','Nan Holda','holda@illinois.edu','217-244-5450','Seminar','Biochemistry Department Seminars','2012-11-09 18:00:00','2012-11-09 19:00:00','2012-10-29 18:15:09','2012-10-29 18:15:09'),(1714,'24092916','11/16/2012','12:00 pm','11/16/2012','1:00 pm','Biochemistry Seminar: Dr. James A. Huntington, University of Cambridge \"The ins and outs of serpin polymerization.\"','http://huntingtonlab.cimr.cam.ac.uk/','B102 CLSL','Dr. Jim Morrissey','Cara L. Day','caraday@illinois.edu','217.333.2013','Seminar','Biochemistry Department Seminars','2012-11-16 18:00:00','2012-11-16 19:00:00','2012-10-29 21:55:09','2012-10-29 21:55:09'),(1715,'23424759','11/1/2012',NULL,'11/1/2012',NULL,'* *CANCELLED* *    Microbiology Seminar:  Dr. Robert Hancock, \"Systems Biology of Host Pathogen Interactions:  From theory to therapy\"',NULL,'B102 Chemical & Life Sciences Laboratory, 601 S. Goodwin Ave., Urbana','Dr. James Slauch, Professor of Microbiology','Diane Tsevelekos','microsem@illinois.edu','333-1736','Seminar','Microbiology Department','2012-11-01 05:00:00','2012-11-01 05:00:00','2012-10-30 14:15:08','2012-10-30 14:15:08'),(1718,'25655043','12/5/2012','12:00 pm','12/5/2012',NULL,'Cell &  Developmental Biology Seminar:   Dr. Robert Sauer, MIT, Dept. of Biology, \"Machines of Protein Destruction\"',NULL,'B102 CLSL','Cell & Developmental Biology','Elaine Rodgers; Lisa Stubbs','erodgers@life.illinois.edu','217-265-5511','Seminar','Cell and Developmental Biology (CDB) Departmental Seminars','2012-12-05 18:00:00','2012-12-05 06:00:00','2012-10-30 16:40:08','2012-10-30 16:40:08'),(1719,'23482899','10/31/2012','12:00 pm','10/31/2012',NULL,'* *CANCELLED* *  Cell &  Developmental Biology Seminar:   Dr. Robert Sauer, MIT, Dept. of Biology, \"Machines of Protein Destruction\"',NULL,'B102 CLSL','Cell & Developmental Biology','Elaine Rodgers; Lisa Stubbs','erodgers@life.illinois.edu','217-265-5511','Seminar','Cell and Developmental Biology (CDB) Departmental Seminars','2012-10-31 17:00:00','2012-10-31 05:00:00','2012-10-30 16:45:08','2012-10-30 16:45:08'),(1720,'25655044','11/1/2012','4:00 pm','11/1/2012',NULL,'*SPEAKER CHANGE* Microbiology Seminar:  Dr. Andrei Kuzminov, \"Mechanisms of Genetic Death:  Targets for Magic Bullets in the DNA Metabolism\"',NULL,'B102 Chemical & Life Sciences Laboratory, 601 S. Goodwin Ave., Urbana','Dr. Cari Vanderpool, Assistant Professor of Microbiology','Diane Tsevelekos','microsem@illinois.edu','333-1736','Seminar','Microbiology Department','2012-11-01 21:00:00','2012-11-01 05:00:00','2012-10-30 16:45:09','2012-10-30 16:45:09'),(1721,'23673417','11/7/2012','4:00 pm','11/7/2012',NULL,'Fiona Groninger-Poe (Gerlt Lab) - Assignment of function to acid sugar dehydratases in Agrobacterium tumefaciens',NULL,'116 RAL','Department of Biochemistry',NULL,NULL,NULL,'Seminar','Biochemistry Department Graduate Seminars','2012-11-07 22:00:00','2012-11-07 06:00:00','2012-10-31 19:50:08','2012-10-31 19:50:08'),(1722,'23673416','11/7/2012','4:00 pm','11/7/2012',NULL,'Michael Gregory (Sligar lab) - \"Differential Interactions of Native Substrates with Human CYP17\"',NULL,'116 RAL','Department of Biochemistry',NULL,NULL,NULL,'Seminar','Biochemistry Department Graduate Seminars','2012-11-07 22:00:00','2012-11-07 06:00:00','2012-11-01 14:40:09','2012-11-01 14:40:09'),(1725,'23673419','11/14/2012','4:00 pm','11/14/2012',NULL,'Swaminath Srinivas (Cronan Lab) - \"Identification and Characterization of Enoyl-ACP isomerases in Clostridium and Neisseria Species\"',NULL,'116 RAL','Department of Biochemistry',NULL,NULL,NULL,'Seminar','Biochemistry Department Graduate Seminars','2012-11-14 22:00:00','2012-11-14 06:00:00','2012-11-05 15:20:08','2012-11-05 15:20:08'),(1726,'23673414','11/14/2012','4:00 pm','11/14/2012',NULL,'Daniel Wichelecki (Gerlt Lab) - \"Functional and Physiological Discovery in the Enolase Superfamily\".',NULL,'116 RAL','Department of Biochemistry',NULL,NULL,NULL,'Seminar','Biochemistry Department Graduate Seminars','2012-11-14 22:00:00','2012-11-14 06:00:00','2012-11-06 16:00:09','2012-11-06 16:00:09'),(1727,'23424763','11/8/2012',NULL,'11/8/2012',NULL,'**CANCELLED** Microbiology Seminar:  Dr. John Connor, \"Understanding poxviral infection using small molecules and cell biology\"',NULL,'B102 Chemical & Life Sciences Laboratory, 601 S. Goodwin Ave., Urbana','Dr. Joanna Shisler, Associate Professor of Microbiology','Diane Tsevelekos','microsem@illinois.edu','333-1736','Seminar','Microbiology Department','2012-11-08 06:00:00','2012-11-08 06:00:00','2012-11-06 21:10:08','2012-11-06 21:10:08'),(1728,'21563686','11/26/2012','12:00 pm','11/26/2012','1:00 pm','CDB Student & Postdoc Seminar, Anika Jain & Younguk Sun',NULL,'B102 CLSL','Cell & Developmental Biology Department','Shannon Croft','shannon9@life.illinois.edu','(217) 333-6118','Lecture','Cell and Developmental Biology (CDB) Student & Postdoc Seminars','2012-11-26 18:00:00','2012-11-26 19:00:00','2012-11-06 22:10:08','2012-11-06 22:10:08'),(1730,'21566457','12/10/2012','12:00 pm','12/10/2012','1:00 pm','CDB Student & Postdoc Seminar, Nidhi Khanna & Dr. Rachel Roberts-Galbraith',NULL,'B102 CLSL','Cell & Developmental Biology Department','Shannon Croft','shannon9@life.illinois.edu','(217) 333-6118','Lecture','Cell and Developmental Biology (CDB) Student & Postdoc Seminars','2012-12-10 18:00:00','2012-12-10 19:00:00','2012-11-07 15:20:08','2012-11-07 15:20:08'),(1731,'21566459','12/3/2012','12:00 pm','12/3/2012','1:00 pm','No Seminar',NULL,'B102 CLSL','Cell & Developmental Biology Department','Shannon Croft','shannon9@life.illinois.edu','(217) 333-6118','Lecture','Cell and Developmental Biology (CDB) Student & Postdoc Seminars','2012-12-03 18:00:00','2012-12-03 19:00:00','2012-11-07 15:20:08','2012-11-07 15:20:08'),(1732,'25831490','11/8/2012','4:00 pm','11/8/2012',NULL,'*SPEAKER CHANGE* Microbiology Seminar:  Dr. Andrei Kuzminov, \"Lab as a habitat, or how to stop a cross-contaming virus:  the story of Lula continues\"',NULL,'B102 Chemical & Life Sciences Laboratory, 601 S. Goodwin Ave., Urbana','Dr. Cari Vanderpool, Assistant Professor of Microbiology','Diane Tsevelekos','microsem@illinois.edu','333-1736','Seminar','Microbiology Department','2012-11-08 22:00:00','2012-11-08 06:00:00','2012-11-07 16:55:08','2012-11-07 16:55:08'),(1734,'25859818','11/15/2012','12:00 pm','11/15/2012',NULL,'Claudio Grosman, PhD-Dept. of Molecular & Integrative Physiology, UIUC - \"The unanticipated complexity of the ring of glutamates in the charge-selectivity filter of the nicotinic acetylcholine receptor\"','http://mcb.illinois.edu/faculty/profile/grosman','B102 CLSL','Dept. of MIP','Penny Morman','morman@illinois.edu','217-333-8275','Seminar','Molecular and Integrative Physiology (MIP) Department Seminar Series','2012-11-15 18:00:00','2012-11-15 06:00:00','2012-11-08 21:45:08','2012-11-08 21:45:08'),(1735,'23424764','11/15/2012',NULL,'11/15/2012',NULL,'*CANCELLED* Microbiology Seminar:  Dr. Michael Glickman, \"Double Strand DNA Break Repair in Mycobacteria:  Novel Pathways of Repair and Response\"',NULL,'B102 Chemical & Life Sciences Laboratory, 601 S. Goodwin Ave., Urbana','Dr. Andrei Kuzminov, Associate Professor of Microbiology','Diane Tsevelekos','microsem@illinois.edu','333-1736','Seminar','Microbiology Department','2012-11-15 06:00:00','2012-11-15 06:00:00','2012-11-09 20:45:08','2012-11-09 20:45:08'),(1736,'25941270','11/15/2012','4:00 pm','11/15/2012',NULL,'*SPEAKER CHANGE* Microbiology Seminar:  Dr. James Slauch, \"Salmonella Resistance to Phagocytic Superoxide\"',NULL,'B102 Chemical & Life Sciences Laboratory, 601 S. Goodwin Ave., Urbana','Dr. Cari Vanderpool, Assistant Professor of Microbiology','Diane Tsevelekos','microsem@illinois.edu','333-1736','Seminar','Microbiology Department','2012-11-15 22:00:00','2012-11-15 06:00:00','2012-11-12 15:00:09','2012-11-12 15:00:09'),(1739,'25949722','11/29/2012','12:00 pm','11/29/2012',NULL,'Timothy J. Ebner, M.D./Ph.D. - Professor and Head, Dept. of Neuroscience, University of Minnesota-\"Visualizing Activity in the Cerebellar Cortex: Beams, Bands, Patches, and Plasticity\"','http://www.neurosci.umn.edu/faculty/ebner.html','B102 CLSL','Daniel Llano, M.D./Ph.D., Department of MIP and the College of Medicine','Penny Morman','morman@illinois.edu','217-333-8275','Seminar','Molecular and Integrative Physiology (MIP) Department Seminar Series','2012-11-29 18:00:00','2012-11-29 06:00:00','2012-11-12 22:00:08','2012-11-12 22:00:08'),(1744,'22526971','11/28/2012','12:00 pm','11/28/2012',NULL,'Cell &  Developmental Biology Seminar:   Dr. Douglas DeSimone, University of Viriginia, Department of Cell Biology, \"Force Dependence of Collective Cell Migration\"',NULL,'B102 CLSL','Cell & Developmental Biology','Elaine Rodgers; Lisa Stubbs','erodgers@life.illinois.edu','217-265-5511','Seminar','Cell and Developmental Biology (CDB) Departmental Seminars','2012-11-28 18:00:00','2012-11-28 06:00:00','2012-11-15 15:05:08','2012-11-15 15:05:08'),(1745,'23425171','12/6/2012','4:00 pm','12/6/2012',NULL,'Microbiology Seminar:  Dr. Sidney Kushner, \"New Insights into the Role of Polyadenylation in Prokaryotes\"',NULL,'B102 Chemical & Life Sciences Laboratory, 601 S. Goodwin Ave., Urbana','Dr. Cari Vanderpool, Assistant Professor of Microbiology','Diane Tsevelekos','microsem@illinois.edu','333-1736','Seminar','Microbiology Department','2012-12-06 22:00:00','2012-12-06 06:00:00','2012-11-15 16:15:09','2012-11-15 16:15:09'),(1757,'22843997','4/25/2013','4:00 pm','4/25/2013','5:00 pm','Ada Doisy Lectures in BIOCHEMISTRY: Drs. Xiaodong Wang and Yigong Shi','http://mcb.illinois.edu/departments/biochemistry/doisy.html#about','MSB Auditorium','Dr. Susan Martinis','Cara Day','caraday@illinois.edu','217.333.2013','Seminar','Biochemistry Department Seminars','2013-04-25 21:00:00','2013-04-25 22:00:00','2012-11-16 06:00:09','2012-11-16 06:00:09'),(1758,'22846762','4/26/2013','12:00 pm','4/26/2013','1:00 pm','Ada Doisy Lectures in BIOCHEMISTRY: Drs. Xiaodong Wang and Yigong Shi','http://mcb.illinois.edu/departments/biochemistry/doisy.html#about','MSB Auditorium','Dr. Susan Martinis','Cara Day','caraday@illinois.edu','217.333.2013','Seminar','Biochemistry Department Seminars','2013-04-26 17:00:00','2013-04-26 18:00:00','2012-11-16 06:00:09','2012-11-16 06:00:09'),(1759,'15689587','5/1/2013',NULL,'5/1/2013',NULL,'Instruction Ends',NULL,NULL,'U-C Senate',NULL,NULL,NULL,'Academic','Academic Dates','2013-05-01 05:00:00','2013-05-01 05:00:00','2012-11-16 15:05:08','2012-11-16 15:05:08'),(1762,'15689589','5/3/2013',NULL,'5/3/2013',NULL,'Final Exams Begin',NULL,NULL,'U-C Senate',NULL,NULL,NULL,'Academic','Academic Dates','2013-05-03 05:00:00','2013-05-03 05:00:00','2012-11-18 06:00:09','2012-11-18 06:00:09'),(1763,'23673422','11/28/2012','4:00 pm','11/28/2012',NULL,'Herbert E. Carter Fellow: Sheena Smith (Kranz Lab) - \"Engineering designer T cell receptors through the use of single-chain T cell receptor scaffolds\"',NULL,'116 RAL','Department of Biochemistry',NULL,NULL,NULL,'Seminar','Biochemistry Department Graduate Seminars','2012-11-28 22:00:00','2012-11-28 06:00:00','2012-11-19 15:20:08','2012-11-19 15:20:08'),(1766,'23673423','12/5/2012','4:00 pm','12/5/2012',NULL,'Neha Garg (van der Donk/Nair Lab) - \"In vitro reconstitution and characterization of the lantibiotic dehydratase NisB\"',NULL,'116 RAL','Department of Biochemistry',NULL,NULL,NULL,'Seminar','Biochemistry Department Graduate Seminars','2012-12-05 22:00:00','2012-12-05 06:00:00','2012-11-20 16:45:08','2012-11-20 16:45:08'),(1767,'15689591','5/12/2013',NULL,'5/12/2013',NULL,'Commencement','http://oc.illinois.edu/commencement/',NULL,'University of Illinois Board of Trustees',NULL,NULL,NULL,'Academic','Academic Dates','2013-05-12 05:00:00','2013-05-12 05:00:00','2012-11-23 06:00:08','2012-11-23 06:00:08'),(1768,'21350886','5/27/2013',NULL,'5/27/2013',NULL,'Memorial Day',NULL,NULL,'U-C Senate',NULL,NULL,NULL,'Holiday','Holidays','2013-05-27 05:00:00','2013-05-27 05:00:00','2012-11-24 06:00:09','2012-11-24 06:00:09'),(1769,'23673421','11/28/2012','4:00 pm','11/28/2012',NULL,'Herbert E. Carter Fellow: Abhinav Luthra (Sligar Lab) - \'KINETIC SOLVENT ISOTOPE EFFECTS IN THE AROMATIZATION REACTION OF HUMAN AROMATASE\'',NULL,'116 RAL','Department of Biochemistry',NULL,NULL,NULL,'Seminar','Biochemistry Department Graduate Seminars','2012-11-28 22:00:00','2012-11-28 06:00:00','2012-11-26 14:50:08','2012-11-26 14:50:08'),(1773,'26231073','12/6/2012','12:00 pm','12/6/2012',NULL,'Zeynep Madak Erdogan, PhD, Post-doc Research Associate, Dr. B. Katzenellenbogen Lab, - \"Integrative Genomics of Gene and Metabolic Regulation by Estrogen Receptors Alpha and Beta and Coregulators\" and Yuechao Zhao, PhD, Post-doc Research Associate, Dr. M. Bagchi Lab - \"Estrogen-Induced Expression of CCN1 is Critical for Vascular Network Formation in Endometriotic Lesions\"',NULL,'B102 CLSL','Dept. of MIP','Penny Morman','morman@illinois.edu','217-333-8275','Seminar','Molecular and Integrative Physiology (MIP) Department Seminar Series','2012-12-06 18:00:00','2012-12-06 06:00:00','2012-11-27 20:15:08','2012-11-27 20:15:08'),(1780,'23673424','12/5/2012','4:00 pm','12/5/2012',NULL,'Adrienne Barry (Leckband Lab) - \"VE-Cadherin Mechanotransduction Regulates Endothelial Contractility and Barrier Integrity\"',NULL,'116 RAL','Department of Biochemistry',NULL,NULL,NULL,'Seminar','Biochemistry Department Graduate Seminars','2012-12-05 22:00:00','2012-12-05 06:00:00','2012-11-30 19:25:08','2012-11-30 19:25:08'),(1783,'21566463','12/17/2012','12:00 pm','12/17/2012','1:00 pm','CDB Student & Postdoc Seminar, Derek Caetano-Anolles',NULL,'B102 CLSL','Cell & Developmental Biology Department','Shannon Croft','shannon9@life.illinois.edu','(217) 333-6118','Lecture','Cell and Developmental Biology (CDB) Student & Postdoc Seminars','2012-12-17 18:00:00','2012-12-17 19:00:00','2012-12-10 15:40:09','2012-12-10 15:40:09'),(1784,'21566490','4/15/2013','12:00 pm','4/15/2013','1:00 pm','CDB Student & Postdoc Seminar, Li-Hsin Chang & JooHwan Kim',NULL,'B102 CLSL','Cell & Developmental Biology Department','Shannon Croft','shannon9@life.illinois.edu','(217) 333-6118','Lecture','Cell and Developmental Biology (CDB) Student & Postdoc Seminars','2013-04-15 17:00:00','2013-04-15 18:00:00','2012-12-10 15:40:09','2012-12-10 15:40:09'),(1785,'26760594','4/25/2013','12:00 pm','4/25/2013',NULL,'Christopher K. Glass, M.D., Ph.D., Professor of Cellular and Molecular Medicine and Professor of Medicine, University of CA at San Diego-\"A genome-wide view of macrophage activation\"','http://cmm.ucsd.edu/glass/','B102 CLSL','MIP Graduate students','Penny Morman','morman@illinois.edu','217-333-8275','Seminar','Molecular and Integrative Physiology (MIP) Department Seminar Series','2013-04-25 17:00:00','2013-04-25 05:00:00','2012-12-18 16:40:08','2012-12-18 16:40:08'),(1786,'26011582','3/7/2013','4:00 pm','3/7/2013',NULL,'Microbiology Seminar:  Dr. John Connor, \"Attacking Poxvirus Replication Using Small Molecules and Cell Biology\"',NULL,'B102 Chemical & Life Sciences Laboratory, 601 S. Goodwin Ave., Urbana','Dr. Joanna Shisler, Associate Professor of Microbiology','Diane Tsevelekos','microsem@illinois.edu','333-1736','Seminar','Microbiology Department','2013-03-07 22:00:00','2013-03-07 06:00:00','2012-12-18 19:50:08','2012-12-18 19:50:08'),(1797,'27138992','1/31/2013','12:00 pm','1/31/2013',NULL,'\"Studies of Cancer Metabolism using Drosophila as a Model System\"',NULL,'B102 CLSL','CDB/MIP','Teresa Bice','tbice@illinois.edu','217-300-0419',NULL,'MCB Events','2013-01-31 18:00:00','2013-01-31 06:00:00','2013-01-02 16:20:09','2013-01-02 16:20:09'),(1800,'27144755','1/29/2013','5:00 pm','1/29/2013','6:00 pm','Undergraduate Research Information Session',NULL,'161 Noyes Lab','MCB Advising',NULL,NULL,NULL,NULL,'MCB Undergraduate Events','2013-01-29 23:00:00','2013-01-30 00:00:00','2013-01-02 20:35:10','2013-01-02 20:35:10'),(1801,'27144756','1/31/2013','5:00 pm','1/31/2013','6:00 pm','MCB Specific Pre-Med/Dent Study Abroad Opportunities',NULL,'140 Burrill Hall','MCB Advising',NULL,NULL,NULL,NULL,'MCB Undergraduate Events','2013-01-31 23:00:00','2013-02-01 00:00:00','2013-01-02 20:35:10','2013-01-02 20:35:10'),(1802,'27144758','2/12/2013','5:00 pm','2/12/2013','6:00 pm','MCB 492 and Graduation with Distinction Information Session',NULL,'161 Noyes Lab','MCB Advising',NULL,NULL,NULL,NULL,'MCB Undergraduate Events','2013-02-12 23:00:00','2013-02-13 00:00:00','2013-01-02 20:40:08','2013-01-02 20:40:08'),(1803,'27144757','2/19/2013','4:00 pm','2/19/2013','5:00 pm','Understanding the IB and MCB Majors',NULL,'135 Burrill Hall','MCB Advising',NULL,NULL,NULL,NULL,'MCB Undergraduate Events','2013-02-19 22:00:00','2013-02-19 23:00:00','2013-01-02 20:40:08','2013-01-02 20:40:08'),(1805,'27138989','1/17/2013','12:00 pm','1/17/2013',NULL,'\"Ovulation requires female reproductive tract secretions controlled by NR5a-family nuclear hormone receptors.\"',NULL,'B102 CLSL','CDB/MIP','Teresa Bice','tbice@illinois.edu','217-300-0419',NULL,'MCB Events','2013-01-17 18:00:00','2013-01-17 06:00:00','2013-01-03 14:45:09','2013-01-03 14:45:09'),(1806,'24927489','1/25/2013','12:00 pm','1/25/2013','1:00 pm','Biochemistry Seminar: Dr. Joseph M. Jez (Washington University) \"GH3 Proteins as Molecular On/Off Switches of Plant Hormone Action\"','http://dbbs.wustl.edu/faculty/Pages/faculty_bio.aspx?SID=5997','B102 CLSL','Dr. Satish Nair','Cara L. Day','caraday@illinois.edu','217.333.2013','Seminar','Biochemistry Department Seminars','2013-01-25 18:00:00','2013-01-25 19:00:00','2013-01-03 16:25:08','2013-01-03 16:25:08'),(1811,'27201024','1/23/2013','12:00 pm','1/23/2013',NULL,'\"Exploring the genetics of lymphoma: towards targeted therapies\"',NULL,'B102 CLSL','CDB/MIP','Teresa Bice','tbice@illinois.edu','217-300-0419',NULL,'MCB Events','2013-01-23 18:00:00','2013-01-23 06:00:00','2013-01-04 22:05:09','2013-01-04 22:05:09'),(1813,'21863812','1/16/2013','12:00 pm','1/16/2013',NULL,'Cell &  Developmental Biology Seminar:   Dr. Wallace Marshall, University of California at San Francisco, \"Building and re-building the cell\"',NULL,'B102 CLSL','Cell & Developmental Biology','Elaine Rodgers; Philip Newmark','erodgers@life.illinois.edu','217-265-5511','Seminar','Cell and Developmental Biology (CDB) Departmental Seminars','2013-01-16 18:00:00','2013-01-16 06:00:00','2013-01-07 15:40:08','2013-01-07 15:40:08'),(1815,'21863815','3/13/2013','12:00 pm','3/13/2013',NULL,'Cell &  Developmental Biology Seminar:   Dr. Bruce Stillman, Cold Spring Harbor Laboratory, \"Inheritance of the Human Genome\"',NULL,'B102 CLSL','Cell & Developmental Biology','Elaine Rodgers; Lisa Stubbs','erodgers@life.illinois.edu','217-265-5511','Seminar','Cell and Developmental Biology (CDB) Departmental Seminars','2013-03-13 17:00:00','2013-03-13 05:00:00','2013-01-08 15:50:08','2013-01-08 15:50:08'),(1816,'27290739','1/17/2013','4:00 pm','1/17/2013',NULL,'Microbiology Seminar:  Dr. Thomas Kehl-Fie, \"Beyond iron:  The struggle for manganese and zinc during infection\"',NULL,'B102 Chemical & Life Sciences Laboratory, 601 S. Goodwin Ave., Urbana','Dr. James Slauch, Professor of Microbiology','Diane Tsevelekos','microsem@illinois.edu','333-1736','Seminar','Microbiology Department','2013-01-17 22:00:00','2013-01-17 06:00:00','2013-01-08 17:05:08','2013-01-08 17:05:08'),(1817,'27290743','1/22/2013','4:00 pm','1/22/2013',NULL,'Microbiology Seminar:  Dr. Josephine Chandler, \"Cell-cell communication and competition:  quorum-regulated social behaviours in Burkholderia thailandensis\"',NULL,'B102 Chemical & Life Sciences Laboratory, 601 S. Goodwin Ave., Urbana','Dr. Cari Vanderpool, Assistant Professor of Microbiology','Diane Tsevelekos','microsem@illinois.edu','333-1736','Seminar','Microbiology Department','2013-01-22 22:00:00','2013-01-22 06:00:00','2013-01-08 17:10:09','2013-01-08 17:10:09'),(1820,'21863816','3/27/2013','12:00 pm','3/27/2013',NULL,'Cell &  Developmental Biology Seminar:   Dr. Xiang-Dong Fu, University of California at San Diego, \"The splicing factor SRSF2 functions as the HIV tat equivalent in activation of cellular gene transcription\"',NULL,'B102 CLSL','Cell & Developmental Biology','Elaine Rodgers; Lisa Stubbs','erodgers@life.illinois.edu','217-265-5511','Seminar','Cell and Developmental Biology (CDB) Departmental Seminars','2013-03-27 17:00:00','2013-03-27 05:00:00','2013-01-08 17:20:09','2013-01-08 17:20:09'),(1821,'27290749','1/29/2013','4:00 pm','1/29/2013',NULL,'Microbiology Seminar:  Dr. Martin Pilhofer, \"The bacterial cytoskeleton:  in vivo superstructure as the key to understanding function and evolution\"',NULL,'B102 Chemical & Life Sciences Laboratory, 601 S. Goodwin Ave., Urbana','Dr. William Metcalf, Professor','Diane Tsevelekos','microsem@illinois.edu','333-1736','Seminar','Microbiology Department','2013-01-29 22:00:00','2013-01-29 06:00:00','2013-01-08 17:20:09','2013-01-08 17:20:09'),(1822,'27290752','1/31/2013','4:00 pm','1/31/2013',NULL,'Microbiology Seminar:  Dr. Arpita Bose, \"Uncovering the electric personality of an iron loving bacterium\"',NULL,'B102 Chemical & Life Sciences Laboratory, 601 S. Goodwin Ave., Urbana','Dr. James Imlay, Professor of Microbiology','Diane Tsevelekos','microsem@illinois.edu','333-1736','Seminar','Microbiology Department','2013-01-31 22:00:00','2013-01-31 06:00:00','2013-01-08 17:25:08','2013-01-08 17:25:08'),(1823,'27290754','2/5/2013','4:00 pm','2/5/2013',NULL,'Microbiology Seminar:  Dr. William Harcombe, \"Synthetic Microbial Communities:  Integrating Systems Biology with Evolutionary Ecology\"',NULL,'B102 Chemical & Life Sciences Laboratory, 601 S. Goodwin Ave., Urbana','Dr. James Slauch, Professor of Microbiology','Diane Tsevelekos','microsem@illinois.edu','333-1736','Seminar','Microbiology Department','2013-02-05 22:00:00','2013-02-05 06:00:00','2013-01-08 17:30:09','2013-01-08 17:30:09'),(1824,'27290756','2/12/2013','4:00 pm','2/12/2013',NULL,'Microbiology Seminar: Dr. Asma Hatoum-Aslan, \"CRISPR-Cas:  A small RNA-mediated bacterial immune system\"',NULL,'B102 Chemical & Life Sciences Laboratory, 601 S. Goodwin Ave., Urbana','Dr. Rachel Whitaker, Assistant Professor of Microbiology','Diane Tsevelekos','microsem@illinois.edu','333-1736','Seminar','Microbiology Department','2013-02-12 22:00:00','2013-02-12 06:00:00','2013-01-08 17:30:09','2013-01-08 17:30:09'),(1825,'27290760','2/14/2013','4:00 pm','2/14/2013',NULL,'Microbiology Seminar:  Dr. Daniel Amador-Noguez, \"Metabolomics of clostridial biofuel production\"',NULL,'B102 Chemical & Life Sciences Laboratory, 601 S. Goodwin Ave., Urbana','Dr. James Imlay, Professor of Microbiology','Diane Tsevelekos','microsem@illinois.edu','333-1736','Seminar','Microbiology Department','2013-02-14 22:00:00','2013-02-14 06:00:00','2013-01-08 17:35:08','2013-01-08 17:35:08'),(1830,'27439038','1/17/2013','12:00 pm','1/17/2013',NULL,'Seminar of Special Interest - Dr. Jianjun Sun, PhD-\"Ovulation requires female reproductive tract secretions controlled by NR5a-family nuclear hormone receptors\"',NULL,'B102 CLSL','School of MCB/MIP/CDB',NULL,NULL,NULL,'Seminar','Molecular and Integrative Physiology (MIP) Department Seminar Series','2013-01-17 18:00:00','2013-01-17 06:00:00','2013-01-14 15:20:08','2013-01-14 15:20:08'),(1834,'24927491','3/1/2013','12:00 pm','3/1/2013','1:00 pm','Biochemistry Seminar: Dr. David H. Price, University of Iowa ,\"Mechanisms of RNA Polymerase II Elongation Control: The role of Gdown1 and Myc as non-sequence specific factors\"','http://www.uiowa.edu/~pricelab','B102 CLSL','Dr. Lin-Feng Chen','Cara L. Day','caraday@illinois.edu','217.333.2013','Seminar','Biochemistry Department Seminars','2013-03-01 18:00:00','2013-03-01 19:00:00','2013-01-15 17:25:08','2013-01-15 17:25:08'),(1835,'23673425','1/23/2013','4:00 pm','1/23/2013',NULL,'Dr. David Kranz, Philip A. Sharp Professor of Biochemistry, \"Engineering adoptive T cell therapies of cancer\"',NULL,'116 RAL','Department of Biochemistry',NULL,NULL,NULL,'Seminar','Biochemistry Department Graduate Seminars','2013-01-23 22:00:00','2013-01-23 06:00:00','2013-01-15 19:30:09','2013-01-15 19:30:09'),(1836,'27290746','1/24/2013','4:00 pm','1/24/2013',NULL,'*CANCELLED* Microbiology Seminar:  Dr. Michael Konopka, \"Single-cell analysis:  connecting cellular biochemistry to cell population behavior\"',NULL,'B102 Chemical & Life Sciences Laboratory, 601 S. Goodwin Ave., Urbana','Dr. William Metcalf, Professor','Diane Tsevelekos','microsem@illinois.edu','333-1736','Seminar','Microbiology Department','2013-01-24 22:00:00','2013-01-24 06:00:00','2013-01-15 21:25:09','2013-01-15 21:25:09'),(1837,'27340344','1/25/2013','3:00 pm','1/25/2013',NULL,'*Special Seminar* Carl Woese Memorial Lecture:  Dr. Norman Pace, \"Following Carl Woese into the Natural Microbial World\"',NULL,'100 Noyes Laboratory, 505 South Matthews Avenue, Urbana','Department of Microbiology and Institute of Genomic Biology','Diane Tsevelekos','microsem@illinois.edu','333-1736','Seminar','Microbiology Department','2013-01-25 21:00:00','2013-01-25 06:00:00','2013-01-15 21:30:08','2013-01-15 21:30:08'),(1840,'27515906','2/14/2013','12:00 pm','2/14/2013',NULL,'\"Cell plasticity in pancreatic development, regeneration, and cancer.\"',NULL,NULL,'CDB/MIP','Teresa Bice','tbice@illinois.edu','217-300-0419',NULL,'MCB Events','2013-02-14 18:00:00','2013-02-14 06:00:00','2013-01-17 21:00:09','2013-01-17 21:00:09'),(1844,'25548591','3/5/2013','4:30 pm','3/5/2013',NULL,'***Postponed***Hong Investiture',NULL,'Auditorium-Spurlock Museum, 600 South Gregory Street, Urbana, IL','Roy and Eva Hong',NULL,NULL,NULL,NULL,'MCB Events','2013-03-05 22:30:00','2013-03-05 06:00:00','2013-01-18 22:10:09','2013-01-18 22:10:09'),(1847,'27520812','1/31/2013','12:00 pm','1/31/2013',NULL,'Seminar of Special Interest - Dr. Jason Tennessen, Univ. of Utah, Dept. of Human Genetics - \"Studies of Cancer Metabolism using Drosophila as a Model System\"','http://www.sci.utah.edu/people/jasont.html','B102 CLSL','MCB/MIP/CDB','Penny Morman','morman@illinois.edu','217-333-8275','Seminar','Molecular and Integrative Physiology (MIP) Department Seminar Series','2013-01-31 18:00:00','2013-01-31 06:00:00','2013-01-23 20:20:08','2013-01-23 20:20:08'),(1850,'25013921','3/15/2013','12:00 pm','3/15/2013','1:00 pm','Biochemistry Seminar: Dr. Axel Brunger, Stanford School of Medicine, \"Reconstitution of calcium-triggered synaptic vesicle fusion\"','http://med.stanford.edu/profiles/frdActionServlet?choiceId=facProfile&fid=4344','B102 CLSL','Dr. Rudy Fratti','Cara L. Day','caraday@illinois.edu','217.333.2013','Seminar','Biochemistry Department Seminars','2013-03-15 17:00:00','2013-03-15 18:00:00','2013-01-24 14:55:08','2013-01-24 14:55:08'),(1852,'21566483','2/13/2013','12:00 pm','2/13/2013','1:00 pm','CDB Student & Postdoc Seminar, Paul Hamilton & Nimish Khanna',NULL,'B102 CLSL','Cell & Developmental Biology Department','Shannon Croft','shannon9@life.illinois.edu','(217) 333-6118','Lecture','Cell and Developmental Biology (CDB) Student & Postdoc Seminars','2013-02-13 18:00:00','2013-02-13 19:00:00','2013-01-24 22:30:08','2013-01-24 22:30:08'),(1853,'27521670','2/11/2013','12:00 pm','2/11/2013',NULL,'\"Systems Analysis of Mouse Hematopoietic Stem Cells in Vivo at the Single Cell Level\"',NULL,'B102 Chemical and Life Sciences Laboratory','CDB/MIP','Teresa Bice','tbice@illinois.edu','217-300-0419',NULL,'MCB Events','2013-02-11 18:00:00','2013-02-11 06:00:00','2013-01-24 23:00:09','2013-01-24 23:00:09'),(1855,'23673461','2/6/2013','4:00 pm','2/6/2013',NULL,'Jason Bouvier (Gerlt Lab) - \"Characterization of Putative Acid-Sugar Dehydratases from Agrobacterium tumefaciens\"',NULL,'116 RAL','Department of Biochemistry',NULL,NULL,NULL,'Seminar','Biochemistry Department Graduate Seminars','2013-02-06 22:00:00','2013-02-06 06:00:00','2013-01-28 17:15:08','2013-01-28 17:15:08'),(1856,'23673462','2/6/2013','4:00 pm','2/6/2013',NULL,'Pei Wang (Huang Lab) - \"Structure of Pnkp1/Hen1/Rnl Heterohexamer: A New RNA Repair Complex\"',NULL,'116 RAL','Department of Biochemistry',NULL,NULL,NULL,'Seminar','Biochemistry Department Graduate Seminars','2013-02-06 22:00:00','2013-02-06 06:00:00','2013-01-30 19:10:08','2013-01-30 19:10:08'),(1858,'27526755','4/25/2013','5:00 pm','4/25/2013','6:00 pm','Undergraduate Research Information Session',NULL,'161 Noyes Lab','MCB Advising',NULL,NULL,NULL,NULL,'MCB Undergraduate Events','2013-04-25 22:00:00','2013-04-25 23:00:00','2013-01-30 21:00:09','2013-01-30 21:00:09'),(1860,'27529875','4/30/2013','5:00 pm','4/30/2013','6:00 pm','Careers in Genetics',NULL,'161 Noyes Lab','MCB Advising',NULL,NULL,NULL,NULL,'MCB Undergraduate Events','2013-04-30 22:00:00','2013-04-30 23:00:00','2013-02-01 17:05:08','2013-02-01 17:05:08'),(1862,'27529880','3/28/2013','5:00 pm','3/28/2013','6:00 pm','How to Work a Job Fair',NULL,'161 Noyes Lab','MCB Advising',NULL,NULL,NULL,NULL,'MCB Undergraduate Events','2013-03-28 22:00:00','2013-03-28 23:00:00','2013-02-01 17:15:08','2013-02-01 17:15:08'),(1863,'26011578','2/7/2013','4:00 pm','2/7/2013',NULL,'Microbiology Seminar:  Dr. Vadim Gladyshev, \"Understanding redox control and aging through genome analyses\"',NULL,'B102 Chemical & Life Sciences Laboratory, 601 S. Goodwin Ave., Urbana','Dr. James Imlay, Professor of Microbiology','Diane Tsevelekos','microsem@illinois.edu','333-1736','Seminar','Microbiology Department','2013-02-07 22:00:00','2013-02-07 06:00:00','2013-02-01 20:50:08','2013-02-01 20:50:08'),(1865,'23673464','2/13/2013','4:00 pm','2/13/2013',NULL,'Kiruthika Selvadurai (Huang Lab) - \"Biochemical and Structural Studies of the Elongator Complex\"',NULL,'116 RAL','Department of Biochemistry',NULL,NULL,NULL,'Seminar','Biochemistry Department Graduate Seminars','2013-02-13 22:00:00','2013-02-13 06:00:00','2013-02-05 15:15:09','2013-02-05 15:15:09'),(1870,'27138993','2/7/2013','12:00 pm','2/7/2013',NULL,'**Postponed**\"Dissecting Systematic mediators of cancer metastasis:  Focus on tumor-microenvironment interactions\"',NULL,'B102 CLSL','CDB/MIP','Teresa Bice','tbice@illinois.edu','217-300-0419',NULL,'MCB Events','2013-02-07 18:00:00','2013-02-07 06:00:00','2013-02-07 16:10:09','2013-02-07 16:10:09'),(1871,'27534746','3/4/2013','12:00 pm','3/4/2013',NULL,'Dr. Swarnali Acharyya \"Dissecting Systematic mediators of cancer metastasis:  Focus on tumor-microenvironment interactions\"',NULL,'B102 CLSL','CDB/MIP','Teresa Bice','tbice@illinois.edu','217-300-0419',NULL,'MCB Events','2013-03-04 18:00:00','2013-03-04 06:00:00','2013-02-07 16:10:10','2013-02-07 16:10:10'),(1872,'27534745','3/7/2013','12:00 pm','3/7/2013',NULL,'Dr. Joyce Muhan Chen \"PHLPPing Cancers:  a novel tumor suppression network\"',NULL,'B102 CLSL','CDB/MIP','Teresa Bice','tbice@illinois.edu','217-300-0419',NULL,'MCB Events','2013-03-07 18:00:00','2013-03-07 06:00:00','2013-02-07 16:10:10','2013-02-07 16:10:10'),(1873,'27520814','2/7/2013','12:00 pm','2/7/2013',NULL,'CANCELLED - Seminar of Special Interest - Dr. Swarnali Acharyya, Memorial Sloan-Kettering Cancer Center, Dept. of Cancer Biology and Genetics - \"Dissecting systematic mediators of cancer metastasis: Focus on tumor-microenvironment interactions\"','http://www.mskcc.org/research/lab/joan-massague/member/swarnali-acharyya','B102 CLSL','MCB/MIP/CDB','Penny Morman','morman@illinois.edu','217-333-8275','Seminar','Molecular and Integrative Physiology (MIP) Department Seminar Series','2013-02-07 18:00:00','2013-02-07 06:00:00','2013-02-07 19:15:09','2013-02-07 19:15:09'),(1874,'27534873','2/11/2013','12:00 pm','2/11/2013',NULL,'Seminar of special interest - Rong Lu, Ph.D., Stanford University, Institute for Stem Cell Biology and Regenerative Medicine, \" Systems Analysis of Mouse Hematopoetic Stem Cells in Vivo at the Single Cell Level\"',NULL,'B102 CLSL','MCB/MIP/CDB','Penny Morman','morman@illinois.edu',NULL,'Seminar','Molecular and Integrative Physiology (MIP) Department Seminar Series','2013-02-11 18:00:00','2013-02-11 06:00:00','2013-02-07 19:15:09','2013-02-07 19:15:09'),(1875,'27535064','5/10/2013','12:00 pm','5/10/2013','1:00 pm','CBI TP/Biochemistry Joint Seminar: Dr. Robert Cichewicz (University of Oklahoma) \'Application of Fungi and Bacteria as Biological Factories for the Production of Bioactive Secondary Metabolites\'','http://chem.ou.edu/robert-h-cichewicz','B102 CLSL','Manuel Ortega, CBI Training Program Fellow','Nan Holda','holda@illinois.edu','217.244-5450','Seminar','Biochemistry Department Seminars','2013-05-10 17:00:00','2013-05-10 18:00:00','2013-02-07 23:10:09','2013-02-07 23:10:09'),(1876,'21566487','3/5/2013','12:00 pm','3/5/2013','1:00 pm','CDB Student & Postdoc Seminar, Alvin Thomas & Hui-Chia Yu',NULL,'B102 CLSL','Cell & Developmental Biology Department','Shannon Croft','shannon9@life.illinois.edu','(217) 333-6118','Lecture','Cell and Developmental Biology (CDB) Student & Postdoc Seminars','2013-03-05 18:00:00','2013-03-05 19:00:00','2013-02-08 16:50:09','2013-02-08 16:50:09'),(1877,'26011581','2/28/2013','4:00 pm','2/28/2013',NULL,'Microbiology Seminar:  Dr. Karen Ottemann, \"How Helicobactor pylori uses chemotaxis and outermembrane proteins to manipulate host inflamation\"',NULL,'B102 Chemical & Life Sciences Laboratory, 601 S. Goodwin Ave., Urbana','Dr. Steven Blanke, Professor of Microbiology','Diane Tsevelekos','microsem@illinois.edu','333-1736','Seminar','Microbiology Department','2013-02-28 22:00:00','2013-02-28 06:00:00','2013-02-08 18:00:09','2013-02-08 18:00:09'),(1879,'23673463','2/13/2013','4:00 pm','2/13/2013',NULL,'Ranjani Murali (Gennis) - \"Isolation and characterization of terminal reductases\".',NULL,'116 RAL','Department of Biochemistry',NULL,NULL,NULL,'Seminar','Biochemistry Department Graduate Seminars','2013-02-13 22:00:00','2013-02-13 06:00:00','2013-02-11 14:40:08','2013-02-11 14:40:08'),(1880,'23673465','2/20/2013','4:00 pm','2/20/2013',NULL,'Irisbel Guzman Sanchez (Gruebele Lab) - \"The extracellular protein VlsE is destabilized inside cells\"',NULL,'116 RAL','Department of Biochemistry',NULL,NULL,NULL,'Seminar','Biochemistry Department Graduate Seminars','2013-02-20 22:00:00','2013-02-20 06:00:00','2013-02-11 15:50:08','2013-02-11 15:50:08'),(1881,'21566482','2/18/2013','12:00 pm','2/18/2013','1:00 pm','CDB Student & Postdoc Seminar, Ruiqi Liao',NULL,'B102 CLSL','Cell & Developmental Biology Department','Shannon Croft','shannon9@life.illinois.edu','(217) 333-6118','Lecture','Cell and Developmental Biology (CDB) Student & Postdoc Seminars','2013-02-18 18:00:00','2013-02-18 19:00:00','2013-02-11 17:25:08','2013-02-11 17:25:08'),(1882,'27537954','4/22/2013','12:00 pm','4/22/2013','1:00 pm','CDB Student & Postdoc Seminar, Dr. Melanie Issigonis',NULL,'B102 CLSL','Cell & Developmental Biology Department','Shannon Croft','shannon9@life.illinois.edu','(217) 333-6118','Lecture','Cell and Developmental Biology (CDB) Student & Postdoc Seminars','2013-04-22 17:00:00','2013-04-22 18:00:00','2013-02-11 17:30:08','2013-02-11 17:30:08'),(1884,'27467640','3/28/2013','12:00 pm','3/28/2013',NULL,'MIP Graduate Student Seminar - Kieren Normoyle (William Brieher lab) \"Cyclase Associated Protein Accelerates Physiological Actin Disassembly via Enhancement of Actin Dissociation\" and Ting Fu (Kim Kemper Lab) \"miRNA-34a contributes to the FGF21 resistance in obesity\"',NULL,NULL,'Dept. of MIP','Penny Morman','morman@illinois.edu','217-333-8275','Seminar','Molecular and Integrative Physiology (MIP) Department Seminar Series','2013-03-28 17:00:00','2013-03-28 05:00:00','2013-02-13 18:00:10','2013-02-13 18:00:10'),(1885,'27539621','2/21/2013','12:00 pm','2/21/2013',NULL,'Seminar of Special Interest - Danielle Maatouk, Ph.D., Duke University - \"Mechanisms of cell fate determination during mammalian gonad development\"',NULL,'B102 CLSL','MCB/MIP/CDB','Penny Morman','morman@illinois.edu','217-333-8275','Seminar','Molecular and Integrative Physiology (MIP) Department Seminar Series','2013-02-21 18:00:00','2013-02-21 06:00:00','2013-02-13 18:20:08','2013-02-13 18:20:08'),(1886,'27539622','2/28/2013','12:00 pm','2/28/2013',NULL,'Seminar of Special Interest - Christy Hagan, Ph.D., Univ. of MN, Dept. of Medicine and Women\'s Cancer Program - \"ck2-dependent Phosphorylation of Progesterone Receptors Mediates Proliferative Signaling in Breast Cancer\"',NULL,'B102 CLSL','MCB/MIP/CDB','Penny Morman','morman@illinois.edu','217-333-8275','Seminar','Molecular and Integrative Physiology (MIP) Department Seminar Series','2013-02-28 18:00:00','2013-02-28 06:00:00','2013-02-13 18:25:09','2013-02-13 18:25:09'),(1887,'27539623','3/4/2013','12:00 pm','3/4/2013',NULL,'Seminar of Special Interest - Swarnali Acharyya, Ph.D., Memorial Sloan-Kettering Cancer Center, Dept. of Cancer Biology and Genetics, \"Dissecting systematic mediators of cancer metastasis: Focus on tumor-microenvironment interactions\"',NULL,'B102 CLSL','MCB/MIP/CDB','Penny Morman','morman@illinois.edu','217-333-8275','Lecture','Molecular and Integrative Physiology (MIP) Department Seminar Series','2013-03-04 18:00:00','2013-03-04 06:00:00','2013-02-13 18:25:09','2013-02-13 18:25:09'),(1888,'27520818','2/14/2013','12:00 pm','2/14/2013',NULL,'Seminar of Special Interest - Janel Kopp, Ph.D., Univ. of CA at San Diego, Sanford Consortium for Regenerative Medicine - \"Cell plasticity in pancreatic development, regeneration, and cancer\"',NULL,'B102 CLSL','MCB/MIP/CDB','Penny Morman','morman@illinois.edu','217-333-8275','Seminar','Molecular and Integrative Physiology (MIP) Department Seminar Series','2013-02-14 18:00:00','2013-02-14 06:00:00','2013-02-13 18:30:08','2013-02-13 18:30:08'),(1889,'23673466','2/20/2013','4:00 pm','2/20/2013',NULL,'Yue Hao (Nair Lab) - \"Gene Structural Studies of Tailoring Enzymes that Modify Ribosomal Peptide Antibiotics\"',NULL,'116 RAL','Department of Biochemistry',NULL,NULL,NULL,'Seminar','Biochemistry Department Graduate Seminars','2013-02-20 22:00:00','2013-02-20 06:00:00','2013-02-13 20:30:08','2013-02-13 20:30:08'),(1890,'23673415','2/27/2013','4:00 pm','2/27/2013',NULL,'Seyed Torabi (Lu Lab) - \"In Vitro Selection and Application of Metal-Specific DNAzymes\"',NULL,'116 RAL','Department of Biochemistry',NULL,NULL,NULL,'Seminar','Biochemistry Department Graduate Seminars','2013-02-27 22:00:00','2013-02-27 06:00:00','2013-02-18 14:50:08','2013-02-18 14:50:08'),(1891,'27529725','2/21/2013','12:00 pm','2/21/2013',NULL,'\"Mechanisms of cell fate determination during mammalian gonad development\" by Dr. Danielle Maatouk',NULL,'B102 CLSL','CDB/MIP','Teresa Bice','tbice@illinois.edu','217-300-0419',NULL,'MCB Events','2013-02-21 18:00:00','2013-02-21 06:00:00','2013-02-18 14:55:08','2013-02-18 14:55:08'),(1892,'27543970','4/4/2013','12:00 pm','4/4/2013',NULL,'Lingjun Li, PhD., University of Wisconsin-Madison, \"Expanding the Chemical Toolbox to Probe Neuronal Signaling\"',NULL,'B102 CLSL','Chemistry-Biology Interface Training Program and the Dept. of Molecular & Integrative Physiology','Nan Holda','holda@illinois.edu','217-244-5450','Lecture','Molecular and Integrative Physiology (MIP) Department Seminar Series','2013-04-04 17:00:00','2013-04-04 05:00:00','2013-02-19 17:00:09','2013-02-19 17:00:09'),(1893,'23673405','2/27/2013','4:00 pm','2/27/2013',NULL,'Rodney Burton (Crofts Lab) - \"Qo site of the bc1 Complex; Unlocking the Gate of the Electron Transport Chain\"',NULL,'116 RAL','Department of Biochemistry',NULL,NULL,NULL,'Seminar','Biochemistry Department Graduate Seminars','2013-02-27 22:00:00','2013-02-27 06:00:00','2013-02-20 19:15:08','2013-02-20 19:15:08'),(1895,'27548346','3/7/2013','12:00 pm','3/7/2013',NULL,'Seminar of Special Interest - Muhan Chen, Ph.D., Cold Spring Harbor Laboratory, Cancer Center - \"PHLPPing Cancers: a novel tumor supression network\"',NULL,'B102 CLSL','MCB/MIP/CDB','Penny Morman','morman@illinois.edu','217-333-8275','Seminar','Molecular and Integrative Physiology (MIP) Department Seminar Series','2013-03-07 18:00:00','2013-03-07 06:00:00','2013-02-21 20:45:08','2013-02-21 20:45:08'),(1896,'27548345','3/4/2013','12:00 pm','3/4/2013',NULL,'Seminar of Special Interest - Swarnali Acharyya, Ph.D., Memorial Sloan-Kettering Cancer Center, Dept. of Cancer Biology and Genetics - \"Dissecting systematic mediators of cancer metastasis: Focus on tumor-microenvironment interactions\"',NULL,'B102 CLSL','MCB/MIP/CDB','Penny Morman','morman@illinois.edu','217-333-8275','Seminar','Molecular and Integrative Physiology (MIP) Department Seminar Series','2013-03-04 18:00:00','2013-03-04 06:00:00','2013-02-21 20:50:09','2013-02-21 20:50:09'),(1898,'27519661','2/28/2013','12:00 pm','2/28/2013',NULL,'***Postponed*** \"ck2-dependent Phosphorylation of Progesterone Receptors Mediates Proliferative Signaling in Breast Cancer\"',NULL,'B102 CLSL','CDB/MIP','Teresa Bice','tbice@illinois.edu','300-0419',NULL,'MCB Events','2013-02-28 18:00:00','2013-02-28 06:00:00','2013-02-25 15:00:08','2013-02-25 15:00:08'),(1899,'21863822','4/3/2013','12:00 pm','4/3/2013',NULL,'Cell &  Developmental Biology Seminar:   Dr. Angelika Amon, Massachusetts Institute of Technology, \"Consequences of aneuploidy\"',NULL,'B102 CLSL','Cell & Developmental Biology','Elaine Rodgers; Lisa Stubbs','erodgers@life.illinois.edu','217-265-5511','Seminar','Cell and Developmental Biology (CDB) Departmental Seminars','2013-04-03 17:00:00','2013-04-03 05:00:00','2013-02-25 17:05:08','2013-02-25 17:05:08'),(1900,'27632784','3/14/2013','12:00 pm','3/14/2013',NULL,'Dr. Christy Hagan \"ck2-dependent Phosphorylation of Progesterone Receptors Mediates Proliferative Signaling in Breast Cancer\"',NULL,'B102 CLSL','CDB/MIP','Teresa Bice','tbice@illinois.edu','217-300-0419',NULL,'MCB Events','2013-03-14 17:00:00','2013-03-14 05:00:00','2013-02-25 19:40:08','2013-02-25 19:40:08'),(1901,'23673469','3/6/2013','4:00 pm','3/6/2013',NULL,'Manuel Ortega - Ford Fellow -  (van der Donk Lab) - \'Characterization of the substrate specificity of ElxP: the lantibiotic peptidase involved in Epilancin 15X biosynthesis\'',NULL,'116 RAL','Department of Biochemistry',NULL,NULL,NULL,'Seminar','Biochemistry Department Graduate Seminars','2013-03-06 22:00:00','2013-03-06 06:00:00','2013-02-25 19:45:09','2013-02-25 19:45:09'),(1902,'25013920','3/8/2013','12:00 pm','3/8/2013','1:00 pm','Biochemistry Seminar: Dr. Eric Schmidt, University of Utah Health Sciences Center, \"Substrate Evolution in  Cyanobactin Biosynthesis\"','http://www.pharmacy.utah.edu/medchem/faculty/schmidt.html','B102 CLSL','Dr. Lin-Feng Chen','Cara L. Day','caraday@illinois.edu','217.333.2013','Seminar','Biochemistry Department Seminars','2013-03-08 18:00:00','2013-03-08 19:00:00','2013-02-26 19:10:08','2013-02-26 19:10:08'),(1903,'26011584','3/14/2013','4:00 pm','3/14/2013',NULL,'Microbiology Seminar:  Dr. Timothy Donohue, \"How bacteria respond to signlet oxygen\"',NULL,'B102 Chemical & Life Sciences Laboratory, 601 S. Goodwin Ave., Urbana','Dr. Cari Vanderpool, Assistant Professor of Microbiology','Diane Tsevelekos','microsem@illinois.edu','333-1736','Seminar','Microbiology Department','2013-03-14 21:00:00','2013-03-14 05:00:00','2013-02-27 16:15:09','2013-02-27 16:15:09'),(1904,'26014396','3/28/2013','4:00 pm','3/28/2013',NULL,'Microbiology Seminar:  Dr. Brian Coombes, \"Pathogenic and commensal bacteria in chronic gut disorders:  Old dogs and new tricks\"',NULL,'B102 Chemical & Life Sciences Laboratory, 601 S. Goodwin Ave., Urbana','Dr. James Slauch, Professor of Microbiology','Diane Tsevelekos','microsem@illinois.edu','333-1736','Seminar','Microbiology Department','2013-03-28 21:00:00','2013-03-28 05:00:00','2013-02-27 20:10:09','2013-02-27 20:10:09'),(1905,'23673470','3/6/2013','4:00 pm','3/6/2013',NULL,'Ismaeel Muhamed (Leckband) - \"Cadherin-mediated mechanotransduction\"',NULL,'116 RAL','Department of Biochemistry',NULL,NULL,NULL,'Seminar','Biochemistry Department Graduate Seminars','2013-03-06 22:00:00','2013-03-06 06:00:00','2013-02-27 20:40:09','2013-02-27 20:40:09'),(1907,'21566485','3/11/2013','12:00 pm','3/11/2013','1:00 pm','CDB Student & Postdoc Seminar, Annie Weisner & Sumanprava Giri',NULL,'B102 CLSL','Cell & Developmental Biology Department','Shannon Croft','shannon9@life.illinois.edu','(217) 333-6118','Lecture','Cell and Developmental Biology (CDB) Student & Postdoc Seminars','2013-03-11 17:00:00','2013-03-11 18:00:00','2013-03-01 20:10:08','2013-03-01 20:10:08'),(1908,'27798011','3/12/2013','5:00 pm','3/12/2013','6:00 pm','Careers in MCB: Cytotechnology',NULL,'161 Noyes Lab','MCB Advising',NULL,NULL,NULL,NULL,'MCB Undergraduate Events','2013-03-12 22:00:00','2013-03-12 23:00:00','2013-03-04 16:05:09','2013-03-04 16:05:09'),(1909,'27529879','3/26/2013','5:00 pm','3/26/2013','6:00 pm','How to Build a Science Resume',NULL,'161 Noyes Lab','MCB Advising',NULL,NULL,NULL,NULL,'MCB Undergraduate Events','2013-03-26 22:00:00','2013-03-26 23:00:00','2013-03-04 16:20:08','2013-03-04 16:20:08'),(1910,'21863814','3/6/2013','12:00 pm','3/6/2013',NULL,'**CANCELLED** Cell &  Developmental Biology Seminar:   Dr. David Spector, Cold Spring Harbor Laboratory, \"Regulating Gene Expression through Transcriptional Compensation\"',NULL,'B102 CLSL','Cell & Developmental Biology','Elaine Rodgers; Lisa Stubbs','erodgers@life.illinois.edu','217-265-5511','Seminar','Cell and Developmental Biology (CDB) Departmental Seminars','2013-03-06 18:00:00','2013-03-06 06:00:00','2013-03-04 16:35:09','2013-03-04 16:35:09'),(1913,'23673478','3/13/2013','4:00 pm','3/13/2013',NULL,'Yi Yu (van der Donk Lab) - \"Yeast Surface Display of Lanthipeptide Leader Peptides \"',NULL,'116 RAL','Department of Biochemistry',NULL,NULL,NULL,'Seminar','Biochemistry Department Graduate Seminars','2013-03-13 21:00:00','2013-03-13 05:00:00','2013-03-06 15:10:09','2013-03-06 15:10:09'),(1914,'23673471','3/13/2013','4:00 pm','3/13/2013',NULL,'Preeti Sharma (Kranz Lab) - \"Engineering receptors involved in immune responses against bacterial toxins\"',NULL,'116 RAL','Department of Biochemistry',NULL,NULL,NULL,'Seminar','Biochemistry Department Graduate Seminars','2013-03-13 21:00:00','2013-03-13 05:00:00','2013-03-06 19:20:08','2013-03-06 19:20:08'),(1915,'27971458','3/14/2013','12:00 pm','3/14/2013',NULL,'Christy Hagan, PhD, Univ. of MN, Dept. of Medicine & Women\'s Cancer Program-Title - \"ck2-dependent Phosphorylation of Progesterone Receptors Mediates Proliferative Signaling in Breast Cancer\"',NULL,'B102 CLSL','MCB/MIP/CDB','Lori Raetzman, PhD','raetzman@illinois.edu','217-24-6233','Seminar','Molecular and Integrative Physiology (MIP) Department Seminar Series','2013-03-14 17:00:00','2013-03-14 05:00:00','2013-03-12 13:45:08','2013-03-12 13:45:08'),(1918,'23673460','3/27/2013','4:00 pm','3/27/2013',NULL,'Herbert E. Carter Fellow: Emilia Calvaresi (Hergenrother Lab) - \"Development and Evaluation of Lactate Dehydrogenase A Inhibitors as Anticancer Agents Targeting the Warburg Effect.\"',NULL,'116 RAL','Department of Biochemistry',NULL,NULL,NULL,'Seminar','Biochemistry Department Graduate Seminars','2013-03-27 21:00:00','2013-03-27 05:00:00','2013-03-12 21:10:08','2013-03-12 21:10:08'),(1919,'27526753','4/4/2013','5:00 pm','4/4/2013','6:30 pm','Pre-Health Career Panel:  Get advice from Medical and Dental Experts',NULL,'165 Noyes Lab','MCB Advising',NULL,NULL,NULL,NULL,'MCB Undergraduate Events','2013-04-04 22:00:00','2013-04-04 23:30:00','2013-03-13 21:35:09','2013-03-13 21:35:09'),(1920,'28002616','4/2/2013','5:00 pm','4/2/2013','6:00 pm','Careers in MCB: Industry',NULL,'161 Noyes Lab','MCB Advising',NULL,NULL,NULL,NULL,'MCB Undergraduate Events','2013-04-02 22:00:00','2013-04-02 23:00:00','2013-03-13 21:40:09','2013-03-13 21:40:09'),(1924,'28092439','4/5/2013','3:00 pm','4/5/2013',NULL,'FINAL DEFENSE - KE KE (Morrissey Lab) - \"The tissue factor-factor VII(a) complex in blood coagulation\"',NULL,'Room 354B Medical Science Building (MSB)','Department of Biochemistry',NULL,NULL,NULL,'Seminar','Biochemistry Department Graduate Seminars','2013-04-05 20:00:00','2013-04-05 05:00:00','2013-03-18 15:55:09','2013-03-18 15:55:09'),(1926,'26014399','4/4/2013','4:00 pm','4/4/2013',NULL,'Microbiology Seminar:  Dr. Ana Fernandez-Sesma, \"Immune modulation by influenza viruses\"',NULL,'B102 Chemical & Life Sciences Laboratory, 601 S. Goodwin Ave., Urbana','Dr. Joanna Shisler, Associate Professor of Microbiology','Diane Tsevelekos','microsem@illinois.edu','333-1736','Seminar','Microbiology Department','2013-04-04 21:00:00','2013-04-04 05:00:00','2013-03-22 18:25:09','2013-03-22 18:25:09'),(1927,'23673473','3/27/2013','4:00 pm','3/27/2013',NULL,'Parisa Hosseinzadeh (Lu Lab) - Engineering cytochrome c peroxidase into manganese peroxidase: exploring the role of non-covalent interactions in catalytic lignin degradation',NULL,'116 RAL','Department of Biochemistry',NULL,NULL,NULL,'Seminar','Biochemistry Department Graduate Seminars','2013-03-27 21:00:00','2013-03-27 05:00:00','2013-03-25 20:30:08','2013-03-25 20:30:08'),(1928,'25363579','4/29/2013','12:00 pm','4/29/2013','1:00 pm','CDB Student & Postdoc Seminar, Min Zeng & James Chu',NULL,'B102 CLSL','Cell & Developmental Biology Department','Shannon Croft','shannon9@life.illinois.edu','(217) 333-6118','Lecture','Cell and Developmental Biology (CDB) Student & Postdoc Seminars','2013-04-29 17:00:00','2013-04-29 18:00:00','2013-03-26 14:00:09','2013-03-26 14:00:09'),(1929,'23673472','4/10/2013','4:00 pm','4/10/2013',NULL,'Hanchao Zhao (Martinis Lab) - Discovery of a Tyrosine Switch within Candida albicans Leucyl-tRNA Synthetase CP1 domain',NULL,'116 RAL','Department of Biochemistry',NULL,NULL,NULL,'Seminar','Biochemistry Department Graduate Seminars','2013-04-10 21:00:00','2013-04-10 05:00:00','2013-03-26 14:50:09','2013-03-26 14:50:09'),(1930,'27136190','4/5/2013','12:00 pm','4/5/2013','1:00 pm','Biochemistry Seminar: Dr. Miljan Simonovic, University of Illinois at Chicago, \"Divergent strategies for tRNA recognition essential for translational fidelity\"','http://tigger.uic.edu/~msimon5/Home.html','B102 CLSL','Dr. Susan Martinis','Cara L. Day','caraday@illinois.edu','217.333.2013','Seminar','Biochemistry Department Seminars','2013-04-05 17:00:00','2013-04-05 18:00:00','2013-03-26 18:15:09','2013-03-26 18:15:09'),(1931,'26014402','4/11/2013','4:00 pm','4/11/2013',NULL,'Microbiology Seminar:  Dr. David Nelson, \"Chlamydial pathogenesis and interactions with the urogenital tract microbiota\"',NULL,'B102 Chemical & Life Sciences Laboratory, 601 S. Goodwin Ave., Urbana','Dr. Brenda Wilson, Professor of Microbiology','Diane Tsevelekos','microsem@illinois.edu','333-1736','Seminar','Microbiology Department','2013-04-11 21:00:00','2013-04-11 05:00:00','2013-03-26 19:40:09','2013-03-26 19:40:09'),(1932,'26017211','4/18/2013','4:00 pm','4/18/2013',NULL,'Microbiology Seminar:  Dr. Michael Glickman, \"Double Strand DNA Break Repair in Mycobacteria:  Novel Pathways of Repair and Response\"',NULL,'B102 Chemical & Life Sciences Laboratory, 601 S. Goodwin Ave., Urbana','Dr. Andrei Kuzminov, Associate Professor of Microbiology','Diane Tsevelekos','microsem@illinois.edu','333-1736','Seminar','Microbiology Department','2013-04-18 21:00:00','2013-04-18 05:00:00','2013-03-26 19:40:09','2013-03-26 19:40:09'),(1933,'27147555','3/29/2013','12:00 pm','3/29/2013','1:00 pm','Biochemistry Seminar: Dr. Marina Ramirez-Alvarado, Mayo Clinic \"When antibodies misbehave: Mechanisms of amyloid formation in Light Chain Amyloidosis\"','http://mayoresearch.mayo.edu/mayo/research/protein_misfolding_lab/','B102 CLSL','SACNAS and partially funded by SORF','Cara L. Day','caraday@illinois.edu','217.333.2013','Seminar','Biochemistry Department Seminars','2013-03-29 17:00:00','2013-03-29 18:00:00','2013-03-27 14:00:09','2013-03-27 14:00:09'),(1935,'21863844','4/10/2013','12:00 pm','4/10/2013',NULL,'Cell &  Developmental Biology Seminar:   Dr. Jacqueline Lees, Koch Institute for Integrative Cancer Research, Massachusetts Institute of Technology, \"New roles for the Rb tumor suppressor\"',NULL,'B102 CLSL','Cell & Developmental Biology','Elaine Rodgers; Lisa Stubbs','erodgers@life.illinois.edu','217-265-5511','Seminar','Cell and Developmental Biology (CDB) Departmental Seminars','2013-04-10 17:00:00','2013-04-10 05:00:00','2013-03-28 16:30:08','2013-03-28 16:30:08'),(1936,'18897235','4/12/2013','12:00 pm','4/12/2013','1:00 pm','Biochemistry Seminar: Dr. David Aggen - Biochemistry Trust of Urbana Awardee \"High Affinity Single-Chain T Cell Receptors for Cancer Immunotherapy\"','https://www.med.illinois.edu/msp/Students/Publications/?ID=6375','B102 CLSL','Dr. David Kranz','Cara L. Day','caraday@illinois.edu','217.333.2013','Seminar','Biochemistry Department Seminars','2013-04-12 17:00:00','2013-04-12 18:00:00','2013-03-29 19:30:09','2013-03-29 19:30:09'),(1937,'27535736','4/12/2013','2:00 pm','4/12/2013',NULL,'*Special Microbiology Seminar*  Dr. Rudolf Thauer, \"Flavin-based electron bifurcation, a novel mechanism of energy conservation in anaerobes\"',NULL,'B102 Chemical & Life Sciences Laboratory auditorium','Dr. Isaac Cann, Microbiology Affiliate Professor','Diane Tsevelekos','microsem@life.illinois.edu','333-1736','Seminar','Microbiology Department','2013-04-12 19:00:00','2013-04-12 05:00:00','2013-04-02 14:30:10','2013-04-02 14:30:10'),(1939,'23673418','4/10/2013','4:00 pm','4/10/2013',NULL,'Young Ahn (Gennis Lab) - \"The K proton-channel of C-family O2 reductase from Vibrio cholerae\"',NULL,'116 RAL','Department of Biochemistry',NULL,NULL,NULL,'Seminar','Biochemistry Department Graduate Seminars','2013-04-10 21:00:00','2013-04-10 05:00:00','2013-04-02 18:10:08','2013-04-02 18:10:08'),(1940,'23673476','4/17/2013','4:00 pm','4/17/2013',NULL,'Padmaja Venkatkrishnan (Gennis Lab) - \' The alternative NADH dehydrogenases in Thermus thermophilus\'',NULL,'116 RAL','Department of Biochemistry',NULL,NULL,NULL,'Seminar','Biochemistry Department Graduate Seminars','2013-04-17 21:00:00','2013-04-17 05:00:00','2013-04-04 19:35:09','2013-04-04 19:35:09'),(1941,'23673475','4/17/2013','4:00 pm','4/17/2013',NULL,'Shyamal Subramanyan (M. Spies/Ha) - \'Mediators and Modifications in Homologous Recombination\'',NULL,'116 RAL','Department of Biochemistry',NULL,NULL,NULL,'Seminar','Biochemistry Department Graduate Seminars','2013-04-17 21:00:00','2013-04-17 05:00:00','2013-04-11 20:10:16','2013-04-11 20:10:16'),(1942,'25013922','4/19/2013','12:00 pm','4/19/2013','1:00 pm','Biochemistry Seminar: Dr. Charles Barlowe, Geisel School of Medicine at Dartmouth, Hanover, New Hampshire, \"Coordinating COPII-Dependent Transport and ER Quality Control\"','http://geiselmed.dartmouth.edu/barlowe/','B102 CLSL','Dr. Lin-Feng Chen','Cara L. Day','caraday@illinois.edu','217.333.2013','Seminar','Biochemistry Department Seminars','2013-04-19 17:00:00','2013-04-19 18:00:00','2013-04-11 20:10:16','2013-04-11 20:10:16'),(1944,'27971463','4/18/2013','12:00 pm','4/18/2013',NULL,'Sean Smith, PhD, Director of Pharmacology in Neuroscience at Merck, Philadelphia, PA- Title \"Discovery and Development of PDE10A Inhibitors for the Treatment of Schizophrenia\"',NULL,'B102 CLSL','Dr. Victor D. Ramirez, Dept. of MIP','Victor D. Ramirez, M.D.','vdramire@ilinois.edu','217-333-8275','Seminar','Molecular and Integrative Physiology (MIP) Department Seminar Series','2013-04-18 17:00:00','2013-04-18 05:00:00','2013-04-12 19:00:10','2013-04-12 19:00:10'),(1945,'21863821','5/1/2013','12:00 pm','5/1/2013',NULL,'Cell &  Developmental Biology Seminar:   Dr. Susan Fisher,  University of California at San Francisco, \"Cell lines from single human blastomeres reveal clues to lineage allocation\"',NULL,'B102 CLSL','Cell & Developmental Biology','Elaine Rodgers; Lisa Stubbs','erodgers@life.illinois.edu','217-265-5511','Seminar','Cell and Developmental Biology (CDB) Departmental Seminars','2013-05-01 17:00:00','2013-05-01 05:00:00','2013-04-16 16:40:10','2013-04-16 16:40:10'),(1946,'28393579','5/2/2013','12:00 pm','5/2/2013',NULL,'MIP Graduate Student Seminar - Hatice Kaya (Dr. Milan Bagchi lab) - \"Molecular signaling mechanisms underlying differentiation of human endometrial stromal cells\" and Vesna Tosic (Dr. Edward Roy lab) \"Fusion protein of Interleukin- 15 (IL-15) and IL-15 receptor alpha enhances antitumor activity of myxoma virus\"',NULL,'B102 CLSL','Department of Molecular & Int. Physiology','Penny Morman','morman@illinois.edu','217-333-8275','Seminar','Molecular and Integrative Physiology (MIP) Department Seminar Series','2013-05-02 17:00:00','2013-05-02 05:00:00','2013-04-19 16:10:10','2013-04-19 16:10:10'),(1948,'21863818','4/24/2013','12:00 pm','4/24/2013',NULL,'**CANCELLED** Cell &  Developmental Biology Seminar:   Dr. Janet Rossant, University of Toronto, \"Stem cells and blastocyst development\"',NULL,'B102 CLSL','Cell & Developmental Biology','Elaine Rodgers; Lisa Stubbs','erodgers@life.illinois.edu','217-265-5511','Seminar','Cell and Developmental Biology (CDB) Departmental Seminars','2013-04-24 17:00:00','2013-04-24 05:00:00','2013-04-24 14:05:09','2013-04-24 14:05:09'),(1949,'28422044','5/1/2013','11:00 am','5/1/2013',NULL,'Final Defense - Benjamin Warlick (Gerlt Lab) - \"Functional Discovery and Promiscuity in the RuBisCo Superfamily\"',NULL,'Room 401 Roger Adams Lab (RAL)','Department of Biochemistry',NULL,NULL,NULL,'Seminar','Biochemistry Department Graduate Seminars','2013-05-01 16:00:00','2013-05-01 05:00:00','2013-04-29 13:35:10','2013-04-29 13:35:10'),(1952,'28565459','5/13/2013','12:00 pm','5/13/2013',NULL,'MIP Special Seminar - Graham R. Huesmann, MD/PhD,  Harvard Medical School, Massachusetts General Hospital - \"Misunderstood Proteins: Caspase-3 and Amyloid. Protective Mechanisms and Targets for Treatment.\"',NULL,'B102 CLSL','Dept. of MIP','Penny Morman','morman@illinois.edu','217-333-8275','Seminar','Molecular and Integrative Physiology (MIP) Department Seminar Series','2013-05-13 17:00:00','2013-05-13 05:00:00','2013-05-08 21:30:09','2013-05-08 21:30:09'),(1975,'28644027','6/6/2013','11:00 am','6/6/2013',NULL,'FINAL DEFENSE - AMY S. GLEKAS (Schuler lab)',NULL,'Room 401 Roger Adams Lab (RAL)','Department of Biochemistry',NULL,NULL,NULL,'Seminar','Biochemistry Department Graduate Seminars','2013-06-06 16:00:00','2013-06-06 05:00:00','2013-05-31 15:55:09','2013-05-31 15:55:09'),(1976,'28644029','6/13/2013','10:00 am','6/13/2013',NULL,'FINAL DEFENSE - NING SUN - (Zhao Lab)',NULL,'Room 117 Roger Adams Lab (RAL)','Department of Biochemistry',NULL,NULL,NULL,'Seminar','Biochemistry Department Graduate Seminars','2013-06-13 15:00:00','2013-06-13 05:00:00','2013-05-31 15:55:10','2013-05-31 15:55:10'),(1977,'28959697','7/11/2013','12:00 pm','7/11/2013',NULL,'FINAL DEFENSE - NEHA GARG (van der Donk/Nair Lab)',NULL,'Room 117 Roger Adams Lab (RAL)','Department of Biochemistry',NULL,NULL,NULL,'Seminar','Biochemistry Department Graduate Seminars','2013-07-11 17:00:00','2013-07-11 05:00:00','2013-05-31 15:55:10','2013-05-31 15:55:10'),(1979,'29045767','6/10/2013','2:00 pm','6/10/2013','3:00 pm','Biochemistry Seminar of Special Interest: Dr. Ian R. Booth, University of Aberdeen,\"Bacterial mechanosensitive channels: diversity in structure, but also function?\"','http://www.abdn.ac.uk/sms/staffprofile.php?id=i.r.booth','B124 CLSL','Dr. James Morrissey','Dr. James Morrissey','morrissey@illinois.edu','217.265-4036','Seminar','Biochemistry Department Seminars','2013-06-10 19:00:00','2013-06-10 20:00:00','2013-06-03 18:55:09','2013-06-03 18:55:09'),(1980,'29077145','7/4/2013',NULL,'7/4/2013',NULL,'Independence Day Holiday',NULL,NULL,'University of Illinois Board of Trustees',NULL,NULL,NULL,'Holiday','Holidays','2013-07-04 05:00:00','2013-07-04 05:00:00','2013-06-04 21:35:10','2013-06-04 21:35:10'),(1981,'29077146','9/2/2013',NULL,'9/2/2013',NULL,'Labor Day',NULL,NULL,'University of Illinois Board of Trustees',NULL,NULL,NULL,'Holiday','Holidays','2013-09-02 05:00:00','2013-09-02 05:00:00','2013-06-04 21:35:10','2013-06-04 21:35:10'),(1982,'11892813','11/28/2013',NULL,'11/28/2013',NULL,'Thanksgiving Day',NULL,NULL,'University of Illinois Board of Trustees',NULL,NULL,NULL,'Holiday','Holidays','2013-11-28 06:00:00','2013-11-28 06:00:00','2013-06-04 21:35:10','2013-06-04 21:35:10'),(1983,'29077147','11/29/2013',NULL,'11/29/2013',NULL,'Day After Thanksgiving - Designated Holiday',NULL,NULL,'University of Illinois Board of Trustees',NULL,NULL,NULL,'Special Event','Holidays','2013-11-29 06:00:00','2013-11-29 06:00:00','2013-06-04 21:35:10','2013-06-04 21:35:10'),(1984,'21350880','12/24/2013',NULL,'12/24/2013',NULL,'December 24',NULL,NULL,'Office of the Chancellor',NULL,NULL,NULL,'Holiday','Holidays','2013-12-24 06:00:00','2013-12-24 06:00:00','2013-06-04 21:35:10','2013-06-04 21:35:10'),(1985,'21350881','12/25/2013',NULL,'12/25/2013',NULL,'Christmas Day Holiday',NULL,NULL,'U-C Senate',NULL,NULL,NULL,'Holiday','Holidays','2013-12-25 06:00:00','2013-12-25 06:00:00','2013-06-04 21:35:10','2013-06-04 21:35:10'),(1986,'21350883','12/23/2013',NULL,'12/23/2013',NULL,'Reduced Service Day*',NULL,NULL,'U-C Senate',NULL,NULL,NULL,'Holiday','Holidays','2013-12-23 06:00:00','2013-12-23 06:00:00','2013-06-04 21:40:10','2013-06-04 21:40:10'),(1987,'21350882','12/26/2013',NULL,'12/26/2013',NULL,'Day after Christmas - Designated Holiday',NULL,NULL,'U-C Senate',NULL,NULL,NULL,'Holiday','Holidays','2013-12-26 06:00:00','2013-12-26 06:00:00','2013-06-04 21:40:10','2013-06-04 21:40:10'),(1988,'29077148','12/27/2013',NULL,'12/27/2013',NULL,'Reduced Service Day*',NULL,NULL,'U-C Senate',NULL,NULL,NULL,'Holiday','Holidays','2013-12-27 06:00:00','2013-12-27 06:00:00','2013-06-04 21:40:10','2013-06-04 21:40:10'),(1989,'21350885','12/30/2013',NULL,'12/30/2013',NULL,'Reduced Service Day*',NULL,NULL,'U-C Senate',NULL,NULL,NULL,'Holiday','Holidays','2013-12-30 06:00:00','2013-12-30 06:00:00','2013-06-04 21:45:10','2013-06-04 21:45:10'),(1990,'29077149','12/31/2013',NULL,'12/31/2013',NULL,'Reduced Service Day*',NULL,NULL,'U-C Senate',NULL,NULL,NULL,'Holiday','Holidays','2013-12-31 06:00:00','2013-12-31 06:00:00','2013-06-04 21:45:10','2013-06-04 21:45:10'),(1991,'29077150','1/1/2014',NULL,'1/1/2014',NULL,'New Year\'s Day',NULL,NULL,'University of Illinois Board of Trustees',NULL,NULL,NULL,'Holiday','Holidays','2014-01-01 06:00:00','2014-01-01 06:00:00','2013-06-04 21:45:10','2013-06-04 21:45:10'),(1992,'29077151','1/20/2014',NULL,'1/20/2014',NULL,'Martin Luther King Jr. Day - Designated Holiday',NULL,NULL,'University of Illinois Board of Trustees',NULL,NULL,NULL,'Holiday','Holidays','2014-01-20 06:00:00','2014-01-20 06:00:00','2013-06-04 21:45:10','2013-06-04 21:45:10'),(1998,'29198258','6/25/2013','11:00 am','6/25/2013',NULL,'FINAL DEFENSE - STACY L. KELLEY - (Drs. Tapping/Nair Labs)',NULL,'Room 117 Medical Sciences building (MSB)','Department of Biochemistry',NULL,NULL,NULL,'Seminar','Biochemistry Department Graduate Seminars','2013-06-25 16:00:00','2013-06-25 05:00:00','2013-06-14 15:05:10','2013-06-14 15:05:10'),(2000,'29250946','8/3/2013',NULL,'8/3/2013',NULL,'End of Summer Session 2',NULL,NULL,'U-C Senate',NULL,NULL,NULL,'Academic','Academic Dates','2013-08-03 05:00:00','2013-08-03 05:00:00','2013-06-20 20:40:09','2013-06-20 20:40:09'),(2001,'29250947','8/26/2013',NULL,'8/26/2013',NULL,'First Day of Instruction, Fall Semester',NULL,NULL,'U-C Senate',NULL,NULL,NULL,'Academic','Academic Dates','2013-08-26 05:00:00','2013-08-26 05:00:00','2013-06-20 20:40:09','2013-06-20 20:40:09'),(2002,'29250948','11/23/2013',NULL,'11/23/2013',NULL,'Thanksgiving Break Begins',NULL,NULL,'U-C Senate',NULL,NULL,NULL,'Academic','Academic Dates','2013-11-23 06:00:00','2013-11-23 06:00:00','2013-06-20 20:45:10','2013-06-20 20:45:10'),(2004,'29250950','12/11/2013',NULL,'12/11/2013',NULL,'Last Day of Instruction, Fall Semester',NULL,NULL,'U-C Senate',NULL,NULL,NULL,'Academic','Academic Dates','2013-12-11 06:00:00','2013-12-11 06:00:00','2013-06-20 20:45:10','2013-06-20 20:45:10'),(2005,'29250951','12/13/2013',NULL,'12/13/2013',NULL,'Final Exams Begin',NULL,NULL,'U-C Senate',NULL,NULL,NULL,'Academic','Academic Dates','2013-12-13 06:00:00','2013-12-13 06:00:00','2013-06-20 20:45:10','2013-06-20 20:45:10'),(2006,'29250952','1/21/2014',NULL,'1/21/2014',NULL,'First Day of Instruction, Spring Semester',NULL,NULL,'U-C Senate',NULL,NULL,NULL,'Academic','Academic Dates','2014-01-21 06:00:00','2014-01-21 06:00:00','2013-06-20 20:45:10','2013-06-20 20:45:10'),(2051,'29434728','8/29/2013','4:00 pm','8/29/2013',NULL,'Microbiology Seminar: \"Bacterial microcompartments, function assembly and selective permeability\"',NULL,'Charles G. Miller Auditorium, Room B102 Chemical & Life Sciences Laboratory','Dr. James Imlay, Professor','Diane Tsevelekos','microsem@life.illinois.edu','333-1736','Seminar','Microbiology Department','2013-08-29 21:00:00','2013-08-29 05:00:00','2013-07-15 21:40:09','2013-07-15 21:40:09'),(2054,'29629566','9/9/2013','12:00 pm','9/9/2013','1:00 pm','CDB Student & Postdoc Seminar, Yijie Geng & Dr. David Forsthoefel',NULL,'B102 CLSL','Cell & Developmental Biology Department','Shannon Croft','shannon9@life.illinois.edu','(217) 333-6118','Lecture','Cell and Developmental Biology (CDB) Student & Postdoc Seminars','2013-09-09 17:00:00','2013-09-09 18:00:00','2013-08-02 14:20:10','2013-08-02 14:20:10'),(2057,'29629919','8/22/2013','3:00 pm','8/22/2013',NULL,'FINAL DEFENSE - KATIE WHALEN - (M. A. Spies/Martinis Lab)',NULL,'401 RAL','Department of Biochemistry',NULL,NULL,NULL,'Seminar','Biochemistry Department Graduate Seminars','2013-08-22 20:00:00','2013-08-22 05:00:00','2013-08-02 14:25:10','2013-08-02 14:25:10'),(2058,'29629901','9/23/2013','12:00 pm','9/23/2013','1:00 pm','No Seminar',NULL,'B102 CLSL','Cell & Developmental Biology Department','Shannon Croft','shannon9@life.illinois.edu','(217) 333-6118','Lecture','Cell and Developmental Biology (CDB) Student & Postdoc Seminars','2013-09-23 17:00:00','2013-09-23 18:00:00','2013-08-02 14:25:10','2013-08-02 14:25:10'),(2083,'29629910','11/25/2013','12:00 pm','11/25/2013','1:00 pm','No Seminar',NULL,'B102 CLSL','Cell & Developmental Biology Department','Shannon Croft','shannon9@life.illinois.edu','(217) 333-6118','Lecture','Cell and Developmental Biology (CDB) Student & Postdoc Seminars','2013-11-25 18:00:00','2013-11-25 19:00:00','2013-08-02 15:10:10','2013-08-02 15:10:10'),(2085,'29629914','12/23/2013','12:00 pm','12/23/2013','1:00 pm','No Seminar',NULL,'B102 CLSL','Cell & Developmental Biology Department','Shannon Croft','shannon9@life.illinois.edu','(217) 333-6118','Lecture','Cell and Developmental Biology (CDB) Student & Postdoc Seminars','2013-12-23 18:00:00','2013-12-23 19:00:00','2013-08-02 15:10:10','2013-08-02 15:10:10'),(2086,'29629915','12/30/2013','12:00 pm','12/30/2013','1:00 pm','No Seminar',NULL,'B102 CLSL','Cell & Developmental Biology Department','Shannon Croft','shannon9@life.illinois.edu','(217) 333-6118','Lecture','Cell and Developmental Biology (CDB) Student & Postdoc Seminars','2013-12-30 18:00:00','2013-12-30 19:00:00','2013-08-02 15:10:10','2013-08-02 15:10:10'),(2087,'29629916','1/6/2014','12:00 pm','1/6/2014','1:00 pm','No Seminar',NULL,'B102 CLSL','Cell & Developmental Biology Department','Shannon Croft','shannon9@life.illinois.edu','(217) 333-6118','Lecture','Cell and Developmental Biology (CDB) Student & Postdoc Seminars','2014-01-06 18:00:00','2014-01-06 19:00:00','2013-08-02 15:10:10','2013-08-02 15:10:10'),(2088,'29629917','1/13/2014','12:00 pm','1/13/2014','1:00 pm','No Seminar',NULL,'B102 CLSL','Cell & Developmental Biology Department','Shannon Croft','shannon9@life.illinois.edu','(217) 333-6118','Lecture','Cell and Developmental Biology (CDB) Student & Postdoc Seminars','2014-01-13 18:00:00','2014-01-13 19:00:00','2013-08-02 15:10:10','2013-08-02 15:10:10'),(2089,'29629918','1/20/2014','12:00 pm','1/20/2014','1:00 pm','No Seminar',NULL,'B102 CLSL','Cell & Developmental Biology Department','Shannon Croft','shannon9@life.illinois.edu','(217) 333-6118','Lecture','Cell and Developmental Biology (CDB) Student & Postdoc Seminars','2014-01-20 18:00:00','2014-01-20 19:00:00','2013-08-02 15:10:10','2013-08-02 15:10:10'),(2150,'28783900','11/13/2013','12:00 pm','11/13/2013',NULL,'Cell &  Developmental Biology Seminar:   Dr. Craig Peterson, Univ. of Massachusetts Medical School, \"Chromatin dynamics: Putting histones in their place\"',NULL,'B102 CLSL','Cell & Developmental Biology Department','Elaine Rodgers; Phil Newmark','erodgers@life.illinois.edu; pnewmark@life.illinois.edu','217-265-5511','Seminar','Cell and Developmental Biology (CDB) Departmental Seminars','2013-11-13 18:00:00','2013-11-13 06:00:00','2013-08-06 15:05:09','2013-08-06 15:05:09'),(2155,'29629905','10/21/2013','12:00 pm','10/21/2013','1:00 pm','CDB Student & Postdoc Seminar, YoungUk Sun & Min Zeng',NULL,'B102 CLSL','Cell & Developmental Biology Department','Shannon Croft','shannon9@life.illinois.edu','(217) 333-6118','Lecture','Cell and Developmental Biology (CDB) Student & Postdoc Seminars','2013-10-21 17:00:00','2013-10-21 18:00:00','2013-08-06 15:40:10','2013-08-06 15:40:10'),(2156,'29629906','10/28/2013','12:00 pm','10/28/2013','1:00 pm','CDB Student & Postdoc Seminar, Li-Hsin Chang & Dr. Vidisha Tripathi',NULL,'B102 CLSL','Cell & Developmental Biology Department','Shannon Croft','shannon9@life.illinois.edu','(217) 333-6118','Lecture','Cell and Developmental Biology (CDB) Student & Postdoc Seminars','2013-10-28 17:00:00','2013-10-28 18:00:00','2013-08-06 15:40:10','2013-08-06 15:40:10'),(2170,'29435776','9/19/2013','4:00 pm','9/19/2013',NULL,'Microbiology Seminar:  \"Repair of Mu insertions requires the replisome to arrive at the transpososome\"',NULL,'Charles G. Miller Auditorium, Room B102 Chemical & Life Sciences Laboratory','Dr. Andrei Kuzminov, Associate Professor','Diane Tsevelekos','microsem@life.illinois.edu','333-1736','Seminar','Microbiology Department','2013-09-19 21:00:00','2013-09-19 05:00:00','2013-08-12 19:40:10','2013-08-12 19:40:10'),(2172,'29629904','10/14/2013','12:00 pm','10/14/2013','1:00 pm','CDB Student & Postdoc Seminar, Nidhi Khanna & Dr. Jim Collins',NULL,'B102 CLSL','Cell & Developmental Biology Department','Shannon Croft','shannon9@life.illinois.edu','(217) 333-6118','Lecture','Cell and Developmental Biology (CDB) Student & Postdoc Seminars','2013-10-14 17:00:00','2013-10-14 18:00:00','2013-08-13 14:25:10','2013-08-13 14:25:10'),(2178,'28783912','9/18/2013','12:00 pm','9/18/2013',NULL,'Cell &  Developmental Biology Seminar:   Dr. Xin Chen, Johns Hopkins University, \"Epigenetic regulation in Drosophila male germline stem cell lineage\"',NULL,'B102 CLSL','Cell & Developmental Biology Department','Elaine Rodgers; Phil Newmark','erodgers@life.illinois.edu; pnewmark@life.illinois.edu','217-265-5511','Seminar','Cell and Developmental Biology (CDB) Departmental Seminars','2013-09-18 17:00:00','2013-09-18 05:00:00','2013-08-15 15:05:09','2013-08-15 15:05:09'),(2179,'29434729','9/5/2013','4:00 pm','9/5/2013',NULL,'Microbiology Seminar:  \"Modulation of cellular signaling and metabolism by an oncogenic herpesvirus\"',NULL,'Charles G. Miller Auditorium, Room B102 Chemical & Life Sciences Laboratory','Dr. Joanna Shisler, Associate Professor','Diane Tsevelekos','microsem@life.illinois.edu','333-1736','Seminar','Microbiology Department','2013-09-05 21:00:00','2013-09-05 05:00:00','2013-08-19 21:45:09','2013-08-19 21:45:09'),(2182,'29738129','9/6/2013','1:00 pm','9/6/2013','5:00 pm','CBI/Biochemistry Seminar: Prof. Thomas Kodadek, The Scripps Research Institute, Scripps Florida, \"Chemical Tools to Monitor and Manipulate the Immune System\"','http://www.scripps.edu/florida/research/faculty/kodadek','Charles G. Miller Auditorium, Room B102 Chemical & Life Sciences Laboratory','Irisbel Guzman','Nan Holda','holda@illinois.edu','217-244-5450','Seminar','Biochemistry Department Seminars','2013-09-06 18:00:00','2013-09-06 22:00:00','2013-08-26 19:25:11','2013-08-26 19:25:11'),(2183,'27532592','9/13/2013','12:00 pm','9/13/2013','1:00 pm','Biochemistry Seminar: Dr. Rudy Fratti, University of Illinois  \"A Role for Lipids in Endolysosomal Maturation\"','http://mcb.illinois.edu/faculty/profile/rfratti','Charles G. Miller Auditorium, Room B102 Chemical & Life Sciences Laboratory','Dr. Robert Gennis','Cara L. Day','caraday@illinois.edu','217.333.2013','Seminar','Biochemistry Department Seminars','2013-09-13 17:00:00','2013-09-13 18:00:00','2013-08-26 19:25:11','2013-08-26 19:25:11'),(2184,'25719406','9/20/2013','12:00 pm','9/20/2013','1:00 pm','Biochemistry Seminar: Dr. Quinn Peterson, 2012 Biochemistry Trust of Urbana Awardee \"Chemical Approaches to treating disease: from cancer to diabetes\"','http://connects.catalyst.harvard.edu/profiles/profile/person/104445','Charles G. Miller Auditorium, Room B102 Chemical & Life Sciences Laboratory','Dr. Paul Hergenrother','Cara L. Day','caraday@illinois.edu','217.333.2013','Seminar','Biochemistry Department Seminars','2013-09-20 17:00:00','2013-09-20 18:00:00','2013-08-26 19:25:11','2013-08-26 19:25:11'),(2185,'27534053','9/23/2013','12:00 pm','9/23/2013',NULL,'Herbert E. Carter Lecture: Dr. David M. Sabatini,  MIT \"Regulation of Growth by the mTOR pathway\"','http://mcb.illinois.edu/departments/biochemistry/carter/','Charles G. Miller Auditorium, Room B102 Chemical & Life Sciences Laboratory','Dr. Susan Martinis','Cara L. Day','caraday@illinois.edu',NULL,'Seminar','Biochemistry Department Seminars','2013-09-23 17:00:00','2013-09-23 05:00:00','2013-08-26 19:25:11','2013-08-26 19:25:11'),(2188,'28783893','9/11/2013','12:00 pm','9/11/2013',NULL,'Cell &  Developmental Biology Seminar:   Dr. William Brieher, UIUC, \"Biochemical dissection of actin assembly and disassembly\"',NULL,'B102 CLSL','Cell & Developmental Biology Department','Elaine Rodgers; Phil Newmark','erodgers@life.illinois.edu; pnewmark@life.illinois.edu','217-265-5511','Seminar','Cell and Developmental Biology (CDB) Departmental Seminars','2013-09-11 17:00:00','2013-09-11 05:00:00','2013-08-26 19:25:11','2013-08-26 19:25:11'),(2190,'28884303','8/30/2013','12:00 pm','8/30/2013','1:00 pm','Biochemistry Seminar: Dr. Manuel Ares, Jr, University of California Santa Cruz, \"Mechanisms that Influence Splicing Decisions','http://mcd.ucsc.edu/faculty/ares.html','Charles G. Miller Auditorium, Room B102 Chemical & Life Sciences Laboratory','Dr. Auinash Kalsotra','Cara L. Day','caraday@illinois.edu','217.333.2013','Seminar','Biochemistry Department Seminars','2013-08-30 17:00:00','2013-08-30 18:00:00','2013-08-26 19:36:37','2013-08-26 19:36:37'),(2191,'29630542','9/4/2013','4:00 pm','9/4/2013',NULL,'Rodney Burton (Crofts Lab) - \"Qo site of the bc1 Complex; Unlocking the Gate of the Electron Transport Chain\"',NULL,NULL,'Department of Biochemistry',NULL,NULL,NULL,'Seminar','Biochemistry Department Graduate Seminars','2013-09-04 21:00:00','2013-09-04 05:00:00','2013-08-26 19:55:03','2013-08-26 19:55:03'),(2193,'29435515','9/12/2013','4:00 pm','9/12/2013',NULL,'Microbiology Seminar:  \"Exopolysaccharides and Pseudomonas aeruginosa biofilm development\"',NULL,'Charles G. Miller Auditorium, Room B102 Chemical & Life Sciences Laboratory','Dr. Patrick Degnan, Assistant Professor','Diane Tsevelekos','microsem@life.illinois.edu','333-1736','Seminar','Microbiology Department','2013-09-12 21:00:00','2013-09-12 05:00:00','2013-08-27 15:25:03','2013-08-27 15:25:03'),(2195,'29629699','9/16/2013','12:00 pm','9/16/2013','1:00 pm','CDB Student & Postdoc Seminar, Edwin Arauz',NULL,'B102 CLSL','Cell & Developmental Biology Department','Shannon Croft','shannon9@life.illinois.edu','(217) 333-6118','Lecture','Cell and Developmental Biology (CDB) Student & Postdoc Seminars','2013-09-16 17:00:00','2013-09-16 18:00:00','2013-08-29 14:10:04','2013-08-29 14:10:04'),(2196,'29629907','11/4/2013','12:00 pm','11/4/2013','1:00 pm','CDB Student & Postdoc Seminar, Christopher Bolt & Xiang Deng',NULL,'B102 CLSL','Cell & Developmental Biology Department','Shannon Croft','shannon9@life.illinois.edu','(217) 333-6118','Lecture','Cell and Developmental Biology (CDB) Student & Postdoc Seminars','2013-11-04 18:00:00','2013-11-04 19:00:00','2013-08-29 14:15:04','2013-08-29 14:15:04'),(2197,'29629908','11/11/2013','12:00 pm','11/11/2013','1:00 pm','CDB Student & Postdoc Seminar, Derek Caetano-Anolles & Dr. Ryan King',NULL,'B102 CLSL','Cell & Developmental Biology Department','Shannon Croft','shannon9@life.illinois.edu','(217) 333-6118','Lecture','Cell and Developmental Biology (CDB) Student & Postdoc Seminars','2013-11-11 18:00:00','2013-11-11 19:00:00','2013-08-29 14:20:05','2013-08-29 14:20:05'),(2198,'29629909','11/18/2013','12:00 pm','11/18/2013','1:00 pm','CDB Student & Postdoc Seminar, Paul Hamilton & Rajashekar Iyer',NULL,'B102 CLSL','Cell & Developmental Biology Department','Shannon Croft','shannon9@life.illinois.edu','(217) 333-6118','Lecture','Cell and Developmental Biology (CDB) Student & Postdoc Seminars','2013-11-18 18:00:00','2013-11-18 19:00:00','2013-08-29 14:20:05','2013-08-29 14:20:05'),(2199,'29629911','12/2/2013','12:00 pm','12/2/2013','1:00 pm','CDB Student & Postdoc Seminar, James Kemp & Dr. Arindam Chakraborty',NULL,'B102 CLSL','Cell & Developmental Biology Department','Shannon Croft','shannon9@life.illinois.edu','(217) 333-6118','Lecture','Cell and Developmental Biology (CDB) Student & Postdoc Seminars','2013-12-02 18:00:00','2013-12-02 19:00:00','2013-08-29 14:20:05','2013-08-29 14:20:05'),(2206,'29435781','10/17/2013','4:00 pm','10/17/2013',NULL,'Microbiology Seminar:  \"Structure - function studies of MurJ\"',NULL,'Charles G. Miller Auditorium, Room B102 Chemical & Life Sciences Laboratory','Dr. Carin Vanderpool, Assistant Professor','Diane Tsevelekos','microsem@life.illinois.edu','333-1736','Seminar','Microbiology Department','2013-10-17 21:00:00','2013-10-17 05:00:00','2013-08-29 14:35:04','2013-08-29 14:35:04'),(2207,'29824833','10/18/2013','12:00 pm','10/18/2013','1:00 pm','Biochemistry Seminar: Dr. Craig E. Cameron, The Pennsylvania State University, \"mtDNA Mutations and Cancer\"','http://bmb.psu.edu/directory/cec9','Charles G. Miller Auditorium, Room B102 Chemical & Life Sciences Laboratory','Dr. Raven Huang','Cara L. Day','caraday@illinois.edu','217.333.2013','Seminar','Biochemistry Department Seminars','2013-10-18 17:00:00','2013-10-18 18:00:00','2013-08-29 20:10:03','2013-08-29 20:10:03'),(2209,'29898484','9/5/2013','12:00 pm','9/5/2013',NULL,'Molecular and Integrative Physiology and College of Medicine: \"Mechanisms of top-down modulation in the mouse auditory forebrain\"',NULL,'Charles G. Miller Auditorium B102 CLSL','MIP/College of Medicine',NULL,NULL,NULL,NULL,'MCB Events','2013-09-05 17:00:00','2013-09-05 05:00:00','2013-08-30 20:55:04','2013-08-30 20:55:04'),(2214,'28783896','10/23/2013','12:00 pm','10/23/2013',NULL,'Cell &  Developmental Biology Seminar:   Dr. Lilianna Solnika-Krezel, Washington University School of Medicine, \"Genetic regulation of gastrulation in zebrafish\"',NULL,'B102 CLSL','Cell & Developmental Biology Department','Elaine Rodgers; Phil Newmark','erodgers@life.illinois.edu; pnewmark@life.illinois.edu','217-265-5511','Seminar','Cell and Developmental Biology (CDB) Departmental Seminars','2013-10-23 17:00:00','2013-10-23 05:00:00','2013-09-03 14:55:03','2013-09-03 14:55:03'),(2215,'29630743','9/11/2013','4:00 pm','9/11/2013',NULL,'Peiwen Wu (Lu Lab) - \"A DNAzyme-Gold Nanoparticle Probe for Uranyl Ion in Living Cells\"',NULL,NULL,'Department of Biochemistry',NULL,NULL,NULL,'Seminar','Biochemistry Department Graduate Seminars','2013-09-11 21:00:00','2013-09-11 05:00:00','2013-09-04 13:45:03','2013-09-04 13:45:03'),(2216,'29948648','9/12/2013','12:00 pm','9/12/2013',NULL,'MIP Seminar: \"Increasing Efficacy of Angiogenesis Inhibitors\"',NULL,'Charles G. Miller Auditorium, B102 CLSL','MIP Students',NULL,NULL,NULL,'Seminar','Molecular and Integrative Physiology (MIP) Department Seminar Series','2013-09-12 17:00:00','2013-09-12 05:00:00','2013-09-04 20:35:06','2013-09-04 20:35:06'),(2218,'29954394','9/5/2013','12:00 pm','9/5/2013',NULL,'MIP Seminar: \"Mechanisms of top-down modulation in the mouse auditory forebrain\"',NULL,'Charles G. Miller Auditorium, B102 CLSL','Dr. Milan Bagchi, Professor of Molecular & Integrative Physiology','Julie Moore','jmoor@illinois.edu','300-5804','Seminar','Molecular and Integrative Physiology (MIP) Department Seminar Series','2013-09-05 17:00:00','2013-09-05 05:00:00','2013-09-05 14:05:04','2013-09-05 14:05:04'),(2219,'28783895','10/9/2013','12:00 pm','10/9/2013',NULL,'Cell &  Developmental Biology Seminar:   Dr. Judith Frydman, Stanford University, \"Molecular Origami: protein folding and misfolding in health and disease\"',NULL,'B102 CLSL','Cell & Developmental Biology Department','Elaine Rodgers; Phil Newmark','erodgers@life.illinois.edu; pnewmark@life.illinois.edu','217-265-5511','Seminar','Cell and Developmental Biology (CDB) Departmental Seminars','2013-10-09 17:00:00','2013-10-09 05:00:00','2013-09-05 15:25:04','2013-09-05 15:25:04'),(2226,'29435779','10/3/2013','4:00 pm','10/3/2013',NULL,'Microbiology Seminar:  \"Extreme genome reduction in insect endosymbionts:  walking the line between bacteria and organelles\"\"',NULL,'Charles G. Miller Auditorium, Room B102 Chemical & Life Sciences Laboratory','Dr. Rachel Whitaker, Assistant Professor','Diane Tsevelekos','microsem@life.illinois.edu','333-1736','Seminar','Microbiology Department','2013-10-03 21:00:00','2013-10-03 05:00:00','2013-09-11 21:30:03','2013-09-11 21:30:03'),(2229,'29435780','10/10/2013','4:00 pm','10/10/2013',NULL,'Microbiology Seminar:  \"Clostridium perfringens Foodborne Diseases:  Tales of Terrible Toxins (and More)\"',NULL,'Charles G. Miller Auditorium, Room B102 Chemical & Life Sciences Laboratory','Dr. Brenda Wilson, Associate Professor','Diane Tsevelekos','microsem@life.illinois.edu','333-1736','Seminar','Microbiology Department','2013-10-10 21:00:00','2013-10-10 05:00:00','2013-09-12 14:35:04','2013-09-12 14:35:04'),(2232,'29435782','10/24/2013','4:00 pm','10/24/2013',NULL,'Microbiology Seminar:  \"Regulation of cell wall synthases and remodeling enzymes involved in bacterial morphogenesis\"',NULL,'Charles G. Miller Auditorium, Room B102 Chemical & Life Sciences Laboratory','Dr. James Slauch, Professor','Diane Tsevelekos','microsem@life.illinois.edu','333-1736','Seminar','Microbiology Department','2013-10-24 21:00:00','2013-10-24 05:00:00','2013-09-13 14:50:04','2013-09-13 14:50:04'),(2233,'30040584','9/26/2013','4:00 pm','9/26/2013',NULL,'\"Receptors, Synapses, and Memory\"',NULL,'Charles Miller Auditorium, B102 CLSL','MIP C. Ladd Prosser Committee','Julie Moore','jmoor@illinois.edu','217-300-5804','Lecture','Molecular and Integrative Physiology (MIP) Department Seminar Series','2013-09-26 21:00:00','2013-09-26 05:00:00','2013-09-13 20:05:04','2013-09-13 20:05:04'),(2234,'30040743','9/27/2013','11:30 am','9/27/2013',NULL,'\"FSH Signaling in Ovarian Granulosa Cells: How PKA Hijacks Other Pathways to Regulate Gene Expression\"',NULL,'3rd Floor Levis Faculty Center','MIP Graduate Students','Julie Moore','jmoor@illinois.edu','217-300-5804','Lecture','Molecular and Integrative Physiology (MIP) Department Seminar Series','2013-09-27 16:30:00','2013-09-27 05:00:00','2013-09-13 20:10:03','2013-09-13 20:10:03'),(2238,'29629902','9/30/2013','12:00 pm','9/30/2013','1:00 pm','CDB Student & Postdoc Seminar, Nimish Khanna & Dr. Vivian Tang',NULL,'B102 CLSL','Cell & Developmental Biology Department','Shannon Croft','shannon9@life.illinois.edu','(217) 333-6118','Lecture','Cell and Developmental Biology (CDB) Student & Postdoc Seminars','2013-09-30 17:00:00','2013-09-30 18:00:00','2013-09-18 15:15:27','2013-09-18 15:15:27'),(2248,'29630811','10/2/2013','4:00 pm','10/2/2013',NULL,'Bijoy Desai (Gerlt Lab) - \"Mechanistic Studies on Orotidine 5\'-Monophosphate Decarboxylase\"',NULL,NULL,'Department of Biochemistry',NULL,NULL,NULL,'Seminar','Biochemistry Department Graduate Seminars','2013-10-02 21:00:00','2013-10-02 05:00:00','2013-09-24 14:20:31','2013-09-24 14:20:31'),(2249,'30160382','10/3/2013','12:00 pm','10/3/2013',NULL,'\"Sensory signal processing in the auditory cortical column\"',NULL,NULL,'MIP Seminar Committee','Julie Moore','jmoor@illinois.edu','300-5804','Seminar','Molecular and Integrative Physiology (MIP) Department Seminar Series','2013-10-03 17:00:00','2013-10-03 05:00:00','2013-09-25 14:00:29','2013-09-25 14:00:29'),(2250,'28783894','10/2/2013','12:00 pm','10/2/2013',NULL,'**CANCELLED**  Cell &  Developmental Biology Seminar: Dr. Scott Michaels, Indiana University, \"Large-scale heterochromatin remodeling linked to re-replication-associated DNA damage\"',NULL,'B102 CLSL','Cell & Developmental Biology Department','Elaine Rodgers; Phil Newmark','erodgers@life.illinois.edu; pnewmark@life.illinois.edu','217-265-5511','Seminar','Cell and Developmental Biology (CDB) Departmental Seminars','2013-10-02 17:00:00','2013-10-02 05:00:00','2013-09-25 17:30:09','2013-09-25 17:30:09'),(2251,'27731508','10/25/2013','12:00 pm','10/25/2013','1:00 pm','Biochemistry Seminar: Dr. Richard L. Eckert (University of Maryland), \"Making sense of skin  death and survival of normal and transformed keratinocytes','http://medschool.umaryland.edu/facultyresearchprofile/viewprofile.aspx?id=9836','Charles G. Miller Auditorium (B102 CLSL)','Dr. Benita K. Katzenellenbogen','Cara L. Day','caraday@illinois.edu','217.333.2013','Seminar','Biochemistry Department Seminars','2013-10-25 17:00:00','2013-10-25 18:00:00','2013-09-25 19:10:17','2013-09-25 19:10:17'),(2252,'29629903','10/7/2013','12:00 pm','10/7/2013','1:00 pm','No Seminar',NULL,'B102 CLSL','Cell & Developmental Biology Department','Shannon Croft','shannon9@life.illinois.edu','(217) 333-6118','Lecture','Cell and Developmental Biology (CDB) Student & Postdoc Seminars','2013-10-07 17:00:00','2013-10-07 18:00:00','2013-09-25 19:35:08','2013-09-25 19:35:08'),(2253,'29630810','10/2/2013','4:00 pm','10/2/2013',NULL,'Zhanar Abil (Zhao Lab) - One-Step Modular Assembly of PUF Proteins for Specific Recognition of Endogenous RNA Sequences',NULL,NULL,'Department of Biochemistry',NULL,NULL,NULL,'Seminar','Biochemistry Department Graduate Seminars','2013-10-02 21:00:00','2013-10-02 05:00:00','2013-09-25 20:20:06','2013-09-25 20:20:06'),(2254,'24137776','10/4/2013','12:00 pm','10/4/2013','1:00 pm','Biochemistry Seminar: Dr. Brian Kuhlman, University of North Carolina at Chapel Hill \"Computational Design of Protein Interactions and Switches\"','http://www.med.unc.edu/biochem/kuhlman','Charles G. Miller Auditorium (B102 CLSL)','Drs. Emad Tajkhorshid and Yi Lu','Cara L. Day','caraday@illinois.edu','217.333.2013','Seminar','Biochemistry Department Seminars','2013-10-04 17:00:00','2013-10-04 18:00:00','2013-09-25 20:45:10','2013-09-25 20:45:10'),(2255,'27539529','11/8/2013','12:00 pm','11/8/2013','1:00 pm','Biochemistry Seminar: Dr. Wen Shan Yew (National University of Singapore) \"New Wine from Old Barrels: Tales of Synthetic Enzymology\"','http://www.med.nus.edu.sg/bch/bchyws.htm','Charles G. Miller Auditorium, Room B102 Chemical & Life Sciences Laboratory','Dr. Susan Martinis','Cara L. Day','caraday@illinois.edu','217.333.2013','Seminar','Biochemistry Department Seminars','2013-11-08 18:00:00','2013-11-08 19:00:00','2013-09-26 13:55:08','2013-09-26 13:55:08'),(2258,'29250953','3/22/2014','1:00 pm','3/22/2014',NULL,'Spring Vacation Begins',NULL,NULL,'U-C Senate',NULL,NULL,NULL,'Academic','Academic Dates','2014-03-22 18:00:00','2014-03-22 05:00:00','2013-09-28 05:00:03','2013-09-28 05:00:03'),(2259,'29630403','3/24/2014','12:00 pm','3/24/2014','1:00 pm','No Seminar',NULL,'B102 CLSL','Cell & Developmental Biology Department','Shannon Croft','shannon9@life.illinois.edu','(217) 333-6118','Lecture','Cell and Developmental Biology (CDB) Student & Postdoc Seminars','2014-03-24 17:00:00','2014-03-24 18:00:00','2013-10-01 05:00:03','2013-10-01 05:00:03'),(2260,'29630812','10/9/2013','4:00 pm','10/9/2013',NULL,'Kade Fellow: Pei Wang (Huang Lab) - RNA repair in Human-hosted Bacteria',NULL,NULL,'Department of Biochemistry',NULL,NULL,NULL,'Seminar','Biochemistry Department Graduate Seminars','2013-10-09 21:00:00','2013-10-09 05:00:00','2013-10-02 18:20:03','2013-10-02 18:20:03'),(2261,'29435784','10/31/2013','4:00 pm','10/31/2013',NULL,'Microbiology Seminar:  \"Molecular arms races between primates and poxviruses\"',NULL,'Charles G. Miller Auditorium, Room B102 Chemical & Life Sciences Laboratory','Dr. Joanna Shisler, Associate Professor','Diane Tsevelekos','microsem@life.illinois.edu','333-1736','Seminar','Microbiology Department','2013-10-31 21:00:00','2013-10-31 05:00:00','2013-10-02 21:50:03','2013-10-02 21:50:03'),(2262,'29435786','11/7/2013','4:00 pm','11/7/2013',NULL,'Microbiology Seminar:  \"Na+ dependent energy metabolism in Pathogenic Bacteria\"',NULL,'Charles G. Miller Auditorium, Room B102 Chemical & Life Sciences Laboratory','Dr. Brenda Wilson, Associate Professor','Diane Tsevelekos','microsem@life.illinois.edu','333-1736','Seminar','Microbiology Department','2013-11-07 22:00:00','2013-11-07 06:00:00','2013-10-02 21:55:04','2013-10-02 21:55:04'),(2263,'29250954','3/31/2014',NULL,'3/31/2014',NULL,'Instruction resumes',NULL,NULL,'U-C Senate',NULL,NULL,NULL,'Academic','Academic Dates','2014-03-31 05:00:00','2014-03-31 05:00:00','2013-10-03 05:00:06','2013-10-03 05:00:06'),(2267,'30246070','10/16/2013','4:00 pm','10/16/2013',NULL,'Michael Gregory (Sligar Lab) - \"Mechanism of Androgen Biosynthesis by Human CYP17A1\"',NULL,NULL,'Biochemistry Department',NULL,NULL,NULL,'Seminar','Biochemistry Department Graduate Seminars','2013-10-16 21:00:00','2013-10-16 05:00:00','2013-10-03 18:55:39','2013-10-03 18:55:39'),(2270,'30255096','10/10/2013','12:00 pm','10/10/2013',NULL,'\"Prefrontal-thalamic interactions for cognition, emotion and action\"',NULL,'Charles G. Miller Auditorium, B102 CLSL','MIP Seminar Committee','Julie Moore','jmoor@illinois.edu',NULL,'Seminar','Molecular and Integrative Physiology (MIP) Department Seminar Series','2013-10-10 17:00:00','2013-10-10 05:00:00','2013-10-04 16:40:14','2013-10-04 16:40:14'),(2273,'29630880','10/16/2013','4:00 pm','10/16/2013',NULL,'Paween Mahinthicahichan (Tajkhorshid/Gennis labs) - \"Pathways and Energetics of Substrate O(2) Diffusion in Cytochrome c Oxidase(s)\"',NULL,NULL,'Department of Biochemistry',NULL,NULL,NULL,'Seminar','Biochemistry Department Graduate Seminars','2013-10-16 21:00:00','2013-10-16 05:00:00','2013-10-07 15:30:03','2013-10-07 15:30:03'),(2282,'29630948','10/23/2013','4:00 pm','10/23/2013',NULL,'Westcott Fellow:  Jon Chekan (Nair lab) - Investigation of Quorum Sensing Molecules to Induce Antibiotic Biosynthesis',NULL,NULL,'Department of Biochemistry',NULL,NULL,NULL,'Seminar','Biochemistry Department Graduate Seminars','2013-10-23 21:00:00','2013-10-23 05:00:00','2013-10-11 19:30:03','2013-10-11 19:30:03'),(2283,'29631016','10/14/2013','9:40 am','10/14/2013',NULL,'Salehe Ghasempur (Gerlt Lab)',NULL,NULL,'Department of Biochemistry',NULL,NULL,NULL,'Seminar','Biochemistry Department Graduate Seminars','2013-10-14 14:40:00','2013-10-14 05:00:00','2013-10-14 14:35:03','2013-10-14 14:35:03'),(2284,'28783913','10/16/2013','12:00 pm','10/16/2013',NULL,'Cell &  Developmental Biology Seminar:   Dr. Ali Shilatifard, Stowers Institute for Medical Research, \"Chromosomal Translocations, Transcriptional Elongation Control, Epigenetics and Cancer\"',NULL,'B102 CLSL','Cell & Developmental Biology Department','Elaine Rodgers; Phil Newmark','erodgers@life.illinois.edu; pnewmark@life.illinois.edu','217-265-5511','Seminar','Cell and Developmental Biology (CDB) Departmental Seminars','2013-10-16 17:00:00','2013-10-16 05:00:00','2013-10-14 16:50:03','2013-10-14 16:50:03'),(2287,'30328416','10/17/2013','12:00 pm','10/17/2013',NULL,'\"Reproductive developmental pathways are linked to adult disease\"',NULL,'Charles G. Miller Auditorium, B102 CLSL','Dr. Lori Raetzman','Julie Moore','jmoor@hotmail.com','300-5804','Seminar','Molecular and Integrative Physiology (MIP) Department Seminar Series','2013-10-17 17:00:00','2013-10-17 05:00:00','2013-10-15 14:15:05','2013-10-15 14:15:05'),(2296,'30367213','10/24/2013','12:00 pm','10/24/2013',NULL,'\"Mouse Models that Mimic the Physiology & Pathology of Human Skin Disease\"',NULL,'Charles G. Miller Auditorium, B102 CLSL','Dr. Benita Katzenellenbogen','Julie Moore','jmoor@illinois.edu','300-5804','Seminar','Molecular and Integrative Physiology (MIP) Department Seminar Series','2013-10-24 17:00:00','2013-10-24 05:00:00','2013-10-18 14:00:05','2013-10-18 14:00:05'),(2298,'30428130','10/31/2013','12:00 pm','10/31/2013',NULL,'\"A closer look at Goldilocks\' Ovary: This amount of Androgen is JUST RIGHT!\"',NULL,'Charles G. Miller Auditorium, B102 CLSL','Dr. Benita Katzenellenbogen','Julie Moore','jmoor@illinois.edu','300-5804','Seminar','Molecular and Integrative Physiology (MIP) Department Seminar Series','2013-10-31 17:00:00','2013-10-31 05:00:00','2013-10-21 15:05:03','2013-10-21 15:05:03'),(2301,'29435788','11/21/2013','4:00 pm','11/21/2013',NULL,'Microbiology Seminar:  \"Molecular Insights into Mycobacterial Protein Secretion\"',NULL,'Charles G. Miller Auditorium, Room B102 Chemical & Life Sciences Laboratory','Dr. James Slauch, Professor','Diane Tsevelekos','microsem@life.illinois.edu','333-1736','Seminar','Microbiology Department','2013-11-21 22:00:00','2013-11-21 06:00:00','2013-10-22 19:35:03','2013-10-22 19:35:03'),(2303,'29250955','5/7/2014',NULL,'5/7/2014',NULL,'Instruction Ends',NULL,NULL,'U-C Senate',NULL,NULL,NULL,'Academic','Academic Dates','2014-05-07 05:00:00','2014-05-07 05:00:00','2013-10-24 05:00:04','2013-10-24 05:00:04'),(2305,'29250956','5/9/2014',NULL,'5/9/2014',NULL,'Final Exams Begin',NULL,NULL,'U-C Senate',NULL,NULL,NULL,'Academic','Academic Dates','2014-05-09 05:00:00','2014-05-09 05:00:00','2013-10-25 05:00:03','2013-10-25 05:00:03'),(2306,'21388396','5/17/2014','9:30 am','5/17/2014','12:00 pm','Commencement* (Saturday)','http://oc.illinois.edu/commencement/','Memorial Stadium','University of Illinois Board of Trustees',NULL,NULL,NULL,'Academic','Academic Dates','2014-05-17 14:30:00','2014-05-17 17:00:00','2013-10-25 05:00:03','2013-10-25 05:00:03'),(2307,'28783898','11/6/2013','12:00 pm','11/6/2013',NULL,'Cell &  Developmental Biology Seminar:  Dr. David Spector, Cold Spring Harbor Laboratory, \"Random Monoallelic Gene Expression Increases Upon ESC Differentiation\"',NULL,'B102 CLSL','Cell & Developmental Biology Department','Elaine Rodgers; Phil Newmark','erodgers@life.illinois.edu; pnewmark@life.illinois.edu','217-265-5511','Seminar','Cell and Developmental Biology (CDB) Departmental Seminars','2013-11-06 18:00:00','2013-11-06 06:00:00','2013-10-25 15:35:03','2013-10-25 15:35:03'),(2308,'21350886','5/26/2014',NULL,'5/26/2014',NULL,'Memorial Day',NULL,NULL,'U-C Senate',NULL,NULL,NULL,'Holiday','Holidays','2014-05-26 05:00:00','2014-05-26 05:00:00','2013-10-26 05:00:04','2013-10-26 05:00:04'),(2309,'29631017','10/30/2013','4:00 pm','10/30/2013',NULL,'Westcott Fellow: Shannon Walsh (Silverman Lab) - DNA Catalysts with Tyrosine Kinase Activity.',NULL,'116 RAL','Department of Biochemistry',NULL,NULL,NULL,'Seminar','Biochemistry Department Graduate Seminars','2013-10-30 21:00:00','2013-10-30 05:00:00','2013-10-28 16:55:04','2013-10-28 16:55:04'),(2338,'29631018','11/6/2013','4:00 pm','11/6/2013',NULL,'Manuel Ortega (van der Donk Lab) - Mechanistic studies on the lantibiotic dehydratase NisB involved in nisin biosynthesis.',NULL,'116 RAL','Department of Biochemistry',NULL,NULL,NULL,'Seminar','Biochemistry Department Graduate Seminars','2013-11-06 22:00:00','2013-11-06 06:00:00','2013-10-29 18:20:04','2013-10-29 18:20:04'),(2339,'29631019','11/6/2013','4:00 pm','11/6/2013',NULL,'Swami Srinivas (Cronan Lab) - Characterization of Enoyl-ACP isomerases and reductases in Clostridium and Neisseria Species',NULL,'116 RAL','Department of Biochemistry',NULL,NULL,NULL,'Seminar','Biochemistry Department Graduate Seminars','2013-11-06 22:00:00','2013-11-06 06:00:00','2013-10-30 13:35:04','2013-10-30 13:35:04'),(2341,'30081955','11/1/2013','12:00 pm','11/1/2013','1:00 pm','Biochemistry Seminar: Dr. A. Joshua Wand (University of Pennsylvania) \"The Dark Energy of Proteins Comes to Light\"','http://www.med.upenn.edu/wandlab/','Charles G. Miller Auditorium, Room B102 Chemical & Life Sciences Laboratory','Dr. Stephen G. Sligar','Cara L. Day','caraday@illinois.edu','217.333.2013','Seminar','Biochemistry Department Seminars','2013-11-01 17:00:00','2013-11-01 18:00:00','2013-10-31 14:05:04','2013-10-31 14:05:04'),(2342,'29631020','11/13/2013','4:00 pm','11/13/2013',NULL,'Daryl Meling (Das Lab) - \"Mechanistic Studies of CYP2J2 Epoxygenase and Thromboxane Synthase\"',NULL,'116 RAL','Department of Biochemistry',NULL,NULL,NULL,'Seminar','Biochemistry Department Graduate Seminars','2013-11-13 22:00:00','2013-11-13 06:00:00','2013-10-31 19:55:04','2013-10-31 19:55:04'),(2346,'30543238','11/18/2013','10:00 am','11/18/2013',NULL,'Hua Zhou - Biochemistry Final Defense - Jakobsson lab',NULL,'401 Roger Adams Lab (RAL)','Department of Biochemistry',NULL,NULL,NULL,'Seminar','Biochemistry Department Graduate Seminars','2013-11-18 16:00:00','2013-11-18 06:00:00','2013-11-01 15:10:05','2013-11-01 15:10:05'),(2350,'30543321','11/7/2013','12:00 pm','11/7/2013','1:00 pm','MIP Seminar: Dr. Su-A Myong (UIUC) \"Single Molecule Study of Telomeric Overhang Structural Dynamics\"',NULL,'Charles G. Miller Auditorium, B102 CLSL','Dr. Hee Jung Chung','Julie Moore','jmoor@illinois.edu','300-5804','Seminar','Molecular and Integrative Physiology (MIP) Department Seminar Series','2013-11-07 18:00:00','2013-11-07 19:00:00','2013-11-01 16:15:04','2013-11-01 16:15:04'),(2352,'29435787','11/14/2013','3:45 pm','11/14/2013',NULL,'*TIME CHANGE* Microbiology Seminar:  \"Intricate regulation provided by small RNAs and small proteins\"',NULL,'Charles G. Miller Auditorium, Room B102 Chemical & Life Sciences Laboratory','Dr. Carin Vanderpool, Assistant Professor','Diane Tsevelekos','microsem@life.illinois.edu','333-1736','Seminar','Microbiology Department','2013-11-14 21:45:00','2013-11-14 06:00:00','2013-11-04 17:37:10','2013-11-04 17:37:10'),(2353,'30577095','11/22/2013','10:00 am','11/22/2013',NULL,'Samanthi Narayanan - Biochemistry Final Defense - Dr. David Kranz Lab',NULL,'Room 410 RAL (Roger Adams Lab)','Department of Biochemistry',NULL,NULL,NULL,'Seminar','Biochemistry Department Graduate Seminars','2013-11-22 16:00:00','2013-11-22 06:00:00','2013-11-04 19:10:17','2013-11-04 19:10:17'),(2354,'29572129','11/15/2013','12:00 pm','11/15/2013','1:00 pm','Biochemistry Seminar: Dr. Jaya Sarkar, NIH, \"2012 Anne A. Johnson Work Award Seminar: Maintenance of Translational Accuracy and Genomic Integrity\"',NULL,'B102 CLSL','Dr. Susan A. Martinis','Cara L. Day','caraday@illinois.edu','217.333.2013','Seminar','Biochemistry Department Seminars','2013-11-15 18:00:00','2013-11-15 19:00:00','2013-11-04 20:30:51','2013-11-04 20:30:51'),(2355,'29250958','6/14/2014',NULL,'6/14/2014',NULL,'End of Summer Session 1',NULL,NULL,'U-C Senate',NULL,NULL,NULL,'Academic','Academic Dates','2014-06-14 05:00:00','2014-06-14 05:00:00','2013-11-05 06:00:04','2013-11-05 06:00:04'),(2356,'30543889','11/14/2013','12:00 pm','11/14/2013',NULL,'MIP Seminar: Michael Shen, Ph.D., \"Stem cells and the origin of prostate cancer\"',NULL,'Charles G. Miller Auditorium, B102 CLSL','Dr. Eric Bolton','Julie Moore','jmoor@illinois.edu','300-5804','Seminar','Molecular and Integrative Physiology (MIP) Department Seminar Series','2013-11-14 18:00:00','2013-11-14 06:00:00','2013-11-06 20:30:04','2013-11-06 20:30:04'),(2357,'29250960','6/16/2014',NULL,'6/16/2014',NULL,'First Day of Instruction, Summer Term 2',NULL,NULL,'U-C Senate',NULL,NULL,NULL,'Academic','Academic Dates','2014-06-16 05:00:00','2014-06-16 05:00:00','2013-11-07 06:00:03','2013-11-07 06:00:03'),(2359,'29250961','8/7/2014',NULL,'8/7/2014',NULL,'End of Summer Session 2',NULL,NULL,'U-C Senate',NULL,NULL,NULL,'Academic','Academic Dates','2014-08-07 05:00:00','2014-08-07 05:00:00','2013-11-07 06:00:04','2013-11-07 06:00:04'),(2360,'29250963','8/8/2014',NULL,'8/8/2014',NULL,'Final Exams Begin',NULL,NULL,'U-C Senate',NULL,NULL,NULL,'Academic','Academic Dates','2014-08-08 05:00:00','2014-08-08 05:00:00','2013-11-08 06:00:04','2013-11-08 06:00:04'),(2363,'29631021','11/13/2013','4:00 pm','11/13/2013',NULL,'Daniel Wichelecki (Gerlt Lab) - \"Functional and Physiological Diversity in the Enolase Superfamily: ManDs\"',NULL,'116 RAL','Department of Biochemistry',NULL,NULL,NULL,'Seminar','Biochemistry Department Graduate Seminars','2013-11-13 22:00:00','2013-11-13 06:00:00','2013-11-11 14:45:03','2013-11-11 14:45:03'),(2364,'29631022','11/20/2013','4:00 pm','11/20/2013',NULL,'Parisa Hosseinzadeh (Lu Lab) - Tuning Redox Potentials of Type 1 Blue Copper Center in Azurin beyond the Natural Range of All Cupredoxins.',NULL,'116 RAL','Department of Biochemistry',NULL,NULL,NULL,'Seminar','Biochemistry Department Graduate Seminars','2013-11-20 22:00:00','2013-11-20 06:00:00','2013-11-11 14:45:04','2013-11-11 14:45:04'),(2366,'29630400','3/10/2014','12:00 pm','3/10/2014','1:00 pm','CDB Student & Postdoc Seminar, Rachel Waldemer & Anika Jain',NULL,'B102 CLSL','Cell & Developmental Biology Department','Shannon Croft','shannon9@life.illinois.edu','(217) 333-6118','Lecture','Cell and Developmental Biology (CDB) Student & Postdoc Seminars','2014-03-10 17:00:00','2014-03-10 18:00:00','2013-11-11 18:10:03','2013-11-11 18:10:03'),(2368,'29630404','4/7/2014','12:00 pm','4/7/2014','1:00 pm','CDB Student & Postdoc Seminar, Mahdieh Jadaliha & Dr. Amanda Brock',NULL,'B102 CLSL','Cell & Developmental Biology Department','Shannon Croft','shannon9@life.illinois.edu','(217) 333-6118','Lecture','Cell and Developmental Biology (CDB) Student & Postdoc Seminars','2014-04-07 17:00:00','2014-04-07 18:00:00','2013-11-11 18:10:04','2013-11-11 18:10:04'),(2369,'29630405','4/14/2014','12:00 pm','4/14/2014','1:00 pm','CDB Student & Postdoc Seminar, Keaton Schuster & Dr. Aparna Anantharaman',NULL,'B102 CLSL','Cell & Developmental Biology Department','Shannon Croft','shannon9@life.illinois.edu','(217) 333-6118','Lecture','Cell and Developmental Biology (CDB) Student & Postdoc Seminars','2014-04-14 17:00:00','2014-04-14 18:00:00','2013-11-11 18:10:04','2013-11-11 18:10:04'),(2371,'29630407','4/28/2014','12:00 pm','4/28/2014','1:00 pm','CDB Student & Postdoc Seminar, Binhui Zhao Dr. Tania Rozario',NULL,'B102 CLSL','Cell & Developmental Biology Department','Shannon Croft','shannon9@life.illinois.edu','(217) 333-6118','Lecture','Cell and Developmental Biology (CDB) Student & Postdoc Seminars','2014-04-28 17:00:00','2014-04-28 18:00:00','2013-11-11 18:10:04','2013-11-11 18:10:04'),(2372,'30650785','3/31/2014','12:00 pm','3/31/2014','1:00 pm','CDB Student & Postdoc Seminar, Xinying Zong & Dr. Abid Khan',NULL,'B102 CLSL','Cell & Developmental Biology Department','Shannon Croft','shannon9@life.illinois.edu','(217) 333-6118','Lecture','Cell and Developmental Biology (CDB) Student & Postdoc Seminars','2014-03-31 17:00:00','2014-03-31 18:00:00','2013-11-11 18:10:04','2013-11-11 18:10:04'),(2373,'29629912','12/16/2013','12:00 pm','12/16/2013','1:00 pm','CDB Student & Postdoc Seminar, Yu Chen & Ruiqi Liao',NULL,'B102 CLSL','Cell & Developmental Biology Department','Shannon Croft','shannon9@life.illinois.edu','(217) 333-6118','Lecture','Cell and Developmental Biology (CDB) Student & Postdoc Seminars','2013-12-16 18:00:00','2013-12-16 19:00:00','2013-11-11 18:15:03','2013-11-11 18:15:03'),(2374,'29629913','1/27/2014','12:00 pm','1/27/2014','1:00 pm','CDB Student & Postdoc Seminar, Ambika Nadkarni & Dr. Rachel Roberts-Galbraith',NULL,'B102 CLSL','Cell & Developmental Biology Department','Shannon Croft','shannon9@life.illinois.edu','(217) 333-6118','Lecture','Cell and Developmental Biology (CDB) Student & Postdoc Seminars','2014-01-27 18:00:00','2014-01-27 19:00:00','2013-11-11 18:15:03','2013-11-11 18:15:03'),(2375,'29630395','2/3/2014','12:00 pm','2/3/2014','1:00 pm','CDB Student & Postdoc Seminar, Amir Saberi & Alvin Thomas',NULL,'B102 CLSL','Cell & Developmental Biology Department','Shannon Croft','shannon9@life.illinois.edu','(217) 333-6118','Lecture','Cell and Developmental Biology (CDB) Student & Postdoc Seminars','2014-02-03 18:00:00','2014-02-03 19:00:00','2013-11-11 18:15:03','2013-11-11 18:15:03'),(2376,'29630396','2/10/2014','12:00 pm','2/10/2014','1:00 pm','CDB Student & Postdoc Seminar, Hui-Chia Yu & Geena Skariah',NULL,'B102 CLSL','Cell & Developmental Biology Department','Shannon Croft','shannon9@life.illinois.edu','(217) 333-6118','Lecture','Cell and Developmental Biology (CDB) Student & Postdoc Seminars','2014-02-10 18:00:00','2014-02-10 19:00:00','2013-11-11 18:15:03','2013-11-11 18:15:03'),(2378,'29630398','2/24/2014','12:00 pm','2/24/2014','1:00 pm','CDB Student & Postdoc Seminar, Harini Iyer & Dr. MeeSup Yoon',NULL,'B102 CLSL','Cell & Developmental Biology Department','Shannon Croft','shannon9@life.illinois.edu','(217) 333-6118','Lecture','Cell and Developmental Biology (CDB) Student & Postdoc Seminars','2014-02-24 18:00:00','2014-02-24 19:00:00','2013-11-11 18:15:03','2013-11-11 18:15:03'),(2380,'30651041','12/9/2013','12:00 pm','12/9/2013','1:00 pm','No Seminar',NULL,'B102 CLSL','Cell & Developmental Biology Department','Shannon Croft','shannon9@life.illinois.edu','(217) 333-6118','Lecture','Cell and Developmental Biology (CDB) Student & Postdoc Seminars','2013-12-09 18:00:00','2013-12-09 19:00:00','2013-11-11 18:15:04','2013-11-11 18:15:04'),(2381,'29250964','8/25/2014',NULL,'8/25/2014',NULL,'First Day of Instruction, Fall Semester',NULL,NULL,'U-C Senate',NULL,NULL,NULL,'Academic','Academic Dates','2014-08-25 05:00:00','2014-08-25 05:00:00','2013-11-12 06:00:04','2013-11-12 06:00:04'),(2383,'29630402','3/17/2014','12:00 pm','3/17/2014','1:00 pm','CDB Student & Postdoc Seminar, Annie Weisner & Dr. Melanie Issigonis',NULL,'B102 CLSL','Cell & Developmental Biology Department','Shannon Croft','shannon9@life.illinois.edu','(217) 333-6118','Lecture','Cell and Developmental Biology (CDB) Student & Postdoc Seminars','2014-03-17 17:00:00','2014-03-17 18:00:00','2013-11-13 16:35:03','2013-11-13 16:35:03'),(2387,'29631024','11/20/2013','4:00 pm','11/20/2013',NULL,'Jason Bouvier (Gerlt Lab) -  Galactaro--Lactone Isomerase The Missing Enzyme in a Microbial D-Galacturonate Catabolic Pathway?',NULL,'116 RAL','Department of Biochemistry',NULL,NULL,NULL,'Seminar','Biochemistry Department Graduate Seminars','2013-11-20 22:00:00','2013-11-20 06:00:00','2013-11-14 15:20:03','2013-11-14 15:20:03'),(2390,'30599614','11/21/2013','12:00 pm','11/21/2013',NULL,'MIP Seminar: Evan Rosen, M.D., Ph.D., \"Epigenetic and transcriptional approaches to adipocyte biology',NULL,'Charles G. Miller Auditorium, B102 CLSL','Dr. Jongsook Kim Kemper','Julie Moore','jmoor@illinois.edu','300-5804','Seminar','Molecular and Integrative Physiology (MIP) Department Seminar Series','2013-11-21 18:00:00','2013-11-21 06:00:00','2013-11-15 16:25:03','2013-11-15 16:25:03'),(2392,'29435919','12/5/2013','4:00 pm','12/5/2013',NULL,'Microbiology Seminar:  \"Discovery and Analysis of Bacillus subtilis Regulatory RNAs\"',NULL,'Charles G. Miller Auditorium, Room B102 Chemical & Life Sciences Laboratory','Dr. Thomas Kehl-Fie, Assistant Professor','Diane Tsevelekos','microsem@life.illinois.edu','333-1736','Seminar','Microbiology Department','2013-12-05 22:00:00','2013-12-05 06:00:00','2013-11-15 20:00:03','2013-11-15 20:00:03'),(2396,'30543963','11/19/2013','9:30 am','11/19/2013',NULL,'CANCELLED!!  Kim-Phung Nguyen - Biochemistry Final Defense - Nair lab',NULL,'Room B124 CLSL','Department of Biochemistry',NULL,NULL,NULL,'Seminar','Biochemistry Department Graduate Seminars','2013-11-19 15:30:00','2013-11-19 06:00:00','2013-11-19 15:25:03','2013-11-19 15:25:03'),(2409,'30773504','12/6/2013','12:00 pm','12/6/2013','1:00 pm','Biochemistry Seminar of Special Interest: Dr. Manuel Ascano, Jr. (HHMI/Rockefeller University), \"The role of RNA- and DNA-binding proteins in post-transcriptional gene regulation and innate immunity\"','http://www.rockefeller.edu/labheads/tuschl/','Charles G. Miller Auditorium (B102 CLSL)','Dr. Satish Nair','Cara Day','caraday@illinois.edu','217.333.2013','Seminar','Biochemistry Department Seminars','2013-12-06 18:00:00','2013-12-06 19:00:00','2013-11-25 22:55:03','2013-11-25 22:55:03'),(2411,'29630947','12/4/2013','4:00 pm','12/4/2013',NULL,'Westcott & Carter Fellow:  Neal Andruska (Shapiro Lab) - A Small Molecule Inhibitor Reveals a Novel Pathway of Estrogen Receptor Action and Induces Regression of Breast Cancers',NULL,'116 RAL','Department of Biochemistry',NULL,NULL,NULL,'Seminar','Biochemistry Department Graduate Seminars','2013-12-04 22:00:00','2013-12-04 06:00:00','2013-11-26 15:00:04','2013-11-26 15:00:04'),(2412,'30650696','12/9/2013','12:00 pm','12/9/2013',NULL,'Special Microbiology Seminar:  \"Mechanisms of Environmental Signaling  in E. coli and Salmonella Pathogenesis\"',NULL,'Charles G. Miller Auditorium, Room B102 Chemical & Life Sciences Laboratory','Dr. James Slauch, Professor','Diane Tsevelekos','microsem@life.illinois.edu','333-1736','Seminar','Microbiology Department','2013-12-09 18:00:00','2013-12-09 06:00:00','2013-11-26 16:50:03','2013-11-26 16:50:03'),(2418,'30881368','12/5/2013','12:00 pm','12/5/2013','1:00 pm','MIP Student Seminar: Featuring Alicia Dietric and Harry Rosenberg',NULL,'Charles G. Miller Auditorium, B102 CLSL','MIP Seminar Committee','Julie Moore','jmoor@illinois.edu','300-5804','Seminar','Molecular and Integrative Physiology (MIP) Department Seminar Series','2013-12-05 18:00:00','2013-12-05 19:00:00','2013-12-02 17:15:07','2013-12-02 17:15:07'),(2420,'29631026','12/11/2013','4:00 pm','12/11/2013',NULL,'Chang Sun (Wraight Lab) - \"Electron Transfer involving LM dimer of bacterial photosynthetic reaction from Rhodobacter sphaeroides\"',NULL,'116 RAL','Department of Biochemistry',NULL,NULL,NULL,'Seminar','Biochemistry Department Graduate Seminars','2013-12-11 22:00:00','2013-12-11 06:00:00','2013-12-03 20:25:03','2013-12-03 20:25:03'),(2433,'28783891','4/2/2014','12:00 pm','4/2/2014',NULL,'Cell &  Developmental Biology Seminar:   Dr. Janet Rossant, University of Toronto, \"Stem cells and blastocyst development\"',NULL,'Charles G. Miller Auditorium, B102 CLSL','Cell & Developmental Biology Department','Elaine Rodgers; Phil Newmark','erodgers@life.illinois.edu; pnewmark@life.illinois.edu','217-265-5511','Seminar','Cell and Developmental Biology (CDB) Departmental Seminars','2014-04-02 17:00:00','2014-04-02 05:00:00','2013-12-05 16:15:03','2013-12-05 16:15:03'),(2444,'29631025','12/11/2013','4:00 pm','12/11/2013',NULL,'Ranjani Murali (Gennis Lab) - \"Novel Nitric oxide reductases: Newly discovered members of the Heme-copper oxidase superfamily\"',NULL,'116 RAL','Department of Biochemistry',NULL,NULL,NULL,'Seminar','Biochemistry Department Graduate Seminars','2013-12-11 22:00:00','2013-12-11 06:00:00','2013-12-05 21:05:04','2013-12-05 21:05:04'),(2455,'30906980','1/23/2014','12:00 pm','1/23/2014',NULL,'MIP Faculty Search Candidate Seminar: Dr. Nien-Pei Tsai, University of Texas Southwestern Medical Center, \"Molecular Mechanisms of Synapse Elimination by Autism-linked Genes\"',NULL,'Charles G. Miller Auditorium, B102 CLSL','Molecular & Integrative Physiology Dept.','Julie Moore','jmoor@illinois.edu','300-5804','Seminar','Molecular and Integrative Physiology (MIP) Department Seminar Series','2014-01-23 18:00:00','2014-01-23 06:00:00','2013-12-10 16:35:03','2013-12-10 16:35:03'),(2456,'30906987','1/27/2014','2:00 pm','1/27/2014',NULL,'MIP Faculty Search Candidate Seminar: Dr. Zheng Sun, Perelman School of Medicine at the University of Pennsylvania, \"Epigenomic Regulation of Metabolism by Histone Deacetylase 3 (HDAC3)\"',NULL,'Charles G. Miller Auditorium, B102 CLSL','Molecular & Integrative Physiology Dept.','Julie Moore','jmoor@illinois.edu','300-5804','Seminar','Molecular and Integrative Physiology (MIP) Department Seminar Series','2014-01-27 20:00:00','2014-01-27 06:00:00','2013-12-10 16:35:03','2013-12-10 16:35:03'),(2457,'30907670','1/30/2014','12:00 pm','1/30/2014',NULL,'MIP Faculty Search Candidate Seminar: Dr. Michael Hoppa, Weill Cornell Medical College, \"A New Layer of Synaptic Plasticity, The Action Potential Waveform\"',NULL,'Charles G. Miller Auditorium, B102 CLSL','Molecular & Integrative Physiology Dept.','Julie Moore','jmoor@illinois.edu','300-5804','Seminar','Molecular and Integrative Physiology (MIP) Department Seminar Series','2014-01-30 18:00:00','2014-01-30 06:00:00','2013-12-10 16:35:04','2013-12-10 16:35:04'),(2459,'30907673','2/6/2014','12:00 pm','2/6/2014',NULL,'MIP Faculty Search Candidate Seminar: Dr. Erik Nelson, Duke University School of Medicine, Pharmacology and Cancer Biology, \"Obesity, Hypercholesterolemia and Breast Cancer\"',NULL,'Charles G. Miller Auditorium, B102 CLSL','Molecular & Integrative Physiology Dept.','Julie Moore','jmoor@illinois.edu','300-5804','Seminar','Molecular and Integrative Physiology (MIP) Department Seminar Series','2014-02-06 18:00:00','2014-02-06 06:00:00','2013-12-10 16:35:04','2013-12-10 16:35:04'),(2463,'30770716','12/11/2013','12:00 pm','12/11/2013',NULL,'Cell &  Developmental Biology Faculty Search Candidate Seminar:   Dr. Amy Ralston, University of California, Santa Cruz, \"Molecular regulation of stem cell origins during mouse development\"',NULL,'Charles G. Miller Auditorium, B102 CLSL','Cell & Developmental Biology Department','Elaine Rodgers; Phil Newmark','erodgers@life.illinois.edu; pnewmark@life.illinois.edu','217-265-5511','Seminar','Cell and Developmental Biology (CDB) Departmental Seminars','2013-12-11 18:00:00','2013-12-11 06:00:00','2013-12-11 16:40:04','2013-12-11 16:40:04'),(2476,'29250965','11/22/2014',NULL,'11/22/2014',NULL,'Thanksgiving Break Begins',NULL,NULL,'U-C Senate',NULL,NULL,NULL,'Academic','Academic Dates','2014-11-22 06:00:00','2014-11-22 06:00:00','2013-12-12 06:00:04','2013-12-12 06:00:04'),(2477,'29250949','12/1/2014',NULL,'12/1/2014',NULL,'Instruction resumes',NULL,NULL,'U-C Senate',NULL,NULL,NULL,'Academic','Academic Dates','2014-12-01 06:00:00','2014-12-01 06:00:00','2013-12-12 06:00:04','2013-12-12 06:00:04'),(2486,'31039745','2/17/2014','2:00 pm','2/17/2014',NULL,'MIP Faculty Search Candidate Seminar: Dr. Catherine Christian, Stanford University, \"The Brain\'s little Helper: Antiepileptic actions of endozepines in the thalamus\".',NULL,'Charles G. Miller Auditorium, B102 CLSL','Molecular & Integrative Physiology Dept.','Julie Moore','jmoor@illinois.edu','300-5804','Seminar','Molecular and Integrative Physiology (MIP) Department Seminar Series','2014-02-17 20:00:00','2014-02-17 06:00:00','2013-12-16 22:10:04','2013-12-16 22:10:04'),(2488,'31039744','2/13/2014','12:00 pm','2/13/2014',NULL,'MIP Faculty Search Candidate Seminar: Dr. Hye Yoon Park, Albert Einstein College of Medicine, Watching Single Endogenous mRNA in Neurons in vivo.',NULL,'Charles G. Miller Auditorium, B102 CLSL','Molecular & Integrative Physiology Dept.','Julie Moore','jmoor@illinois.edu','300-5804','Seminar','Molecular and Integrative Physiology (MIP) Department Seminar Series','2014-02-13 18:00:00','2014-02-13 06:00:00','2013-12-17 16:45:03','2013-12-17 16:45:03'),(2489,'31047602','12/12/2013',NULL,'12/23/2013',NULL,'IT No Change Period in effect',NULL,NULL,'CITES','CITES Help Desk','consult@illinois.edu','244-7000','Academic','Academic Dates','2013-12-12 06:00:00','2013-12-23 06:00:00','2013-12-17 17:15:03','2013-12-17 17:15:03'),(2490,'29251031','12/10/2014',NULL,'12/10/2014',NULL,'Last Day of Instruction, Fall Semester',NULL,NULL,'U-C Senate',NULL,NULL,NULL,'Academic','Academic Dates','2014-12-10 06:00:00','2014-12-10 06:00:00','2013-12-24 06:00:03','2013-12-24 06:00:03'),(2491,'29251032','12/12/2014',NULL,'12/12/2014',NULL,'Final Exams Begin',NULL,NULL,'U-C Senate',NULL,NULL,NULL,'Academic','Academic Dates','2014-12-12 06:00:00','2014-12-12 06:00:00','2013-12-24 06:00:03','2013-12-24 06:00:03'),(2492,'29251098','1/20/2015',NULL,'1/20/2015',NULL,'First Day of Instruction, Spring Semester',NULL,NULL,'U-C Senate',NULL,NULL,NULL,'Academic','Academic Dates','2015-01-20 06:00:00','2015-01-20 06:00:00','2013-12-24 06:00:03','2013-12-24 06:00:03'),(2502,'31225357','5/8/2014',NULL,'5/20/2014',NULL,'IT No Change Period in effect',NULL,NULL,'CITES','CITES Help Desk','consult@illinois.edu','244-7000','Academic','Academic Dates','2014-05-08 05:00:00','2014-05-20 05:00:00','2014-01-02 18:45:04','2014-01-02 18:45:04'),(2503,'31225358','12/11/2014',NULL,'12/23/2014',NULL,'IT No Change Period in effect',NULL,NULL,'CITES','CITES Help Desk','consult@illinois.edu','244-7000','Academic','Academic Dates','2014-12-11 06:00:00','2014-12-23 06:00:00','2014-01-02 18:50:03','2014-01-02 18:50:03'),(2505,'31226469','2/24/2014','2:00 pm','2/24/2014',NULL,'MIP Faculty Search Candidate Seminar: Dr. Bernadette Grayson, University of Cincinnati, \" Bariatric surgery: A cure or a curse?\"',NULL,'Charles G. Miller Auditorium, B102 CLSL','Molecular & Integrative Physiology Dept.','Julie Moore','jmoor@illinois.edu','300-5804','Seminar','Molecular and Integrative Physiology (MIP) Department Seminar Series','2014-02-24 20:00:00','2014-02-24 06:00:00','2014-01-02 20:20:04','2014-01-02 20:20:04'),(2506,'30907672','2/3/2014','2:00 pm','2/3/2014',NULL,'MIP Faculty Search Candidate Seminar: Dr. Mathew Tantama, Harvard Medical School, \"Illuminating the Cellular Fuel Gauge: Protein Engineering Sensors for Single-Cell Imaging\"',NULL,'Charles G. Miller Auditorium, B102 CLSL','Molecular & Integrative Physiology Dept.','Julie Moore','jmoor@illinois.edu','300-5804','Seminar','Molecular and Integrative Physiology (MIP) Department Seminar Series','2014-02-03 20:00:00','2014-02-03 06:00:00','2014-01-03 16:55:03','2014-01-03 16:55:03'),(2507,'30981156','1/22/2014','12:00 pm','1/22/2014',NULL,'Cell &  Developmental Biology Faculty Search Candidate Seminar:   Dr. Wenqian Hu, Whitehead Institute for Biomedical Research, \"Regulation of Erythropoiesis by Long Noncoding RNAs and mRNA Binding Proteins\"',NULL,'Charles G. Miller Auditorium, B102 CLSL','Cell & Developmental Biology Department','Elaine Rodgers; Phil Newmark','erodgers@life.illinois.edu; pnewmark@life.illinois.edu','217-265-5511','Seminar','Cell and Developmental Biology (CDB) Departmental Seminars','2014-01-22 18:00:00','2014-01-22 06:00:00','2014-01-03 17:25:03','2014-01-03 17:25:03'),(2508,'30974177','2/6/2014','4:00 pm','2/6/2014',NULL,'Microbiology Seminar:  Dr. Kenneth Bayles of University of Nebraska, \"Spatial and temporal control of gene expression during Staphylococcus aureus biofilm development\"',NULL,'Charles G. Miller Auditorium, Room B102 Chemical & Life Sciences Laboratory','Dr. Thomas Kehl-Fie, Assistant Professor','Diane Tsevelekos','microsem@life.illinois.edu','333-1736','Seminar','Microbiology Department','2014-02-06 22:00:00','2014-02-06 06:00:00','2014-01-03 21:15:03','2014-01-03 21:15:03'),(2510,'31281998','2/20/2014','12:00 pm','2/20/2014',NULL,'MIP Faculty Search Candidate Seminar: Dr. Sona Kang, Harvard Medical School, \"Transcriptional and Epigenomic Control of Adipose Biology\"',NULL,'Charles G. Miller Auditorium, B102 CLSL','Molecular & Integrative Physiology Dept.','Julie Moore','jmoor@illinois.edu','300-5804','Seminar','Molecular and Integrative Physiology (MIP) Department Seminar Series','2014-02-20 18:00:00','2014-02-20 06:00:00','2014-01-07 19:15:03','2014-01-07 19:15:03'),(2511,'30974174','1/23/2014','4:00 pm','1/23/2014',NULL,'Microbiology Seminar:  Dr. Christoper Waters of Michigan State University, \"Cyclic di-GMP: A regulatory maestro that orchestrates bacterial biofilm formation and motility\"',NULL,'Charles G. Miller Auditorium, Room B102 Chemical & Life Sciences Laboratory','Dr. Carin Vanderpool, Associate Professor','Diane Tsevelekos','microsem@life.illinois.edu','333-1736','Seminar','Microbiology Department','2014-01-23 22:00:00','2014-01-23 06:00:00','2014-01-07 21:15:03','2014-01-07 21:15:03'),(2514,'30974176','1/30/2014','4:00 pm','1/30/2014',NULL,'Microbiology Seminar:  Dr. Allison Hansen of University of Illinois/Entomology, \"Small RNAs in Small Genomes\"',NULL,'Charles G. Miller Auditorium, Room B102 Chemical & Life Sciences Laboratory','Dr. Carin Vanderpool, Associate Professor','Diane Tsevelekos','microsem@life.illinois.edu','333-1736','Seminar','Microbiology Department','2014-01-30 22:00:00','2014-01-30 06:00:00','2014-01-07 21:20:04','2014-01-07 21:20:04'),(2518,'31346390','2/10/2014','2:00 pm','2/10/2014',NULL,'MIP Faculty Search Candidate Seminar: Dr. Benjamin T. Spike, The Salk Institute for Biological Studies, \"Deconstructing Stem Cells and Cancer from the Fetal Mammary Perspective\"',NULL,'Charles G. Miller Auditorium, B102 CLSL','Molecular & Integrative Physiology Dept.','Julie Moore','jmoor@illinois.edu','300-5804','Seminar','Molecular and Integrative Physiology (MIP) Department Seminar Series','2014-02-10 20:00:00','2014-02-10 06:00:00','2014-01-13 15:10:03','2014-01-13 15:10:03'),(2520,'31223732','1/22/2014','4:00 pm','1/22/2014','5:00 pm','Biochemistry Seminar (Molecular Neuroscience Faculty Search Candidate): Dr. Kai Zhang (Stanford University), \"Observing and Steering Nerve Growth Factor Signaling in Live Cells\"','http://med.stanford.edu/profiles/postdocs/researcher/Kai_Zhang/','116 Roger Adams Laboratory (RAL)','Dr. Emad Tajkhorshid','Cara Day','caraday@illinois.edu','217.333.2013','Seminar','Biochemistry Department Seminars','2014-01-22 22:00:00','2014-01-22 23:00:00','2014-01-13 17:10:04','2014-01-13 17:10:04'),(2521,'31006044','1/24/2014','12:00 pm','1/24/2014','1:00 pm','Biochemistry Seminar (Molecular Neuroscience Faculty Search Candidate): Dr. Lin Jiang (UCLA) Amyloid protein aggregation: structure, computation, mechanism and therapeutics\"','http://people.mbi.ucla.edu/jiangl/','Charles G. Miller Auditorium (B102 CLSL)','Dr. Satish Nair','Cara Day','caraday@illinois.edu','217.333.2013','Seminar','Biochemistry Department Seminars','2014-01-24 18:00:00','2014-01-24 19:00:00','2014-01-13 17:10:04','2014-01-13 17:10:04'),(2522,'30907671','1/31/2014','12:00 pm','1/31/2014','1:00 pm','Biochemistry Seminar (Molecular Neuroscience Faculty Search Candidate): Dr. Lukasz Joachimiak (Stanford University) Deciphering the architecture and mechanics of a protein folding machine: the eukaryotic chaperonin TRiC/CCT\"','http://www.stanford.edu/group/frydman/mobile/people.html','Charles G. Miller Auditorium (B102 CLSL)','Dr. Satish Nair','Cara Day','caraday@illinois.edu','217.333.2013','Seminar','Biochemistry Department Seminars','2014-01-31 18:00:00','2014-01-31 19:00:00','2014-01-13 17:20:03','2014-01-13 17:20:03'),(2527,'30985037','2/20/2014','4:00 pm','2/20/2014',NULL,'Microbiology Seminar/CBITG:  Dr. Roberto Kolter of Harvard Medical School, \"Chemical Ecology of Microbial Interspecies Interactions\"',NULL,'Charles G. Miller Auditorium, Room B102 Chemical & Life Sciences Laboratory','CBITG','Diane Tsevelekos','microsem@life.illinois.edu','333-1736','Seminar','Microbiology Department','2014-02-20 22:00:00','2014-02-20 06:00:00','2014-01-14 16:20:03','2014-01-14 16:20:03'),(2528,'30984611','2/13/2014','4:00 pm','2/13/2014',NULL,'Microbiology Seminar:  Dr. Juliane Bubeck-Wardenburg of University of Chicago, \"Staphylococcus aureus alpha-toxin: complexities of a host-pathogen interaction\"',NULL,'Charles G. Miller Auditorium, Room B102 Chemical & Life Sciences Laboratory','Dr. Steven Blanke, Professor','Diane Tsevelekos','microsem@life.illinois.edu','333-1736','Seminar','Microbiology Department','2014-02-13 22:00:00','2014-02-13 06:00:00','2014-01-17 23:00:04','2014-01-17 23:00:04'),(2532,'29631029','2/5/2014','4:00 pm','2/5/2014',NULL,'Kiruthika Selvadurai (Huang Lab) -  \"Archaeal Elp3 Catalyzes tRNA Modification via a Radical Mechanism.\"',NULL,'116 RAL','Department of Biochemistry',NULL,NULL,NULL,'Seminar','Biochemistry Department Graduate Seminars','2014-02-05 22:00:00','2014-02-05 06:00:00','2014-01-21 16:50:03','2014-01-21 16:50:03'),(2537,'31283828','1/23/2014','9:30 am','1/23/2014',NULL,'Sharon Choi - Anne A. Johnson Work Awardee (Morrissey Lab)',NULL,NULL,'Department of Biochemistry',NULL,NULL,NULL,'Seminar','Biochemistry Department Graduate Seminars','2014-01-23 15:30:00','2014-01-23 06:00:00','2014-01-23 15:25:03','2014-01-23 15:25:03'),(2538,'31348782','1/29/2014','4:00 pm','1/29/2014','5:00 pm','Biochemistry Seminar: Dr. Sharon Choi (2013 Anne A. Johnson Work Award Seminar), \"Polyphosphate modulates hemostasis, thrombosis, and inflammation\"',NULL,'B102 CLSL','Dr. James A. Morrissey','Cara L. Day','caraday@illinois.edu','217.333.2013','Seminar','Biochemistry Department Seminars','2014-01-29 22:00:00','2014-01-29 23:00:00','2014-01-23 20:50:04','2014-01-23 20:50:04'),(2546,'30308147','2/28/2014','12:00 pm','2/28/2014',NULL,'Biochemistry Seminar: Dr. Hau Lou (Case Western Reserve University) \"Calcium-mediated epigenetic regulation of alternative splicing in cardiomyocytes\"','http://genetics.case.edu/page.php?page_id=5&LN=Lou&FN=Hua','Charles G. Miller Auditorium (B102 CLSL)','Dr. Auinash Kalsotra','Cara Day','caraday@illinois.edu','217-333-2013','Seminar','Biochemistry Department Seminars','2014-02-28 18:00:00','2014-02-28 06:00:00','2014-01-24 22:45:03','2014-01-24 22:45:03'),(2547,'31471306','2/7/2014','12:00 pm','2/7/2014','1:00 pm','Biochemistry Seminar (Molecular Neuroscience Faculty Search Candidate): Dr. Erhu Cao (UCSF), \"Functional and Structural Insights into TRPV1 Activation\"','http://profiles.ucsf.edu/erhu.cao','Charles G. Miller Auditorium (B102 CLSL)','Dr. Hong Jin','Cara Day','caraday@illinois.edu','217.333.2013','Seminar','Biochemistry Department Seminars','2014-02-07 18:00:00','2014-02-07 19:00:00','2014-01-24 23:05:04','2014-01-24 23:05:04'),(2552,'30308341','5/2/2014','12:00 pm','5/2/2014',NULL,'Biochemistry Seminar: Dr. Kristen W. Lynch (University of Pennsylvania School of Medicine) \"Mechanisms for Transmitting Cell Stimulation Signals to Control Alternative Splicing Programs\"','http://www.med.upenn.edu/lynchlab/','Charles G. Miller Auditorium (B102 CLSL)','Dr. Auinash Kalsotra','Cara Day','caraday@illinois.edu','217-333-2013','Seminar','Biochemistry Department Seminars','2014-05-02 17:00:00','2014-05-02 05:00:00','2014-01-28 15:40:04','2014-01-28 15:40:04'),(2553,'31472983','2/12/2014','12:00 pm','2/12/2014',NULL,'Cell &  Developmental Biology Faculty Search Candidate Seminar:   Dr. Meelad Dawlaty, Whitehead Institute for Biomedical Research,\"Epigenetic Regulation of Stem Cells and Development by Tet Enzymes\"',NULL,'Charles G. Miller Auditorium, B102 CLSL','Cell & Developmental Biology Department','Elaine Rodgers; Phil Newmark','erodgers@life.illinois.edu; pnewmark@life.illinois.edu','217-265-5511','Seminar','Cell and Developmental Biology (CDB) Departmental Seminars','2014-02-12 18:00:00','2014-02-12 06:00:00','2014-01-28 20:15:03','2014-01-28 20:15:03'),(2558,'29631031','3/5/2014','4:00 pm','3/5/2014',NULL,'Padmaja Venkatakrishnan (Gennis lab) - \" The Alternative Complex III from Flavobacterium johnsoniae\'\"',NULL,'116 RAL','Department of Biochemistry',NULL,NULL,NULL,'Seminar','Biochemistry Department Graduate Seminars','2014-03-05 22:00:00','2014-03-05 06:00:00','2014-01-29 15:45:04','2014-01-29 15:45:04'),(2560,'31518797','2/19/2014','12:00 pm','2/19/2014',NULL,'Cell &  Developmental Biology Faculty Search Candidate Seminar:   Dr. SeYeon Chung, Johns Hopkins Univ. School of Medicine, Dept. of Cell Biology, \"Apical membrane dynamics in tubular epithelia\"',NULL,'Charles G. Miller Auditorium, B102 CLSL','Cell & Developmental Biology Department','Elaine Rodgers; Phil Newmark','erodgers@life.illinois.edu; pnewmark@life.illinois.edu','217-265-5511','Seminar','Cell and Developmental Biology (CDB) Departmental Seminars','2014-02-19 18:00:00','2014-02-19 06:00:00','2014-01-29 17:50:03','2014-01-29 17:50:03'),(2561,'31527769','2/26/2014','12:00 pm','2/26/2014',NULL,'Cell &  Developmental Biology Faculty Search Candidate Seminar:   Dr. Timothy Mosca, Stanford University, Department of Biology, \"Deciphering the Molecular and Circuit Logic of Synapse Formation in Drosophila\"',NULL,'Charles G. Miller Auditorium, B102 CLSL','Cell & Developmental Biology Department','Elaine Rodgers; Phil Newmark','erodgers@life.illinois.edu; pnewmark@life.illinois.edu','217-265-5511','Seminar','Cell and Developmental Biology (CDB) Departmental Seminars','2014-02-26 18:00:00','2014-02-26 06:00:00','2014-01-29 17:50:03','2014-01-29 17:50:03'),(2564,'31537116','2/12/2014','4:00 pm','2/12/2014','5:00 pm','Biochemistry Seminar (Molecular Neuroscience Faculty Search Candidate): Dr. Erik Procko (University of Washington), \"Using designer proteins to explore biology: computational design of protein-protein interactions\"','http://depts.washington.edu/bakerpg/drupal/node/384/','116 Roger Adams Laboratory (RAL)','Dr. Emad Tajkhorshid','Cara Day','caraday@illinois.edu','217.333.2013','Seminar','Biochemistry Department Seminars','2014-02-12 22:00:00','2014-02-12 23:00:00','2014-01-30 15:15:04','2014-01-30 15:15:04'),(2565,'30985295','3/13/2014','4:00 pm','3/13/2014',NULL,'Microbiology Seminar:  Dr. David Weiss of University of Iowa, \"Novel bacterial cell division proteins involved in cell wall biogenesis\"',NULL,'Charles G. Miller Auditorium, Room B102 Chemical & Life Sciences Laboratory','Dr. James Slauch, Professor','Diane Tsevelekos','microsem@life.illinois.edu','333-1736','Seminar','Microbiology Department','2014-03-13 21:00:00','2014-03-13 05:00:00','2014-01-30 16:55:03','2014-01-30 16:55:03'),(2567,'30981157','3/3/2014','12:00 pm','3/3/2014',NULL,'Cell &  Developmental Biology Faculty Search Candidate Seminar:   Dr. Xin Li, New York University, \"Generating neural diversity in the Drosophila medulla\"',NULL,'Charles G. Miller Auditorium, B102 CLSL','Cell & Developmental Biology Department','Elaine Rodgers; Phil Newmark','erodgers@life.illinois.edu; pnewmark@life.illinois.edu','217-265-5511','Seminar','Cell and Developmental Biology (CDB) Departmental Seminars','2014-03-03 18:00:00','2014-03-03 06:00:00','2014-01-30 18:45:03','2014-01-30 18:45:03'),(2579,'29631033','2/19/2014','4:00 pm','2/19/2014',NULL,'Richard Travers (Morrissey Lab) - \"Polyphosphate Inhibitors as Novel Antithrombotic Therapeutics.\"',NULL,'116 RAL','Department of Biochemistry',NULL,NULL,NULL,'Seminar','Biochemistry Department Graduate Seminars','2014-02-19 22:00:00','2014-02-19 06:00:00','2014-02-04 17:15:07','2014-02-04 17:15:07'),(2580,'29685606','2/19/2014','4:00 pm','2/19/2014',NULL,'HAGER GRADUATE FELLOW IN BIOCHEMISTRY: Yue Hao (Nair lab) - \"Structural Studies of Tailoring Enzymes that Modify Ribosomal Peptide Antibiotics:',NULL,'116 RAL','Department of Biochemistry',NULL,NULL,NULL,'Seminar','Biochemistry Department Graduate Seminars','2014-02-19 22:00:00','2014-02-19 06:00:00','2014-02-04 17:25:04','2014-02-04 17:25:04'),(2582,'29630399','3/4/2014','12:00 pm','3/4/2014','1:00 pm','CDB Student & Postdoc Seminar, Christina Plaisier & Dr. Bo Wang',NULL,'B102 CLSL','Cell & Developmental Biology Department','Shannon Croft','shannon9@life.illinois.edu','(217) 333-6118','Lecture','Cell and Developmental Biology (CDB) Student & Postdoc Seminars','2014-03-04 18:00:00','2014-03-04 19:00:00','2014-02-06 20:05:03','2014-02-06 20:05:03'),(2584,'29630609','2/6/2014','2:15 pm','2/6/2014',NULL,'Fiona Goninger-Poe (Gerlt Lab)',NULL,'116 RAL','Department of Biochemistry',NULL,NULL,NULL,'Seminar','Biochemistry Department Graduate Seminars','2014-02-06 20:15:00','2014-02-06 06:00:00','2014-02-06 20:15:03','2014-02-06 20:15:03'),(2586,'29630397','2/17/2014','12:00 pm','2/17/2014','1:00 pm','CDB Student & Postdoc Seminar, Sumanprava Giri & James Chu',NULL,'B102 CLSL','Cell & Developmental Biology Department','Shannon Croft','shannon9@life.illinois.edu','(217) 333-6118','Lecture','Cell and Developmental Biology (CDB) Student & Postdoc Seminars','2014-02-17 18:00:00','2014-02-17 19:00:00','2014-02-06 21:30:04','2014-02-06 21:30:04'),(2591,'31631918','2/27/2014','12:00 pm','2/27/2014',NULL,'MIP Faculty Search Candidate Seminar: Dr. Erik Nelson, Duke University School of Medicine, Pharmacology and Cancer Biology, \"Obesity, Hypercholesterolemia and Breast Cancer\"',NULL,'Charles G. Miller Auditorium, B102 CLSL','Molecular & Integrative Physiology Dept.','Julie Moore','jmoor@illinois.edu','300-5804','Seminar','Molecular and Integrative Physiology (MIP) Department Seminar Series','2014-02-27 18:00:00','2014-02-27 06:00:00','2014-02-07 22:15:04','2014-02-07 22:15:04'),(2593,'29855621','4/4/2014','12:00 pm','4/4/2014',NULL,'Biochemistry Seminar: Dr. Jingshi Shen (University of Colorado) \"Regulatory Mechanisms of Exocytosis\"','https://mcdb.colorado.edu/directory/shen_j.html','Charles G. Miller Auditorium (B102 CLSL)','Dr. Rudy Fratti','Cara Day','caraday@illinois.edu','217-333-2013','Seminar','Biochemistry Department Seminars','2014-04-04 17:00:00','2014-04-04 05:00:00','2014-02-10 14:50:03','2014-02-10 14:50:03'),(2597,'28187562','2/20/2014','4:00 pm','2/20/2014','5:00 pm','Biochemistry Seminar: Dr. Roberto Kolter (Harvard University) \"Chemical Ecology of Microbial Interspecies Interactions\"','http://micro.med.harvard.edu/faculty/kolter.html','Charles G. Miller Auditorium (B102 CLSL)','Chemistry-Biology Interface Training Program and the Department of Microbiology','Nan Holda','holda@illinois.edu','217.244-5450','Seminar','Biochemistry Department Seminars','2014-02-20 22:00:00','2014-02-20 23:00:00','2014-02-12 17:05:04','2014-02-12 17:05:04'),(2601,'30985294','3/6/2014','4:00 pm','3/6/2014',NULL,'Microbiology Seminar:  Dr. John Coates of University of California-Berkeley, \"Sour and sweet with a little salt!  Perchlorate control of oil reservoir H2S biogenesis\"',NULL,'Charles G. Miller Auditorium, Room B102 Chemical & Life Sciences Laboratory','Dr. Isaac Cann, Professor','Diane Tsevelekos','microsem@life.illinois.edu','333-1736','Seminar','Microbiology Department','2014-03-06 22:00:00','2014-03-06 06:00:00','2014-02-13 16:00:04','2014-02-13 16:00:04'),(2603,'30985293','2/27/2014','4:00 pm','2/27/2014',NULL,'Microbiology Seminar:  Dr. Seema Mattoo of Purdue Univerity, \"Fic Proteins:  An Exciting Frontier in Post-Translational Regulation of Cell Signaling\"',NULL,'Charles G. Miller Auditorium, Room B102 Chemical & Life Sciences Laboratory','Dr. Brenda Wilson, Associate Professor','Diane Tsevelekos','microsem@life.illinois.edu','333-1736','Seminar','Microbiology Department','2014-02-27 22:00:00','2014-02-27 06:00:00','2014-02-18 22:05:03','2014-02-18 22:05:03'),(2604,'29631034','2/26/2014','4:00 pm','2/26/2014',NULL,'Zhongyi Li (Martinis Lab) - Mechanism of leucyl-tRNA synthetase-dependent RNA splicing function',NULL,'116 RAL','Department of Biochemistry',NULL,NULL,NULL,'Seminar','Biochemistry Department Graduate Seminars','2014-02-26 22:00:00','2014-02-26 06:00:00','2014-02-19 20:05:04','2014-02-19 20:05:04'),(2607,'29631035','2/26/2014','4:00 pm','2/26/2014',NULL,'Gus Lawrence (Fratti Lab) - \"The role of the guanine nucleotide exchange factor Mon1 and regulatory lipids in control of endocytic trafficking\"',NULL,'116 RAL','Department of Biochemistry',NULL,NULL,NULL,'Seminar','Biochemistry Department Graduate Seminars','2014-02-26 22:00:00','2014-02-26 06:00:00','2014-02-20 21:05:04','2014-02-20 21:05:04'),(2608,'29631039','3/12/2014','4:00 pm','3/12/2014',NULL,'Alex Cioffi (Burke Lab) -  \"Molecular Prosthetics in Cells.\"',NULL,'116 RAL','Department of Biochemistry',NULL,NULL,NULL,'Seminar','Biochemistry Department Graduate Seminars','2014-03-12 21:00:00','2014-03-12 05:00:00','2014-02-24 19:45:04','2014-02-24 19:45:04'),(2609,'29631030','3/5/2014','4:00 pm','3/5/2014',NULL,'Ismaeel Muhamed (Leckband Lab) - \"The mechanical language of cadherin.\"',NULL,'116 RAL','Department of Biochemistry',NULL,NULL,NULL,'Seminar','Biochemistry Department Graduate Seminars','2014-03-05 22:00:00','2014-03-05 06:00:00','2014-02-26 22:35:04','2014-02-26 22:35:04'),(2611,'28783903','3/5/2014','12:00 pm','3/5/2014',NULL,'Cell &  Developmental Biology Seminar:   Dr. Paul Sternberg, Caltech, \"Systems Biology of Cell Migration in C. elegans\"\"',NULL,'Charles G. Miller Auditorium, B102 CLSL','Cell & Developmental Biology Department','Elaine Rodgers; Phil Newmark','erodgers@life.illinois.edu; pnewmark@life.illinois.edu','217-265-5511','Seminar','Cell and Developmental Biology (CDB) Departmental Seminars','2014-03-05 18:00:00','2014-03-05 06:00:00','2014-02-28 19:55:04','2014-02-28 19:55:04'),(2612,'31619185','3/19/2014','4:00 pm','3/19/2014',NULL,'Daniel Harris (Kranz Lab) - - \"Engineering Human T Cell Receptors for Adoptive T Cell Therapies\"',NULL,NULL,'Department of Biochemistry',NULL,NULL,NULL,'Seminar','Biochemistry Department Graduate Seminars','2014-03-19 21:00:00','2014-03-19 05:00:00','2014-03-03 17:41:11','2014-03-03 17:41:11'),(2613,'31718624','3/20/2014','12:00 pm','3/20/2014',NULL,'\"Crosstalk between Nuclear Receptors and Inflammation in the Liver\"',NULL,'Charles G. Miller Auditorium, B102 CLSL','MIP Seminar Committee','Julie Moore','jmoor@illinois.edu','300-5804','Seminar','Molecular and Integrative Physiology (MIP) Department Seminar Series','2014-03-20 17:00:00','2014-03-20 05:00:00','2014-03-03 21:45:03','2014-03-03 21:45:03'),(2614,'29631038','3/12/2014','4:00 pm','3/12/2014',NULL,'Xinyun Cao (Cronan Lab) - Functional Investigation of Streptomyces coelicolor Lipoate Protein Ligase A (LplA)',NULL,'116 RAL','Department of Biochemistry',NULL,NULL,NULL,'Seminar','Biochemistry Department Graduate Seminars','2014-03-12 21:00:00','2014-03-12 05:00:00','2014-03-04 14:40:03','2014-03-04 14:40:03'),(2615,'31593130','3/12/2014','12:00 pm','3/12/2014',NULL,'Cell &  Developmental Biology Seminar:   Dr. Takako Moriguchi, University of Iowa Carver College of Medicine, \"Dissecting glycan-deficient muscular dystrophies\"',NULL,'Charles G. Miller Auditorium, B102 CLSL','Cell & Developmental Biology Department','Elaine Rodgers; Phil Newmark','erodgers@life.illinois.edu; pnewmark@life.illinois.edu','217-265-5511','Seminar','Cell and Developmental Biology (CDB) Departmental Seminars','2014-03-12 17:00:00','2014-03-12 05:00:00','2014-03-04 17:30:04','2014-03-04 17:30:04'),(2617,'31353081','3/14/2014','12:00 pm','3/14/2014',NULL,'Biochemistry Seminar: Dr. Susan M. Rosenberg (Baylor College of Medicine) \"How Bacteria and Cancer Cells Regulate Mutagenesis and Their Ability to Evolve\"','https://www.bcm.edu/departments/molecular-and-human-genetics/index.cfm?pmid=11034','Charles G. Miller Auditorium (B102 CLSL)','Dr. Jim Morrissey','Cara Day','caraday@illinois.edu','217-333-2013','Seminar','Biochemistry Department Seminars','2014-03-14 17:00:00','2014-03-14 05:00:00','2014-03-06 21:55:03','2014-03-06 21:55:03'),(2618,'30985297','4/3/2014','4:00 pm','4/3/2014',NULL,'Microbiology Seminar:  Dr. Alan Davidson of Univerity of Toronto, \"How phages fight back against the CRISPR/Cas bacterial immune system\"',NULL,'Charles G. Miller Auditorium, Room B102 Chemical & Life Sciences Laboratory','Dr. Rachel Whitaker, Associate Professor','Diane Tsevelekos','microsem@life.illinois.edu','333-1736','Seminar','Microbiology Department','2014-04-03 21:00:00','2014-04-03 05:00:00','2014-03-07 20:15:04','2014-03-07 20:15:04'),(2620,'29631028','3/19/2014','4:00 pm','3/19/2014',NULL,'Hanchao Zhao (Martinis Lab) - Post-transfer Editing is regulated by a Tyrosine Switch in Eukaryotic and Archaeal Leucyl-tRNA Synthetase',NULL,'116 RAL','Department of Biochemistry',NULL,NULL,NULL,'Seminar','Biochemistry Department Graduate Seminars','2014-03-19 21:00:00','2014-03-19 05:00:00','2014-03-10 16:00:04','2014-03-10 16:00:04'),(2621,'30985300','4/24/2014','4:00 pm','4/24/2014',NULL,'Microbiology Seminar:  Dr. Martin Polz of Massachusetts Institute of Technology, \"Ecology and Evolution of Bacterial Populations\"',NULL,'Charles G. Miller Auditorium, Room B102 Chemical & Life Sciences Laboratory','Dr. Patrick Degnan, Assistant Professor','Diane Tsevelekos','microsem@life.illinois.edu','333-1736','Seminar','Microbiology Department','2014-04-24 21:00:00','2014-04-24 05:00:00','2014-03-10 19:00:04','2014-03-10 19:00:04'),(2626,'30100073','4/18/2014','12:00 pm','4/18/2014',NULL,'Biochemistry Seminar: Dr. George Stark (Cleveland Clinic), \"Novel Aspects of NFkB and STAT Activation in Cancer\"','http://www.lerner.ccf.org/molgen/stark/','Charles G. Miller Auditorium (B102 CLSL)','Dr. Lin-Feng Chen','Cara Day','caraday@illinois.edu','217-333-2013','Seminar','Biochemistry Department Seminars','2014-04-18 17:00:00','2014-04-18 05:00:00','2014-03-14 16:40:03','2014-03-14 16:40:03'),(2627,'28783907','3/19/2014','12:00 pm','3/19/2014',NULL,'Cell &  Developmental Biology Seminar:   Dr. Sharon Dent, MD Anderson Cancer Center, University of Texas, \"Histone Modifiers in Developmental Disease\"',NULL,'Charles G. Miller Auditorium, B102 CLSL','Cell & Developmental Biology Department','Elaine Rodgers; Phil Newmark','erodgers@life.illinois.edu; pnewmark@life.illinois.edu','217-265-5511','Seminar','Cell and Developmental Biology (CDB) Departmental Seminars','2014-03-19 17:00:00','2014-03-19 05:00:00','2014-03-14 19:15:04','2014-03-14 19:15:04'),(2628,'29631027','3/17/2014','10:00 am','3/17/2014',NULL,'Preeti Sharma (Kranz Lab)',NULL,'116 RAL','Department of Biochemistry',NULL,NULL,NULL,'Seminar','Biochemistry Department Graduate Seminars','2014-03-17 15:00:00','2014-03-17 05:00:00','2014-03-17 14:55:04','2014-03-17 14:55:04'),(2629,'29631040','4/2/2014','4:00 pm','4/2/2014',NULL,'Nitesh Shashikanth (Leckband Lab) - \"Allosteric Modulation of Cadherin Activity by Inside-out Signaling\"',NULL,'116 RAL','Department of Biochemistry',NULL,NULL,NULL,'Seminar','Biochemistry Department Graduate Seminars','2014-04-02 21:00:00','2014-04-02 05:00:00','2014-03-17 16:15:03','2014-03-17 16:15:03'),(2631,'31735059','4/23/2014','12:00 pm','4/23/2014',NULL,'FINAL DEFENSE: Kim-Phung T. Nguyen, M.D. (Nair Lab)',NULL,'401 Roger Adams Lab - Rose Seminar Room','Department of Biochemistry',NULL,NULL,NULL,'Seminar','Biochemistry Department Graduate Seminars','2014-04-23 17:00:00','2014-04-23 05:00:00','2014-03-17 20:30:04','2014-03-17 20:30:04'),(2632,'30985296','3/20/2014','4:00 pm','3/20/2014',NULL,'Microbiology Seminar/Silverman & Guerrero Lecture in Immunology Series:  Dr. John Shively of City of Hope - National Cancer Institute, \"CEACAM1 -- A connection between inflammation and cancer\"',NULL,'Charles G. Miller Auditorium, Room B102 Chemical & Life Sciences Laboratory','Department of Microbiology','Diane Tsevelekos','microsem@life.illinois.edu','333-1736','Seminar','Microbiology Department','2014-03-20 21:00:00','2014-03-20 05:00:00','2014-03-19 21:30:03','2014-03-19 21:30:03'),(2634,'31753284','4/3/2014','12:00 pm','4/3/2014',NULL,'MIP Seminar: Hyunjoon Kong, Ph.D. (UIUC) \"Soft Nanomaterials for Diagnosis and Treatments of Vascular Diseases',NULL,'Charles G. Miller Auditorium, B102 CLSL','MIP Seminar Committee','Julie Moore','jmoor@illinois.edu','300-5804','Seminar','Molecular and Integrative Physiology (MIP) Department Seminar Series','2014-04-03 17:00:00','2014-04-03 05:00:00','2014-03-24 18:40:04','2014-03-24 18:40:04'),(2635,'29630406','4/21/2014','12:00 pm','4/21/2014','1:00 pm','CDB Student & Postdoc Seminar, Yating Wang',NULL,'B102 CLSL','Cell & Developmental Biology Department','Shannon Croft','shannon9@life.illinois.edu','(217) 333-6118','Lecture','Cell and Developmental Biology (CDB) Student & Postdoc Seminars','2014-04-21 17:00:00','2014-04-21 18:00:00','2014-03-24 21:35:03','2014-03-24 21:35:03'),(2640,'28563669','4/10/2014','4:00 pm','4/10/2014','5:00 pm','Ada Doisy Lectures in BIOCHEMISTRY: Drs. Melissa J. Moore (University of Massachusetts Medical School) \"Assembly and Dynamics of Uber Complex RNPs\"','http://mcb.illinois.edu/departments/biochemistry/doisy.html#about','MSB Auditorium','Dr. Susan Martinis','Cara Day','caraday@illinois.edu','217.333.2013','Seminar','Biochemistry Department Seminars','2014-04-10 21:00:00','2014-04-10 22:00:00','2014-03-25 14:25:03','2014-03-25 14:25:03'),(2641,'30985298','4/17/2014','4:00 pm','4/17/2014',NULL,'Microbiology Seminar:  Dr. Houra Merrikh of University of Washington, \"How replication-transcription conflicts impact the genome and evolution of bacteria\"',NULL,'Charles G. Miller Auditorium, Room B102 Chemical & Life Sciences Laboratory','Dr. Andrei Kuzminov, Professor','Diane Tsevelekos','microsem@life.illinois.edu','333-1736','Seminar','Microbiology Department','2014-04-17 21:00:00','2014-04-17 05:00:00','2014-03-28 18:20:03','2014-03-28 18:20:03'),(2642,'28563670','4/11/2014','12:00 pm','4/11/2014','1:00 pm','Ada Doisy Lectures in BIOCHEMISTRY: Dr. Taekjip Ha (University of Illinois at Urbana-Champaign) \"Genome Maintenance Up Close and Personal: Eavesdropping on Single Molecular Conversations\"','http://mcb.illinois.edu/departments/biochemistry/doisy.html#about','MSB Auditorium','Dr. Susan Martinis','Cara Day','caraday@illinois.edu','217.333.2013','Seminar','Biochemistry Department Seminars','2014-04-11 17:00:00','2014-04-11 18:00:00','2014-03-28 20:10:03','2014-03-28 20:10:03'),(2644,'29631037','4/16/2014','4:00 pm','4/16/2014',NULL,'Zehua Bao (Zhao Lab) - Customized CRISPR-Cas system for multiple gene disruptions in Saccharomyces cerevisiae',NULL,'116 RAL','Department of Biochemistry',NULL,NULL,NULL,'Seminar','Biochemistry Department Graduate Seminars','2014-04-16 21:00:00','2014-04-16 05:00:00','2014-04-02 17:45:04','2014-04-02 17:45:04'),(2645,'31593127','4/9/2014','12:00 pm','4/9/2014',NULL,'Cell &  Developmental Biology Seminar:   Dr.  Allan Spradling, Department of Embryology, Carnegie Institution, \"Evolutionary conservation in tissue and stem cell biology\"',NULL,'Charles G. Miller Auditorium, B102 CLSL','Cell & Developmental Biology Department','Elaine Rodgers; Phil Newmark','erodgers@life.illinois.edu; pnewmark@life.illinois.edu','217-265-5511','Seminar','Cell and Developmental Biology (CDB) Departmental Seminars','2014-04-09 17:00:00','2014-04-09 05:00:00','2014-04-04 15:05:04','2014-04-04 15:05:04'),(2646,'29631036','4/23/2014','4:00 pm','4/23/2014',NULL,'Xin Ye (Sligar Lab) -  \"Nanodiscs as a Platform to Study Integrin Signaling\".',NULL,'116 RAL','Department of Biochemistry',NULL,NULL,NULL,'Seminar','Biochemistry Department Graduate Seminars','2014-04-23 21:00:00','2014-04-23 05:00:00','2014-04-07 16:35:03','2014-04-07 16:35:03'),(2647,'29631023','4/16/2014','4:00 pm','4/16/2014',NULL,'Yi Yu (van der Donk Lab) - \" Investigations on Class II lanthipeptides\"',NULL,'116 RAL','Department of Biochemistry',NULL,NULL,NULL,'Seminar','Biochemistry Department Graduate Seminars','2014-04-16 21:00:00','2014-04-16 05:00:00','2014-04-07 20:55:03','2014-04-07 20:55:03'),(2649,'28783911','5/7/2014','12:00 pm','5/7/2014',NULL,'Cell &  Developmental Biology Seminar:  Dr. Frank Slack, Department of Molecular, Cellular, and Developmental Biology, Yale University, \"MicroRNA-based therapeutics in cancer\"',NULL,'Charles G. Miller Auditorium, B102 CLSL','Cell & Developmental Biology Department','Elaine Rodgers; Phil Newmark','erodgers@life.illinois.edu; pnewmark@life.illinois.edu','217-265-5511','Seminar','Cell and Developmental Biology (CDB) Departmental Seminars','2014-05-07 17:00:00','2014-05-07 05:00:00','2014-04-08 19:50:04','2014-04-08 19:50:04'),(2651,'31782521','4/17/2014','12:00 pm','4/17/2014',NULL,'MIP Seminar: Dr. Naoto Hoshi: UC of Irvine, \"Molecular regulation and functional role of the M-type potassium channel',NULL,'Charles G. Miller Auditorium, B102 CLSL','MIP Seminar Committee','Julie Moore','jmoor@illinois.edu','300-5804','Seminar','Molecular and Integrative Physiology (MIP) Department Seminar Series','2014-04-17 17:00:00','2014-04-17 05:00:00','2014-04-11 14:15:03','2014-04-11 14:15:03'),(2652,'31789276','4/23/2014','9:30 am','4/23/2014','4:00 pm','(Center for Biophysics and Computational Biology) Enrique De La Cruze (Yale University) \"10th Annual CB2 Symposium\"','http://biophysics.illinois.edu/ibs/symposium/symposium2014/','1005 Beckman','Illinois Biophysics Society','Eric Johnson','johns103@illinois.edu',NULL,NULL,'MCB Events','2014-04-23 14:30:00','2014-04-23 21:00:00','2014-04-15 16:10:03','2014-04-15 16:10:03'),(2654,'29631041','4/23/2014','4:00 pm','4/23/2014',NULL,'Carleigh Hebbard (Morrissey Lab) -  \"Chromogenic and Fluorogenic Polyphosphatase Substrates.\"',NULL,'116 RAL','Department of Biochemistry',NULL,NULL,NULL,'Seminar','Biochemistry Department Graduate Seminars','2014-04-23 21:00:00','2014-04-23 05:00:00','2014-04-17 18:45:03','2014-04-17 18:45:03'),(2656,'30985301','5/1/2014','4:00 pm','5/1/2014',NULL,'Microbiology Seminar:  Dr. Stephen Melville of Virginia Polytechnic Institute and State University, \"Analysis of Clostridium perfringens gliding motility at the cellular and atomic level\"',NULL,'Charles G. Miller Auditorium, Room B102 Chemical & Life Sciences Laboratory','TBA','Diane Tsevelekos','microsem@life.illinois.edu','333-1736','Seminar','Microbiology Department','2014-05-01 21:00:00','2014-05-01 05:00:00','2014-04-18 14:35:04','2014-04-18 14:35:04'),(2657,'31791622','4/24/2014','12:00 pm','4/24/2014',NULL,'MIP Seminar: Diane M. Robins, Ph.D.: University of Michigan \"Androgen Receptor Function in Prostate Cancer  Lessons from Humanized Mice and Men\"',NULL,'Charles G. Miller Auditorium, B102 CLSL','MIP Seminar Committee','Julie Moore','jmoor@illinois.edu','300-5804','Seminar','Molecular and Integrative Physiology (MIP) Department Seminar Series','2014-04-24 17:00:00','2014-04-24 05:00:00','2014-04-18 21:30:03','2014-04-18 21:30:03'),(2658,'31471999','4/30/2014','4:00 pm','4/30/2014',NULL,'Seung J. Oh (Blanke Lab) - - Understanding the molecular basis of the interaction between Helicobacter pylori vacuolating cytotoxin and its cellular receptor',NULL,NULL,'Department of Biochemistry',NULL,NULL,NULL,'Seminar','Biochemistry Department Graduate Seminars','2014-04-30 21:00:00','2014-04-30 05:00:00','2014-04-21 16:55:03','2014-04-21 16:55:03'),(2660,'29631032','4/30/2014','4:00 pm','4/30/2014',NULL,'Ziqiao Ding (Gennis Lab) - \"study of a radical formed during catalysis in cytochrome bo3 oxidase from E.coli\"',NULL,'116 RAL','Department of Biochemistry',NULL,NULL,NULL,'Seminar','Biochemistry Department Graduate Seminars','2014-04-30 21:00:00','2014-04-30 05:00:00','2014-04-24 18:30:03','2014-04-24 18:30:03'),(2661,'31806012','5/1/2014','12:00 pm','5/1/2014',NULL,'MIP Seminar: Thanos Tzounopoulos, Ph.D., University of Pittsburgh, \"Molecular Mechanisms Underlying Normal and Pathological Auditory Processing',NULL,'Charles G. Miller Auditorium, B102 CLSL','MIP Seminar Committee','Julie Moore','jmoor@illinois.edu','300-5804','Seminar','Molecular and Integrative Physiology (MIP) Department Seminar Series','2014-05-01 17:00:00','2014-05-01 05:00:00','2014-04-25 14:00:04','2014-04-25 14:00:04'),(2662,'28783910','4/30/2014','12:00 pm','4/30/2014',NULL,'Cell &  Developmental Biology Seminar:  **CANCELLED**  Dr. Jeffrey Rosen, Baylor College of Medicine, \"Long noncoding RNAs in mammary gland development and breast cancer\"',NULL,'Charles G. Miller Auditorium, B102 CLSL','Cell & Developmental Biology Department','Elaine Rodgers; Phil Newmark','erodgers@life.illinois.edu; pnewmark@life.illinois.edu','217-265-5511','Seminar','Cell and Developmental Biology (CDB) Departmental Seminars','2014-04-30 17:00:00','2014-04-30 05:00:00','2014-04-28 16:50:03','2014-04-28 16:50:03'),(2664,'31659743','5/9/2014','12:00 pm','5/9/2014',NULL,'Biochemistry/Chemical Biology Seminar: Dr. Lei Wang (The Salk Institute for Biological Sciences) \"Proximity-enabled Bioreactivity\"','http://www.salk.edu/faculty/wang.html','Charles G. Miller Auditorium (B102 CLSL)','Dr. Hong Jin','Cara Day','caraday@illinois.edu','217-333-2013','Seminar','Biochemistry Department Seminars','2014-05-09 17:00:00','2014-05-09 05:00:00','2014-05-01 14:40:04','2014-05-01 14:40:04'),(2668,'31879446','9/1/2014',NULL,'9/1/2014',NULL,'Labor Day',NULL,NULL,'University of Illinois Board of Trustees',NULL,NULL,NULL,'Holiday','Holidays','2014-09-01 05:00:00','2014-09-01 05:00:00','2014-05-27 19:55:03','2014-05-27 19:55:03'),(2669,'31879447','11/27/2014',NULL,'11/27/2014',NULL,'Thanksgiving Day',NULL,NULL,'University of Illinois Board of Trustees',NULL,NULL,NULL,'Holiday','Holidays','2014-11-27 06:00:00','2014-11-27 06:00:00','2014-05-27 19:55:03','2014-05-27 19:55:03'),(2670,'29077147','11/28/2014',NULL,'11/28/2014',NULL,'Day After Thanksgiving - Designated Holiday',NULL,NULL,'University of Illinois Board of Trustees',NULL,NULL,NULL,'Special Event','Holidays','2014-11-28 06:00:00','2014-11-28 06:00:00','2014-05-27 19:55:03','2014-05-27 19:55:03'),(2672,'31879449','1/1/2015',NULL,'1/1/2015',NULL,'New Year\'s Day',NULL,NULL,'University of Illinois Board of Trustees',NULL,NULL,NULL,'Holiday','Holidays','2015-01-01 06:00:00','2015-01-01 06:00:00','2014-05-27 20:00:04','2014-05-27 20:00:04'),(2673,'31879450','1/19/2015',NULL,'1/19/2015',NULL,'Martin Luther King Jr. Day - Designated Holiday',NULL,NULL,'University of Illinois Board of Trustees',NULL,NULL,NULL,'Holiday','Holidays','2015-01-19 06:00:00','2015-01-19 06:00:00','2014-05-27 20:00:04','2014-05-27 20:00:04'),(2676,'31879654','7/4/2014',NULL,'7/4/2014',NULL,'Independence Day',NULL,NULL,'University of Illinois Board of Trustees',NULL,NULL,NULL,'Holiday','Holidays','2014-07-04 05:00:00','2014-07-04 05:00:00','2014-05-27 20:25:04','2014-05-27 20:25:04'),(2677,'31911142','6/30/2014','2:00 pm','6/30/2014',NULL,'Fiona Groninger-Poe Final Defense',NULL,NULL,'Department of Biochemistry',NULL,NULL,NULL,'Seminar','Biochemistry Department Graduate Seminars','2014-06-30 19:00:00','2014-06-30 05:00:00','2014-06-13 18:30:03','2014-06-13 18:30:03'),(2690,'31911143','6/24/2014','1:00 pm','6/24/2014',NULL,'Salehe Ghasempur Final Defense',NULL,NULL,'Department of Biochemistry',NULL,NULL,NULL,'Seminar','Biochemistry Department Graduate Seminars','2014-06-24 18:00:00','2014-06-24 05:00:00','2014-06-24 16:15:03','2014-06-24 16:15:03'),(2694,'31930853','11/8/2014',NULL,'11/8/2014',NULL,'Microbial Diversity  A Tribute to the Life and Work of Abigail Salyers',NULL,'Charles G. Miller Auditorium, Room B102 Chemical & Life Sciences Laboratory','Department of Microbiology','Diane Tsevelekos','dtsevele@illinois.edu','333-1736','Seminar','Microbiology Department','2014-11-08 06:00:00','2014-11-08 06:00:00','2014-06-25 14:50:03','2014-06-25 14:50:03'),(2699,'31929233','10/30/2014','4:00 pm','10/30/2014',NULL,'Microbiology Seminar:  Dr. Molly Hughes of the University of Virginia, \"Chemokine-mediated antimicrobial activity against Bacillus anthracis\"',NULL,'Charles G. Miller Auditorium, Room B102 Chemical & Life Sciences Laboratory','Department of Microbiology, Dr. Steven Blanke','Diane Tsevelekos',NULL,'333-1736','Seminar','Microbiology Department','2014-10-30 21:00:00','2014-10-30 05:00:00','2014-07-03 15:00:03','2014-07-03 15:00:03'),(2703,'31927815','7/21/2014','3:00 pm','7/21/2014',NULL,'Emilia Calvaresi Final Defense (Hergenrother Lab)',NULL,'612 IGB','Department of Biochemistry',NULL,NULL,NULL,'Seminar','Biochemistry Department Graduate Seminars','2014-07-21 20:00:00','2014-07-21 05:00:00','2014-07-07 16:00:04','2014-07-07 16:00:04'),(2704,'31951202','8/5/2014','1:00 pm','8/5/2014',NULL,'Bijoy Desai Final Defense (Gerlt Lab)',NULL,'401 RAL','Department of Biochemistry',NULL,NULL,NULL,'Seminar','Biochemistry Department Graduate Seminars','2014-08-05 18:00:00','2014-08-05 05:00:00','2014-07-07 16:00:04','2014-07-07 16:00:04'),(2705,'31951203','8/6/2014','1:00 pm','8/6/2014',NULL,'Daniel Wichelecki Final Defense (Gerlt Lab)',NULL,'401 RAL','Department of Biochemistry',NULL,NULL,NULL,'Seminar','Biochemistry Department Graduate Seminars','2014-08-06 18:00:00','2014-08-06 05:00:00','2014-07-07 16:00:04','2014-07-07 16:00:04'),(2706,'31951306','8/15/2014','1:00 pm','8/15/2014',NULL,'Sheena Smith Final Defense (Kranz Lab)',NULL,'B102 CLSL','Department of Biochemistry',NULL,NULL,NULL,'Seminar','Biochemistry Department Graduate Seminars','2014-08-15 18:00:00','2014-08-15 05:00:00','2014-07-07 16:15:03','2014-07-07 16:15:03'),(2744,'31928177','8/28/2014','4:00 pm','8/28/2014',NULL,'Microbiology Seminar:  Dr. Jaquelin Dudley of the University of Texas-Austin, \"Exploitation of ERAD and Innate Immunity by a Tumorigenic Retrovirus\"',NULL,'Charles G. Miller Auditorium, Room B102 Chemical & Life Sciences Laboratory','Department of Microbiology, Dr. Joanna Shisler','Diane Tsevelekos','dtsevele@illinois.edu','333-1736','Seminar','Microbiology Department','2014-08-28 21:00:00','2014-08-28 05:00:00','2014-07-16 14:50:03','2014-07-16 14:50:03'),(2745,'31879448','12/29/2014',NULL,'12/29/2014',NULL,'Reduced Service Day',NULL,NULL,'U-C Senate',NULL,NULL,NULL,'Holiday','Holidays','2014-12-29 06:00:00','2014-12-29 06:00:00','2014-07-17 15:15:04','2014-07-17 15:15:04'),(2746,'31968755','12/24/2014',NULL,'12/24/2014',NULL,'Christmas Holiday',NULL,NULL,'U-C Senate',NULL,NULL,NULL,'Holiday','Holidays','2014-12-24 06:00:00','2014-12-24 06:00:00','2014-07-17 15:15:04','2014-07-17 15:15:04'),(2747,'31968756','1/2/2015',NULL,'1/2/2015',NULL,'Reduced Service Day',NULL,NULL,'University of Illinois Board of Trustees',NULL,NULL,NULL,'Holiday','Holidays','2015-01-02 06:00:00','2015-01-02 06:00:00','2014-07-17 15:20:04','2014-07-17 15:20:04'),(2750,'31968759','12/30/2014',NULL,'12/30/2014',NULL,'Reduced Service Day',NULL,NULL,'U-C Senate',NULL,NULL,NULL,'Holiday','Holidays','2014-12-30 06:00:00','2014-12-30 06:00:00','2014-07-17 15:25:03','2014-07-17 15:25:03'),(2751,'31968760','12/31/2014',NULL,'12/31/2014',NULL,'Reduced Service Day',NULL,NULL,'U-C Senate',NULL,NULL,NULL,'Holiday','Holidays','2014-12-31 06:00:00','2014-12-31 06:00:00','2014-07-17 15:25:03','2014-07-17 15:25:03'),(2752,'31929230','10/2/2014','4:00 pm','10/2/2014',NULL,'Microbiology Seminar:  Dr. Thomas Santangelo of Colorado State University \"Archaeal Information Processing Systems\"',NULL,'Charles G. Miller Auditorium, Room B102 Chemical & Life Sciences Laboratory','Department of Microbiology','Diane Tsevelekos','dtsevele@illinois.edu','333-1736','Seminar','Microbiology Department','2014-10-02 21:00:00','2014-10-02 05:00:00','2014-07-17 18:50:04','2014-07-17 18:50:04'),(2754,'31952671','7/21/2014','4:00 pm','7/21/2014',NULL,'Kade Fellow: Pei Wang (Huang Lab)',NULL,'116 RAL','Department of Biochemistry',NULL,NULL,NULL,'Seminar','Biochemistry Department Graduate Seminars','2014-07-21 21:00:00','2014-07-21 05:00:00','2014-07-21 19:05:03','2014-07-21 19:05:03'),(2761,'31978947','8/4/2014','1:00 pm','8/4/2014',NULL,'Adrienne Barry Final Defense (Leckband Lab) -',NULL,'401 RAL','Department of Biochemistry',NULL,NULL,NULL,'Seminar','Biochemistry Department Graduate Seminars','2014-08-04 18:00:00','2014-08-04 05:00:00','2014-07-23 16:00:04','2014-07-23 16:00:04'),(2775,'31952659','7/30/2014','4:00 pm','7/30/2014',NULL,'Westcott & Carter Fellow: Neal Andruska (Shapiro Lab)',NULL,'116 RAL','Department of Biochemistry',NULL,NULL,NULL,'Seminar','Biochemistry Department Graduate Seminars','2014-07-30 21:00:00','2014-07-30 05:00:00','2014-07-30 20:35:03','2014-07-30 20:35:03'),(2782,'31992784','8/28/2014','11:00 am','8/28/2014','12:00 pm','MIP Seminar: Dr. Frances Champagne, Columbia University, \"Early Environments and the Epigenetics of the Developing Brain\"',NULL,'Charles G. Miller Auditorium, B102 CLSL','MIP Seminar Committee','Julie Moore','jmoor@illinois.edu','300-5804','Seminar','Molecular and Integrative Physiology (MIP) Department Seminar Series','2014-08-28 16:00:00','2014-08-28 17:00:00','2014-07-31 14:05:03','2014-07-31 14:05:03'),(2789,'31929121','9/11/2014','4:00 pm','9/11/2014',NULL,'Microbiology Seminar:  Dr. Christian Jobin of the University of Florida, \"Role of microbial activities in colorectal cancer\"',NULL,'Charles G. Miller Auditorium, Room B102 Chemical & Life Sciences Laboratory','Department of Microbiology, Dr. Brenda Wilson','Diane Tsevelekos','dtsevele@illinois.edu','333-1736','Seminar','Microbiology Department','2014-09-11 21:00:00','2014-09-11 05:00:00','2014-08-04 16:25:03','2014-08-04 16:25:03'),(2791,'31941713','9/19/2014','12:00 pm','9/19/2014',NULL,'Biochemistry Seminar: Dr. David Giedroc (Indiana University), \"Copper Metalloregulation and Trafficking at the Host-microbial Pathogen Interface\"','http://giedroc.chem.indiana.edu/','Charles G. Miller Auditorium (B102 CLSL)','Dr. Robert Gennis','Cara Day','caraday@illinois.edu','217-333-2013','Seminar','Biochemistry Department Seminars','2014-09-19 17:00:00','2014-09-19 05:00:00','2014-08-05 18:25:04','2014-08-05 18:25:04'),(2795,'31929122','9/18/2014','4:00 pm','9/18/2014',NULL,'Microbiology Seminar:  Dr. John Helmann of Cornell University, \"Metal Ion Homeostasis in Bacillus subtilis\"',NULL,'Charles G. Miller Auditorium, Room B102 Chemical & Life Sciences Laboratory','Department of Microbiology, Dr. Thomas Kehl-Fie','Diane Tsevelekos','dtsevele@illinois.edu','333-1736','Seminar','Microbiology Department','2014-09-18 21:00:00','2014-09-18 05:00:00','2014-08-06 20:35:04','2014-08-06 20:35:04'),(2797,'31841625','9/26/2014','12:00 pm','9/26/2014',NULL,'Biochemistry Seminar: Dr. Jochen Zimmer (University of Virginia), \"Structural and Functional Insights into Cellulose Synthesis and Secretion\"','http://med.virginia.edu/faculty/faculty-listing/jz3x/','Charles G. Miller Auditorium (B102 CLSL)','Dr. Rudy Fratti','Cara Day','caraday@illinois.edu','217-333-2013','Seminar','Biochemistry Department Seminars','2014-09-26 17:00:00','2014-09-26 05:00:00','2014-08-07 14:15:04','2014-08-07 14:15:04'),(2814,'32011220','9/17/2014','12:00 pm','9/17/2014',NULL,'Cell &  Developmental Biology Seminar:   Dr. Gant Luxton, University of Minnesota, Dept. of Genetics, Cell Biology & Development, \"Nuclear-cytoskeletal coupling in migrating cells\"',NULL,'Charles G. Miller Auditorium, B102 CLSL','Cell & Developmental Biology Department','Elaine Rodgers; Phil Newmark','erodgers@life.illinois.edu; pnewmark@life.illinois.edu','217-265-5511','Seminar','Cell and Developmental Biology (CDB) Departmental Seminars','2014-09-17 17:00:00','2014-09-17 05:00:00','2014-08-12 20:05:03','2014-08-12 20:05:03'),(2815,'32011221','9/24/2014','12:00 pm','9/24/2014',NULL,'Cell &  Developmental Biology Seminar:   Dr. Roberto Cattaneo, Gene and Virus Therapy Program, Mayo Clinic Cancer Center, \"New viruses for cancer therapy: beyond cell adhesion\"',NULL,'Charles G. Miller Auditorium, B102 CLSL','Cell & Developmental Biology Department','Elaine Rodgers; Phil Newmark','erodgers@life.illinois.edu; pnewmark@life.illinois.edu','217-265-5511','Seminar','Cell and Developmental Biology (CDB) Departmental Seminars','2014-09-24 17:00:00','2014-09-24 05:00:00','2014-08-12 20:05:04','2014-08-12 20:05:04'),(2816,'32011223','10/15/2014','12:00 pm','10/15/2014',NULL,'Cell &  Developmental Biology Seminar:   Dr. Jeffrey Rosen, Baylor College of Medicine, Molecular & Cellular Biology, \"Long noncoding RNAs in mammary gland development and breast cancer\"',NULL,'Charles G. Miller Auditorium, B102 CLSL','Cell & Developmental Biology Department','Elaine Rodgers; Phil Newmark','erodgers@life.illinois.edu; pnewmark@life.illinois.edu','217-265-5511','Seminar','Cell and Developmental Biology (CDB) Departmental Seminars','2014-10-15 17:00:00','2014-10-15 05:00:00','2014-08-12 20:05:04','2014-08-12 20:05:04'),(2846,'32024699','9/5/2014','1:00 pm','9/5/2014',NULL,'10h Annual CBI TP Symposium: Prof. Anthony A. James, UC Irvine, \"Genetic Approaches for Controlling Transmission of Mosquito-Borne Diseases: Focus on Malaria\"',NULL,'Charles G. Miller Auditorium, Room B102 Chemical & Life Sciences Laboratory','Chemistry-Biology Interface Training Program','Nan Holda','holda@illinois.edu','244-5450','Seminar','Microbiology Department','2014-09-05 18:00:00','2014-09-05 05:00:00','2014-08-14 21:35:04','2014-08-14 21:35:04'),(2853,'31929120','9/4/2014','4:00 pm','9/4/2014',NULL,'Microbiology Seminar:  Dr. Thomas Kuhlman of the University of Illinois at Urbana-Champaign, \"Real Time Genome and Evolutionary Dynamics\"',NULL,'Charles G. Miller Auditorium, Room B102 Chemical & Life Sciences Laboratory','Department of Microbiology, Dr. Cari Vanderpool','Diane Tsevelekos','dtsevele@illinois.edu','333-1736','Seminar','Microbiology Department','2014-09-04 21:00:00','2014-09-04 05:00:00','2014-08-18 15:15:04','2014-08-18 15:15:04'),(2866,'31992798','9/4/2014','11:00 am','9/4/2014','12:00 pm','MIP Seminar: Sayeepriyadarshini \"Sayee\" Anakk, Ph.D., UIUC,\"Nuclear receptors-juggling from cholicky to housekeeping!\"',NULL,'Charles G. Miller Auditorium, B102 CLSL','MIP Seminar Committee','Julie Moore','jmoor@illinois.edu','300-5804','Seminar','Molecular and Integrative Physiology (MIP) Department Seminar Series','2014-09-04 16:00:00','2014-09-04 17:00:00','2014-08-25 14:55:03','2014-08-25 14:55:03'),(2869,'31941921','10/3/2014','1:00 pm','10/3/2014',NULL,'Herbert E. Carter Lecture in Nutritional Biochemistry and Preventive Medicine: Dr. Craig Thompson (Sloan-Kettering), \"The Role of Metabolism in the Regulation of Cell Growth and Differentiation\"','http://www.mskcc.org/research/lab/craig-thompson','Charles G. Miller Auditorium (B102 CLSL)','Dr. James Morrissey','Cara Day','caraday@illinois.edu','217-333-2013','Seminar','Biochemistry Department Seminars','2014-10-03 18:00:00','2014-10-03 05:00:00','2014-08-26 17:05:04','2014-08-26 17:05:04'),(2870,'32055305','9/15/2014','2:00 pm','9/15/2014',NULL,'Special Microbiology Seminar:  Dr. Ingyu Hwang of Seoul National University, \"Bacterial Social Behaviors in Cooperative Population\"',NULL,'Charles G. Miller Auditorium, Room B102 Chemical & Life Sciences Laboratory','Department of Microbiology, Dr. Stephen Farrand','Diane Tsevelekos','dtsevele@illinois.edu','333-1736','Seminar','Microbiology Department','2014-09-15 19:00:00','2014-09-15 05:00:00','2014-08-28 15:20:04','2014-08-28 15:20:04'),(2871,'31952657','8/28/2014','4:15 pm','8/28/2014',NULL,'Irisbel Guzman Sanchez (Gruebele Lab)',NULL,'116 RAL','Department of Biochemistry',NULL,NULL,NULL,'Seminar','Biochemistry Department Graduate Seminars','2014-08-28 21:15:00','2014-08-28 05:00:00','2014-08-28 21:05:04','2014-08-28 21:05:04'),(2881,'31952658','9/17/2014','4:00 pm','9/17/2014',NULL,'Keith R. Westcott Fellow: Jon Chekan (Nair Lab) - Biosynthesis of Constrained Bioactive Molecules from Linear Peptides',NULL,'116 RAL','Department of Biochemistry',NULL,NULL,NULL,'Seminar','Biochemistry Department Graduate Seminars','2014-09-17 21:00:00','2014-09-17 05:00:00','2014-09-02 20:20:03','2014-09-02 20:20:03'),(2882,'31952662','9/17/2014','4:00 pm','9/17/2014',NULL,'Keith R. Westcott Fellow: Shannon Walsh (Silverman Lab) - DNA Catalysts with Tyrosine, Serine, and Oligonucleotide Kinase Activity',NULL,'116 RAL','Department of Biochemistry',NULL,NULL,NULL,'Seminar','Biochemistry Department Graduate Seminars','2014-09-17 21:00:00','2014-09-17 05:00:00','2014-09-02 20:20:03','2014-09-02 20:20:03'),(2884,'32065638','9/10/2014','10:00 am','9/10/2014',NULL,'Cell &  Developmental Biology/BioEngineering Seminar:   Dr. Douglas DeSimone, University of Virginia School of Medicine, Department of Cell Biology, \"Cell Adhesion, Migration and the Forces that Shape Embryos\"',NULL,'1000 MNTL','Cell & Developmental Biology Department',NULL,NULL,'217-265-5511','Seminar','Cell and Developmental Biology (CDB) Departmental Seminars','2014-09-10 15:00:00','2014-09-10 05:00:00','2014-09-02 21:05:04','2014-09-02 21:05:04'),(2888,'31993106','9/25/2014','11:00 am','9/25/2014','12:00 pm','MIP Seminar: Charles Gilbert, M.D., Ph.D., Rockefeller University, \"Top down influences, perceptual learning and adaptive processing in the visual cortex\"',NULL,'Charles G. Miller Auditorium, B102 CLSL','MIP Seminar Committee','Julie Moore','jmoor@illinois.edu','300-5804','Seminar','Molecular and Integrative Physiology (MIP) Department Seminar Series','2014-09-25 16:00:00','2014-09-25 17:00:00','2014-09-03 14:25:03','2014-09-03 14:25:03'),(2903,'31929123','9/25/2014','4:00 pm','9/25/2014',NULL,'Microbiology Seminar:  Dr. Anna Malkova of the University of Iowa, \"Unusual mode of DNA synthesis promotes genomic destabilization\"',NULL,'Charles G. Miller Auditorium, Room B102 Chemical & Life Sciences Laboratory','Department of Microbiology, Dr. Andrei Kuzminov','Diane Tsevelekos','dtsevele@illinois.edu','333-1736','Seminar','Microbiology Department','2014-09-25 21:00:00','2014-09-25 05:00:00','2014-09-08 15:45:03','2014-09-08 15:45:03'),(2904,'31941817','9/12/2014','1:00 pm','9/12/2014',NULL,'Biochemistry Seminar: Dr. P. Leslie Dutton (University of Pennsylvania School of Medicine), \"Toward Biogenesis of Man-Designed Oxidoreductases Working in Cells\"','http://www.med.upenn.edu/biocbiop/faculty/dutton/','Charles G. Miller Auditorium (B102 CLSL)','Drs. Robert Gennis and Yi Lu','Cara Day','caraday@illinois.edu','217-333-2013','Seminar','Biochemistry Department Seminars','2014-09-12 18:00:00','2014-09-12 05:00:00','2014-09-08 16:35:04','2014-09-08 16:35:04'),(2909,'31968757','12/25/2014',NULL,'12/25/2014',NULL,'Christmas Day',NULL,NULL,'U-C Senate',NULL,NULL,NULL,'Holiday','Holidays','2014-12-25 06:00:00','2014-12-25 06:00:00','2014-09-15 16:35:04','2014-09-15 16:35:04'),(2910,'31968758','12/26/2014',NULL,'12/26/2014',NULL,'Day after Christmas - Designated Holiday',NULL,NULL,'U-C Senate',NULL,NULL,NULL,'Holiday','Holidays','2014-12-26 06:00:00','2014-12-26 06:00:00','2014-09-15 16:35:04','2014-09-15 16:35:04'),(2911,'31994678','10/1/2014','4:00 pm','10/1/2014',NULL,'Postdoc: Chris Thibodeaux (van der donk Lab) - \"A Comparative Kinetic Analysis of the Multifunctional Class II Lanthipeptide Synthetases\"',NULL,'116 RAL','Department of Biochemistry',NULL,NULL,NULL,'Seminar','Biochemistry Department Graduate Seminars','2014-10-01 21:00:00','2014-10-01 05:00:00','2014-09-15 16:45:04','2014-09-15 16:45:04'),(2916,'32094253','10/30/2014','11:00 am','10/30/2014',NULL,'MIP Seminar: Dr. David Sacks, NIH Clinical Center, \"IQGAP1 Orchestrates signaling from the Plasma Membrane to the Nucleus\"',NULL,'Charles G. Miller Auditorium, B102 CLSL','MIP Seminar Committee','Julie Moore','jmoor@illinois.edu','300-5804','Seminar','Molecular and Integrative Physiology (MIP) Department Seminar Series','2014-10-30 16:00:00','2014-10-30 05:00:00','2014-09-16 14:30:04','2014-09-16 14:30:04'),(2917,'28783905','11/12/2014','12:00 pm','11/12/2014',NULL,'Cell &  Developmental Biology Seminar:   Dr. E. Jane Hubbard, New York University School of Medicine, \"Time and Tide: Influences of Age, Physiology and Environment on Germline Stem Cells\"',NULL,'Charles G. Miller Auditorium, B102 CLSL','Cell & Developmental Biology Department','Elaine Rodgers; Phil Newmark','erodgers@life.illinois.edu; pnewmark@life.illinois.edu','217-265-5511','Seminar','Cell and Developmental Biology (CDB) Departmental Seminars','2014-11-12 18:00:00','2014-11-12 06:00:00','2014-09-17 16:00:04','2014-09-17 16:00:04'),(2924,'32106764','11/13/2014','10:00 am','11/13/2014',NULL,'FINAL DEFENSE:  SeyedFakhreddin Torabi (Lu Lab) - \"In Vitro Selection and Characterization of Mono-, Di-, and Trivalent Metal-Dependent DNAzymes and Their Sensing Applications\"',NULL,'401 RAL','Department of Biochemistry',NULL,NULL,NULL,'Seminar','Biochemistry Department Graduate Seminars','2014-11-13 16:00:00','2014-11-13 06:00:00','2014-09-22 15:00:04','2014-09-22 15:00:04'),(2927,'31993107','10/2/2014','11:00 am','10/2/2014','12:00 pm','MIP Seminar: Donald McDonnell, Ph.D., Duke University, \"Moving from Empirical to Mechanism-based Discovery Approaches in the Search for Molecules that Disrupt Androgen Signaling in Prostate Cancer\"\"',NULL,'Charles G. Miller Auditorium, B102 CLSL','MIP Seminar Committee','Julie Moore','jmoor@illinois.edu','300-5804','Seminar','Molecular and Integrative Physiology (MIP) Department Seminar Series','2014-10-02 16:00:00','2014-10-02 17:00:00','2014-09-24 14:10:04','2014-09-24 14:10:04'),(2928,'31929231','10/23/2014','4:00 pm','10/23/2014',NULL,'Microbiology Seminar:  Dr. Wyndham Lathem of Northwestern University, \"Extracellular Proteolysis, Cell Death, and Inflammation: New Connections Explain an Ancient Disease\"',NULL,'Charles G. Miller Auditorium, Room B102 Chemical & Life Sciences Laboratory','Department of Microbiology, Dr. Steven Blanke','Diane Tsevelekos','dtsevele@illinois.edu','333-1736','Seminar','Microbiology Department','2014-10-23 21:00:00','2014-10-23 05:00:00','2014-09-24 14:45:04','2014-09-24 14:45:04'),(2929,'31952661','10/1/2014','4:00 pm','10/1/2014',NULL,'Daryl Meling (Das Lab) - Protein-Protein Interactions and Mechanistic Insights for CYP2J2 and CYP5A1',NULL,'116 RAL','Department of Biochemistry',NULL,NULL,NULL,'Seminar','Biochemistry Department Graduate Seminars','2014-10-01 21:00:00','2014-10-01 05:00:00','2014-09-24 21:20:04','2014-09-24 21:20:04'),(2930,'32024565','9/29/2014','12:00 pm','9/29/2014','1:00 pm','CDB Student & Postdoc Seminar:  Xiang Deng, \"Dynamic Plasticity of Large-scale Chromatin Fibers During DNA Replication\"',NULL,'B102 CLSL','Cell & Developmental Biology Department','Elaine Rodgers','erodgers@life.illinois.edu','(217) 333-6118','Lecture','Cell and Developmental Biology (CDB) Student & Postdoc Seminars','2014-09-29 17:00:00','2014-09-29 18:00:00','2014-09-24 21:40:04','2014-09-24 21:40:04'),(2937,'31993241','10/16/2014','11:00 am','10/16/2014','12:00 pm','C. Ladd Prosser Lecture: Dr. Owen Witte, UCLA, \"Stem Cell Targets and Pathways in Prostate Cancer\"',NULL,'Alice Campbell Alumni Center Ballroom','MIP Seminar Committee','Julie Moore','jmoor@illinois.edu','300-5804','Lecture','Molecular and Integrative Physiology (MIP) Department Seminar Series','2014-10-16 16:00:00','2014-10-16 17:00:00','2014-09-30 18:15:04','2014-09-30 18:15:04'),(2938,'32024515','10/6/2014','12:00 pm','10/6/2014','1:00 pm','CDB Student & Postdoc Seminar:  Alvin Thomas, \"Retinoic acid signaling regulation by CYP26 during Xenopus lens regeneration\" &  James Kemp, \"Cyclase Associated Protein 1 Regulates Alpha-Actinin Function in Epithelia\"',NULL,'B102 CLSL','Cell & Developmental Biology Department','Elaine Rodgers','erodgers@life.illinois.edu','(217) 333-6118','Lecture','Cell and Developmental Biology (CDB) Student & Postdoc Seminars','2014-10-06 17:00:00','2014-10-06 18:00:00','2014-10-01 19:50:04','2014-10-01 19:50:04'),(2943,'32127197','10/14/2014','10:30 am','10/14/2014',NULL,'FINAL DEFENSE - Salehe Ghasempur (Gerlt lab) - \"MINING the Enolase Superfamily for new functions: Investigations of D-GlucARATE DEHYDRATASE related proteins (Glucdrp) and L-lyxonate dehydratase proteins (LyxD)\"',NULL,'401 RAL','Department of Biochemistry',NULL,NULL,NULL,'Seminar','Biochemistry Department Graduate Seminars','2014-10-14 15:30:00','2014-10-14 05:00:00','2014-10-02 16:15:03','2014-10-02 16:15:03'),(2944,'32127459','10/7/2014','12:00 pm','10/7/2014',NULL,'The School of Molecular & Cellular Biology Career Seminar Series: Dr. David Selinger, DuPont Pioneer, \"Industrial Biotechnology at DuPont\"',NULL,'B102 CLSL Charles G. Miller Auditorium','Molecular & Cellular Biology',NULL,NULL,NULL,NULL,'MCB Events','2014-10-07 17:00:00','2014-10-07 05:00:00','2014-10-02 18:15:03','2014-10-02 18:15:03'),(2947,'32011222','10/8/2014','12:00 pm','10/8/2014',NULL,'Cell &  Developmental Biology Seminar:   Dr. Jody Rosenblatt, Oncological Sciences, Bioengineering, and Biology, University of Utah; Huntsman Cancer Institute, \"Epithelial cell turnover--new roles for mechanical tension driving cell death and division\"',NULL,'Charles G. Miller Auditorium, B102 CLSL','Cell & Developmental Biology Department','Elaine Rodgers; Phil Newmark','erodgers@life.illinois.edu; pnewmark@life.illinois.edu','217-265-5511','Seminar','Cell and Developmental Biology (CDB) Departmental Seminars','2014-10-08 17:00:00','2014-10-08 05:00:00','2014-10-03 16:30:04','2014-10-03 16:30:04'),(2948,'31929229','10/9/2014','4:00 pm','10/9/2014',NULL,'Microbiology Seminar:  Dr. Rajeev Misra of Arizona State University, \"Outer membrane protein assembly and envelope stress:  two sides of the same coin\"',NULL,'Charles G. Miller Auditorium, Room B102 Chemical & Life Sciences Laboratory','Department of Microbiology, Dr. Cari Vanderpool','Diane Tsevelekos','dtsevele@illinois.edu','333-1736','Seminar','Microbiology Department','2014-10-09 21:00:00','2014-10-09 05:00:00','2014-10-03 16:45:03','2014-10-03 16:45:03'),(2949,'32129267','10/9/2014','11:00 am','10/9/2014',NULL,'MIP Seminar: Dr. Young-Chae Kim & Dr. Ting Fu, University of Illinois , Kemper Lab',NULL,'Charles G. Miller Auditorium, B102 CLSL','MIP Seminar Committee','Julie Moore','jmoor@illinois.edu','300-5804','Seminar','Molecular and Integrative Physiology (MIP) Department Seminar Series','2014-10-09 16:00:00','2014-10-09 05:00:00','2014-10-03 16:45:03','2014-10-03 16:45:03'),(2950,'32024516','10/13/2014','12:00 pm','10/13/2014','1:00 pm','CDB Student & Postdoc Seminar:  Hui-Chia Yu-Kemp, \"Collapsin Response Mediator Protein-1 regulates actin polymerization\"',NULL,'B102 CLSL','Cell & Developmental Biology Department','Elaine Rodgers','erodgers@life.illinois.edu','(217) 333-6118','Lecture','Cell and Developmental Biology (CDB) Student & Postdoc Seminars','2014-10-13 17:00:00','2014-10-13 18:00:00','2014-10-03 19:05:04','2014-10-03 19:05:04'),(2952,'31814566','10/17/2014',NULL,'10/18/2014',NULL,'Biochemistry Seminar: Hagerfest Memorial - A Symposium Honoring the Life and Work of Lowell P. Hager','https://mcb.illinois.edu/departments/biochemistry/hager_symposium.html','Charles G. Miller Auditorium (B102 CLSL)','Dr. Susan Martinis','Cara Day','caraday@illinois.edu','217-333-2013','Seminar','Biochemistry Department Seminars','2014-10-17 05:00:00','2014-10-18 05:00:00','2014-10-03 20:15:04','2014-10-03 20:15:04'),(2957,'31841623','11/7/2014','12:00 pm','11/7/2014',NULL,'Biochemistry Seminar: Dr. Jane Jackman (Ohio State University), \"A New Direction for RNA Synthesis: 3\'5\' Polymerases in Biology\"','http://chemistry.osu.edu/faculty/jackman','Charles G. Miller Auditorium (B102 CLSL)','Dr. Raven Huang','Cara Day','caraday@illinois.edu','217-333-2013','Seminar','Biochemistry Department Seminars','2014-11-07 18:00:00','2014-11-07 06:00:00','2014-10-08 16:10:04','2014-10-08 16:10:04'),(2961,'31983090','10/16/2014','4:00 pm','10/16/2014',NULL,'David Gottlieb Lecture 2014:  Dr. Mohamed Marahiel of the Philipps University Marburg, \"Structures and Dynamics of the NRPS Assembly-Line Machinery\"',NULL,'Charles G. Miller Auditorium, Room B102 Chemical & Life Sciences Laboratory','Dr. Douglas Mitchell, Department of Chemistry, Microbiology Affilliate, Institute For Genomic Biology','Institute For Genomic Biology','flanegin@illinois.edu',NULL,'Seminar','Microbiology Department','2014-10-16 21:00:00','2014-10-16 05:00:00','2014-10-10 15:35:04','2014-10-10 15:35:04'),(2962,'31952667','10/12/2014','4:00 pm','10/12/2014',NULL,'Hager Fellow: Yue Hao (Nair Lab)',NULL,'116 RAL','Department of Biochemistry',NULL,NULL,NULL,'Seminar','Biochemistry Department Graduate Seminars','2014-10-12 21:00:00','2014-10-12 05:00:00','2014-10-12 18:20:04','2014-10-12 18:20:04'),(2965,'32024517','10/20/2014','12:00 pm','10/20/2014','1:00 pm','CDB Student & Postdoc Seminar:  Paul Hamilton, \"Wnt/-catenin Signaling  in Xenopus Lens Regeneration  and Cornea Epithelial Maintenance\"',NULL,'B102 CLSL','Cell & Developmental Biology Department','Elaine Rodgers','erodgers@life.illinois.edu','(217) 333-6118','Lecture','Cell and Developmental Biology (CDB) Student & Postdoc Seminars','2014-10-20 17:00:00','2014-10-20 18:00:00','2014-10-13 15:00:04','2014-10-13 15:00:04'),(2970,'31952668','10/22/2014','4:00 pm','10/22/2014',NULL,'Paween Mahinthichaichan (Tajkhorshid/Gennis lab) - \"Molecular Dynamics Simulation Studies of Pathways and Mechanism of Substrate Delivery in Heme-Copper Oxidases\"',NULL,'116 RAL','Department of Biochemistry',NULL,NULL,NULL,'Seminar','Biochemistry Department Graduate Seminars','2014-10-22 21:00:00','2014-10-22 05:00:00','2014-10-16 14:45:04','2014-10-16 14:45:04'),(2971,'31952669','10/22/2014','4:00 pm','10/22/2014',NULL,'Ranjani Murali (Gennis Lab) - \"Discovering diversity and function of respiratory enzymes using sequence analysis\"',NULL,'116 RAL','Department of Biochemistry',NULL,NULL,NULL,'Seminar','Biochemistry Department Graduate Seminars','2014-10-22 21:00:00','2014-10-22 05:00:00','2014-10-16 20:05:04','2014-10-16 20:05:04'),(2974,'31993249','10/23/2014','11:00 am','10/23/2014','12:00 pm','MIP Seminar: Dr. Derek Wildman, UIUC \"Elucidating the Evolutionary History of Birth and Labor\"',NULL,'Charles G. Miller Auditorium, B102 CLSL','MIP Seminar Committee','Julie Moore','jmoor@illinois.edu','300-5804','Seminar','Molecular and Integrative Physiology (MIP) Department Seminar Series','2014-10-23 16:00:00','2014-10-23 17:00:00','2014-10-17 14:55:04','2014-10-17 14:55:04'),(2975,'31929234','11/6/2014','4:00 pm','11/6/2014',NULL,'Microbiology Seminar:  Dr. Billy Tsai of the University of Michigan, \"How the non-enveloped SV40 penetrates the ER membrane to cause infection\"',NULL,'Charles G. Miller Auditorium, Room B102 Chemical & Life Sciences Laboratory','Department of Microbiology, Dr. Joanna Shisler','Diane Tsevelekos','dtsevele@illinois.edu','333-1736','Seminar','Microbiology Department','2014-11-06 22:00:00','2014-11-06 06:00:00','2014-10-17 18:15:04','2014-10-17 18:15:04'),(2977,'31929337','11/13/2014','4:00 pm','11/13/2014',NULL,'Microbiology Seminar:  Dr. Zvi Kelman of the Institute For Bioscience and Biotechnology Research, \"Isolation and characterization of new archaeal replication proteins\"',NULL,'Charles G. Miller Auditorium, Room B102 Chemical & Life Sciences Laboratory','Department of Microbiology, Dr. Rachel Whitaker','Diane Tsevelekos','dtsevele@illinois.edu','333-1736','Seminar','Microbiology Department','2014-11-13 22:00:00','2014-11-13 06:00:00','2014-10-17 20:35:03','2014-10-17 20:35:03'),(2980,'31952663','10/20/2014','12:00 pm','10/20/2014',NULL,'Jason Bouvier (Gerlt Lab)',NULL,'116 RAL','Department of Biochemistry',NULL,NULL,NULL,'Seminar','Biochemistry Department Graduate Seminars','2014-10-20 17:00:00','2014-10-20 05:00:00','2014-10-20 16:30:04','2014-10-20 16:30:04'),(2982,'31952656','10/20/2014','12:00 pm','10/20/2014',NULL,'Michael Gregory (Sligar lab)',NULL,'116 RAL','Department of Biochemistry',NULL,NULL,NULL,'Seminar','Biochemistry Department Graduate Seminars','2014-10-20 17:00:00','2014-10-20 05:00:00','2014-10-20 16:30:04','2014-10-20 16:30:04'),(2983,'31952670','10/29/2014','4:00 pm','10/29/2014',NULL,'Daniel Harris (Kranz Lab) - \"Engineering Human T Cell Receptors for Adoptive T Cell Therapies\"',NULL,'116 RAL','Department of Biochemistry',NULL,NULL,NULL,'Seminar','Biochemistry Department Graduate Seminars','2014-10-29 21:00:00','2014-10-29 05:00:00','2014-10-20 18:10:03','2014-10-20 18:10:03'),(2984,'32024518','10/27/2014','12:00 pm','10/27/2014','1:00 pm','CDB Student & Postdoc Seminar:  Amir Saberi, \"GPCRs in Somatic Regulation of the Planarian Germline Development & Discovery of a Novem Flatworm RNA Virus\"& James Chu, \"Characterizing Cerebellin-short, a Novel Circadian Peptide, in the Rat Suprachiasmatic Nucleus\"',NULL,'B102 CLSL','Cell & Developmental Biology Department','Elaine Rodgers','erodgers@life.illinois.edu','(217) 333-6118','Lecture','Cell and Developmental Biology (CDB) Student & Postdoc Seminars','2014-10-27 17:00:00','2014-10-27 18:00:00','2014-10-20 21:20:04','2014-10-20 21:20:04'),(2986,'32065494','10/31/2014','12:00 pm','10/31/2014',NULL,'Biochemistry Seminar: Dr. Adrian Krainer (Cold Spring Harbor Laboratory), \"Antisense Splicing Modulation for Therapy and Modeling of CNS Disease\"','http://www.cshl.edu/Faculty/krainer-adrian-r.html','Charles G. Miller Auditorium (B102 CLSL)','Dr. Auinash Kalsotra','Cara Day','caraday@illinois.edu','217-333-2013','Seminar','Biochemistry Department Seminars','2014-10-31 17:00:00','2014-10-31 05:00:00','2014-10-20 22:10:03','2014-10-20 22:10:03'),(2997,'32024539','11/3/2014','12:00 pm','11/3/2014','1:00 pm','CDB Student & Postdoc Seminar:  Harini Iyer \"Understanding the Male Germline of Free-living and Parasitic Flatworms\" & Dr. Amanda Brock, \"Searching for Regulators of Regeneration in Drosophila\"',NULL,'B102 CLSL','Cell & Developmental Biology Department','Elaine Rodgers','erodgers@life.illinois.edu','(217) 333-6118','Lecture','Cell and Developmental Biology (CDB) Student & Postdoc Seminars','2014-11-03 18:00:00','2014-11-03 19:00:00','2014-10-24 16:20:03','2014-10-24 16:20:03'),(3000,'32011224','11/5/2014','12:00 pm','11/5/2014',NULL,'Cell &  Developmental Biology Seminar:   Dr. Anindya Bagchi, University of Minnesota, Genetics, Cell Biology & Development, \"The PVT1-MYC duet in cancer: Rising above the noise\"',NULL,'Charles G. Miller Auditorium, B102 CLSL','Cell & Developmental Biology Department','Elaine Rodgers; Phil Newmark','erodgers@life.illinois.edu; pnewmark@life.illinois.edu','217-265-5511','Seminar','Cell and Developmental Biology (CDB) Departmental Seminars','2014-11-05 18:00:00','2014-11-05 06:00:00','2014-10-28 16:25:04','2014-10-28 16:25:04'),(3002,'32006996','11/14/2014',NULL,'11/14/2014',NULL,'No Biochemistry Seminar Today in lieu of Colin A. Wraight Molecular Biophysics Symposium.  Keynote address by Prof. Julio Fernandez, Columbia University \"Titin: A Giant Mechanical Computer\"','http://illinois.edu/calendar/detail/4469?eventId=31927480&calMin=201411&cal=20141114&skinId=1','Beckman Institute, room 1005','Emad Tajkhorshid, Klaus Schulten, and many others',NULL,NULL,NULL,'Seminar','Biochemistry Department Seminars','2014-11-14 06:00:00','2014-11-14 06:00:00','2014-10-30 18:55:04','2014-10-30 18:55:04'),(3003,'31993402','11/6/2014','11:00 am','11/6/2014','12:00 pm','MIP Seminar: Dr. Timothy Osborne, Sanford/Burnham Medical Research Inst. Orlando, \"SREBPs as integrators of lipid metabolism and cell physiology\"',NULL,'Charles G. Miller Auditorium, B102 CLSL','MIP Seminar Committee','Julie Moore','jmoor@illinois.edu','300-5804','Seminar','Molecular and Integrative Physiology (MIP) Department Seminar Series','2014-11-06 17:00:00','2014-11-06 18:00:00','2014-10-30 20:00:04','2014-10-30 20:00:04'),(3006,'32024540','11/10/2014','12:00 pm','11/10/2014','1:00 pm','CDB Student & Postdoc Seminar:  Rachel Waldemer, \"Tnfsf14: a novel regulator of skeletal myoblast survival and muscle regeneration\"',NULL,'B102 CLSL','Cell & Developmental Biology Department','Elaine Rodgers','erodgers@life.illinois.edu','(217) 333-6118','Lecture','Cell and Developmental Biology (CDB) Student & Postdoc Seminars','2014-11-10 18:00:00','2014-11-10 19:00:00','2014-10-31 14:05:03','2014-10-31 14:05:03'),(3008,'31952778','11/12/2014','4:00 pm','11/12/2014',NULL,'Shyamal Subramanyam (Maria Spies Lab) - Keeping RAD51 Recombinase in Check  Role of c-Abl Kinase',NULL,'116 RAL','Department of Biochemistry',NULL,NULL,NULL,'Seminar','Biochemistry Department Graduate Seminars','2014-11-12 22:00:00','2014-11-12 06:00:00','2014-11-03 15:05:04','2014-11-03 15:05:04'),(3009,'31952779','11/12/2014','4:00 pm','11/12/2014',NULL,'Yi Yu (van der donk Lab) - \" Kinetic Control of the Cyclization Process is Important for Ring Pattern Determination in Prochlorosins\"',NULL,'116 RAL','Department of Biochemistry',NULL,NULL,NULL,'Seminar','Biochemistry Department Graduate Seminars','2014-11-12 22:00:00','2014-11-12 06:00:00','2014-11-03 17:05:04','2014-11-03 17:05:04'),(3013,'31993433','11/20/2014','11:00 am','11/20/2014',NULL,'MIP Seminar: Dr. Jason Kim, UMASS Medical School, \"Role of Inflammation in Type 2 Diabetes\"',NULL,'Charles G. Miller Auditorium, B102 CLSL','MIP Seminar Committee','Julie Moore','jmoor@illinois.edu','300-5804','Seminar','Molecular and Integrative Physiology (MIP) Department Seminar Series','2014-11-20 17:00:00','2014-11-20 06:00:00','2014-11-05 15:50:04','2014-11-05 15:50:04'),(3017,'31944649','12/5/2014','12:00 pm','12/5/2014',NULL,'Biochemistry Seminar: Dr. R. David Britt (University of California-Davis), \"Biosynthesis of the Catalytic H-Cluster of  [FeFe] Hydrogenase\"','http://brittepr.ucdavis.edu/index.php?option=com_frontpage&Itemid=1','Charles G. Miller Auditorium (B102 CLSL)','Dr. Robert Gennis','Cara Day','caraday@illinois.edu','217-333-2013','Seminar','Biochemistry Department Seminars','2014-12-05 18:00:00','2014-12-05 06:00:00','2014-11-06 22:55:04','2014-11-06 22:55:04'),(3022,'31952665','11/19/2014','4:00 pm','11/19/2014',NULL,'Ismaeel Muhamed (Leckband Lab) - \"E-Cadherin Global Mechanotransduction\"',NULL,'116 RAL','Department of Biochemistry',NULL,NULL,NULL,'Seminar','Biochemistry Department Graduate Seminars','2014-11-19 22:00:00','2014-11-19 06:00:00','2014-11-10 16:00:04','2014-11-10 16:00:04'),(3024,'32024542','11/17/2014','12:00 pm','11/17/2014','1:00 pm','CDB Student & Postdoc Seminar: Christina (Plasier) Rosenberg, \"Mitogenic Regulation of mTORC1\" & Dr. David Forsthoefel, \"More Functions For Fat: A Putative Role For Intestinal Lipid Stores During Planarian Regeneration\"',NULL,'B102 CLSL','Cell & Developmental Biology Department','Elaine Rodgers','erodgers@life.illinois.edu','(217) 333-6118','Lecture','Cell and Developmental Biology (CDB) Student & Postdoc Seminars','2014-11-17 18:00:00','2014-11-17 19:00:00','2014-11-11 17:45:03','2014-11-11 17:45:03'),(3025,'32011228','12/3/2014','12:00 pm','12/3/2014',NULL,'Cell &  Developmental Biology Seminar:   Dr. Lee Zou, Massachusetts General Hospital Cancer Center, Dept. of Pathobiology, \"Sensing and Signaling DNA Damage by the Checkpoint Pathways\"',NULL,'Charles G. Miller Auditorium, B102 CLSL','Cell & Developmental Biology Department','Elaine Rodgers; Phil Newmark','erodgers@life.illinois.edu; pnewmark@life.illinois.edu','217-265-5511','Seminar','Cell and Developmental Biology (CDB) Departmental Seminars','2014-12-03 18:00:00','2014-12-03 06:00:00','2014-11-11 17:50:03','2014-11-11 17:50:03'),(3027,'32035684','11/19/2014','4:05 pm','11/19/2014',NULL,'Carleigh Hebbard (Morrissey lab) -  \"Polyphosphate Degradation in Serum\"',NULL,'401 RAL','Department of Biochemistry',NULL,NULL,NULL,'Seminar','Biochemistry Department Graduate Seminars','2014-11-19 22:05:00','2014-11-19 06:00:00','2014-11-13 21:25:04','2014-11-13 21:25:04'),(3028,'32011225','11/19/2014','12:00 pm','11/19/2014',NULL,'Cell &  Developmental Biology Seminar:   Dr. Sally Horne-Badovinac, University of Chicago, Dept. of Molecular Genetics & Cell Biology, \"Round and round: epithelial rotation and basement membrane remodeling during organ morphogenesis\"',NULL,'Charles G. Miller Auditorium, B102 CLSL','Cell & Developmental Biology Department','Elaine Rodgers; Phil Newmark','erodgers@life.illinois.edu; pnewmark@life.illinois.edu','217-265-5511','Seminar','Cell and Developmental Biology (CDB) Departmental Seminars','2014-11-19 18:00:00','2014-11-19 06:00:00','2014-11-14 16:15:04','2014-11-14 16:15:04'),(3029,'31929338','11/20/2014','4:00 pm','11/20/2014',NULL,'Microbiology Seminar:  Dr. Laurie Comstock of Harvard Medical School, \"Ecological interactions among human gut bacteria\"',NULL,'Charles G. Miller Auditorium, Room B102 Chemical & Life Sciences Laboratory','Department of Microbiology, Dr. Patrick Degnan','Diane Tsevelekos','dtsevele@illinois.edu','333-1736','Seminar','Microbiology Department','2014-11-20 22:00:00','2014-11-20 06:00:00','2014-11-14 16:25:03','2014-11-14 16:25:03'),(3030,'31929340','12/4/2014','4:00 pm','12/4/2014',NULL,'Microbiology Seminar:  Dr. Joseph Mougous of the University of Washington, \"The travels of interbacterial toxins\"',NULL,'Charles G. Miller Auditorium, Room B102 Chemical & Life Sciences Laboratory','Department of Microbiology, Dr. James Slauch','Diane Tsevelekos','dtsevele@illinois.edu','333-1736','Seminar','Microbiology Department','2014-12-04 22:00:00','2014-12-04 06:00:00','2014-11-17 15:50:04','2014-11-17 15:50:04'),(3031,'31952775','12/3/2014','4:00 pm','12/3/2014',NULL,'Ford Fellow: Manuel Ortega (van der Donk Lab) - \"Biochemical characterization of the enzymes involved in the biosynthesis of the lantibiotic microbisporicin',NULL,'116 RAL','Department of Biochemistry',NULL,NULL,NULL,'Seminar','Biochemistry Department Graduate Seminars','2014-12-03 22:00:00','2014-12-03 06:00:00','2014-11-18 17:20:04','2014-11-18 17:20:04'),(3032,'31993436','12/4/2014','11:00 am','12/4/2014','12:00 pm','MIP Seminar: Dr. Susan Schantz, M.D., UIUC, \"Development PCB Exposure and Seizures: A New Story About an Old Contaminant\"',NULL,'Charles G. Miller Auditorium, B102 CLSL','MIP Seminar Committee','Julie Moore','jmoor@illinois.edu','300-5804','Seminar','Molecular and Integrative Physiology (MIP) Department Seminar Series','2014-12-04 17:00:00','2014-12-04 18:00:00','2014-11-24 20:15:04','2014-11-24 20:15:04'),(3034,'31952777','12/10/2014','4:00 pm','12/10/2014',NULL,'Swaminath Srinivas (Cronan Lab) - \"A Snapshot of acyl-ACP intermediates in E. coli \"',NULL,'116 RAL','Department of Biochemistry',NULL,NULL,NULL,'Seminar','Biochemistry Department Graduate Seminars','2014-12-10 22:00:00','2014-12-10 06:00:00','2014-11-24 20:30:04','2014-11-24 20:30:04'),(3035,'32258333','12/1/2014','1:00 pm','12/1/2014',NULL,'FINAL DEFENSE: NEAL ANDRUSKA (Shapiro Lab)',NULL,'C605 CLSL','Department of Biochemistry',NULL,NULL,NULL,'Seminar','Biochemistry Department Graduate Seminars','2014-12-01 19:00:00','2014-12-01 06:00:00','2014-11-25 15:30:04','2014-11-25 15:30:04'),(3036,'32024544','12/1/2014','12:00 pm','12/1/2014','1:00 pm','CDB Student & Postdoc Seminar:  Keaton Schuster, \"The Role of Taranis during imaginal disc regeneration\" & Sumanprava Giri, \"CMORCA/LRWD1 Organizes Heterochromatin by Assembling Histone H3 Lysine 9 Methyltransferases on Chromatin\"',NULL,'B102 CLSL','Cell & Developmental Biology Department','Elaine Rodgers','erodgers@life.illinois.edu','(217) 333-6118','Lecture','Cell and Developmental Biology (CDB) Student & Postdoc Seminars','2014-12-01 18:00:00','2014-12-01 19:00:00','2014-11-26 16:05:03','2014-11-26 16:05:03'),(3037,'31952664','12/10/2014','4:00 pm','12/10/2014',NULL,'Kiruthika Selvadurai (Huang Lab) - \"Investigation of tRNA Wobble Uridine Modification by Elp3\"',NULL,'116 RAL','Department of Biochemistry',NULL,NULL,NULL,'Seminar','Biochemistry Department Graduate Seminars','2014-12-10 22:00:00','2014-12-10 06:00:00','2014-12-01 15:35:04','2014-12-01 15:35:04'),(3046,'32024545','12/8/2014','12:00 pm','12/8/2014','1:00 pm','CDB Student & Postdoc Seminar:  Xinying Zong, \"Characterization of a positive regulatory loop between MALAT1 and its natural antisense transcript\" & Dr. Arindam Chakraborty, \"Dynamic phosphorylation of replication proteins during cell cycle progression\"',NULL,'B102 CLSL','Cell & Developmental Biology Department','Elaine Rodgers','erodgers@life.illinois.edu','(217) 333-6118','Lecture','Cell and Developmental Biology (CDB) Student & Postdoc Seminars','2014-12-08 18:00:00','2014-12-08 19:00:00','2014-12-03 16:00:04','2014-12-03 16:00:04'),(3047,'32281043','1/12/2015','10:00 am','1/12/2015',NULL,'FINAL DEFENSE - Abhinav Luthra (Sligar Lab) - \"Spectroscopic Characterization of Iron-oxygen Intermediates in Human Aromatase (CYP19A1)',NULL,'401 RAL','Department of Biochemistry',NULL,NULL,NULL,'Seminar','Biochemistry Department Graduate Seminars','2015-01-12 16:00:00','2015-01-12 06:00:00','2014-12-03 19:55:03','2014-12-03 19:55:03'),(3049,'31952785','12/11/2014','11:30 am','12/11/2014',NULL,'Hanchao Zhao (Martinis Lab)',NULL,'116 RAL','Department of Biochemistry',NULL,NULL,NULL,'Seminar','Biochemistry Department Graduate Seminars','2014-12-11 17:30:00','2014-12-11 06:00:00','2014-12-11 17:25:04','2014-12-11 17:25:04'),(3076,'32369782','1/29/2015','11:00 am','1/29/2015',NULL,'MIP Seminar: Dr. David Rudnick, Washington University School of Medicine, \"Re-examining Prometheus\' Liver\"',NULL,'Charles G. Miller Auditorium, B102 CLSL','MIP Seminar Committee','Julie Moore','jmoor@illinois.edu','333-1735','Seminar','Molecular and Integrative Physiology (MIP) Department Seminar Series','2015-01-29 17:00:00','2015-01-29 06:00:00','2015-01-05 16:30:03','2015-01-05 16:30:03'),(3089,'32318763','1/8/2015','4:00 pm','1/8/2015',NULL,'Microbiology Seminar:  Dr. Kevin Sokoloski, Indiana University:  \"A Tale of Two Hosts:  Comparative Molecular Analysis of Sindbis Virus Particles\"',NULL,'Charles G. Miller Auditorium, Room B102 Chemical & Life Sciences Laboratory','Department of Microbiology, Dr. Cari Vanderpool','Diane Tsevelekos','dtsevele@illinois.edu','333-1736','Seminar','Microbiology Department','2015-01-08 22:00:00','2015-01-08 06:00:00','2015-01-05 21:05:04','2015-01-05 21:05:04'),(3092,'32371116','1/29/2015','4:00 pm','1/29/2015',NULL,'Microbiology Seminar:  Dr. Maria Kalamvoki, University of Chicago: \"The Multifaceted strategy of HSV-1 to conquer the host:  A journey from the nucleus to the extracellular space\"',NULL,'Charles G. Miller Auditorium, Room B102 Chemical & Life Sciences Laboratory','Department of Microbiology, Dr. Cari Vanderpool','Diane Tsevelekos','dtsevele@illinois.edu','333-1736','Seminar','Microbiology Department','2015-01-29 22:00:00','2015-01-29 06:00:00','2015-01-05 22:30:04','2015-01-05 22:30:04'),(3104,'32202933','1/23/2015','12:00 pm','1/23/2015',NULL,'Biochemistry Seminar: Dr. Scott L. Diamond (University of Pennsylvania), \"Multiscale and Patient-Specific Systems Biology\"','http://www.seas.upenn.edu/~diamond/director.html','Charles G. Miller Auditorium (B102 CLSL)','Dr. Jim Morrissey','Cara Day','caraday@illinois.edu','217-333-2013','Seminar','Biochemistry Department Seminars','2015-01-23 18:00:00','2015-01-23 06:00:00','2015-01-07 19:30:03','2015-01-07 19:30:03'),(3110,'32397651','1/29/2015','1:00 pm','1/29/2015',NULL,'FINAL DEFENSE:  Pei Wang (Huang Lab) -  Discovery and Characterization of Novel RNA Repair systems.',NULL,'Room 532 Morrill Hall','Department of Biochemistry',NULL,NULL,NULL,'Seminar','Biochemistry Department Graduate Seminars','2015-01-29 19:00:00','2015-01-29 06:00:00','2015-01-14 21:05:04','2015-01-14 21:05:04'),(3112,'32335276','1/22/2015','11:00 am','1/22/2015',NULL,'MIP Seminar Dr. Nien-Pei Tsai; UIUC, \"Activity-Dependent Regulation of Synaptic Plasticity by Ubiquitin E3 Ligase Mdm2\"',NULL,'Charles G. Miller Auditorium, B102 CLSL','MIP Seminar Committee','Julie Moore','jmoor@illinois.edu','333-1735','Seminar','Molecular and Integrative Physiology (MIP) Department Seminar Series','2015-01-22 17:00:00','2015-01-22 06:00:00','2015-01-15 15:40:04','2015-01-15 15:40:04'),(3114,'31980720','1/21/2015','4:00 pm','1/21/2015',NULL,'Postdoc: Sandip Chorgahde (Kalsotra Lab) - \"Poly(A) binding protein C1 is developmentally regulated and controls cardiac hypertrophy\"',NULL,'116 RAL','Department of Biochemistry',NULL,NULL,NULL,'Seminar','Biochemistry Department Graduate Seminars','2015-01-21 22:00:00','2015-01-21 06:00:00','2015-01-15 16:20:04','2015-01-15 16:20:04'),(3115,'31985128','1/21/2015','4:00 pm','1/21/2015',NULL,'Postdoc: Xiangyan Shi (Rienstra lab) - Determining Protein Dynamics using Deuterium Solid-state NMR',NULL,'116 RAL','Department of Biochemistry',NULL,NULL,NULL,'Seminar','Biochemistry Department Graduate Seminars','2015-01-21 22:00:00','2015-01-21 06:00:00','2015-01-15 16:50:03','2015-01-15 16:50:03'),(3117,'31952782','1/28/2015','4:00 pm','1/28/2015',NULL,'Chang Sun (Gennis Lab) - \"Functional and Structural characterizations on the LM dimer from bacterial photosynthetic reaction center of Rb. sphaeroides\"',NULL,'116 RAL','Department of Biochemistry',NULL,NULL,NULL,'Seminar','Biochemistry Department Graduate Seminars','2015-01-28 22:00:00','2015-01-28 06:00:00','2015-01-16 14:50:03','2015-01-16 14:50:03'),(3121,'32024547','1/26/2015','12:00 pm','1/26/2015','1:00 pm','CDB Student & Postdoc Seminar:  Ambika Nadkarni, \"Uncovering Novel Roles For Actin Disassembly Factors\"',NULL,'B102 CLSL','Cell & Developmental Biology Department','Elaine Rodgers','erodgers@life.illinois.edu','(217) 333-6118','Lecture','Cell and Developmental Biology (CDB) Student & Postdoc Seminars','2015-01-26 18:00:00','2015-01-26 19:00:00','2015-01-20 17:50:04','2015-01-20 17:50:04'),(3124,'31952781','1/28/2015','4:00 pm','1/28/2015',NULL,'Seung J. Oh (Blanke Lab) -  \"identification of the receptor binding site on vacuolation cytotoxin from Helicobacter pylori\"',NULL,'116 RAL','Department of Biochemistry',NULL,NULL,NULL,'Seminar','Biochemistry Department Graduate Seminars','2015-01-28 22:00:00','2015-01-28 06:00:00','2015-01-21 19:20:03','2015-01-21 19:20:03'),(3128,'32371115','1/27/2015','4:00 pm','1/27/2015',NULL,'*CANCELLED* Microbiology Seminar:  Dr. Carolina Arias, Novartis Institute for Biomedical Research:  \"Gene expression regulation on a global scale:  Lessons from a herpesvirus\"',NULL,'Charles G. Miller Auditorium, Room B102 Chemical & Life Sciences Laboratory','Department of Microbiology, Dr. Cari Vanderpool','Diane Tsevelekos','dtsevele@illinois.edu','333-1736','Seminar','Microbiology Department','2015-01-27 22:00:00','2015-01-27 06:00:00','2015-01-26 16:50:04','2015-01-26 16:50:04'),(3131,'29251099','3/21/2015','1:00 pm','3/21/2015',NULL,'Spring Vacation Begins',NULL,NULL,NULL,NULL,NULL,NULL,'Academic','Academic Dates','2015-03-21 18:00:00','2015-03-21 05:00:00','2015-02-02 14:05:03','2015-02-02 14:05:03'),(3132,'29251100','3/30/2015',NULL,'3/30/2015',NULL,'Instruction resumes',NULL,NULL,NULL,NULL,NULL,NULL,'Academic','Academic Dates','2015-03-30 05:00:00','2015-03-30 05:00:00','2015-02-02 14:05:03','2015-02-02 14:05:03'),(3133,'29251101','5/6/2015',NULL,'5/6/2015',NULL,'Instruction Ends',NULL,NULL,NULL,NULL,NULL,NULL,'Academic','Academic Dates','2015-05-06 05:00:00','2015-05-06 05:00:00','2015-02-02 14:05:04','2015-02-02 14:05:04'),(3134,'29251167','5/8/2015',NULL,'5/8/2015',NULL,'Final Exams Begin',NULL,NULL,NULL,NULL,NULL,NULL,'Academic','Academic Dates','2015-05-08 05:00:00','2015-05-08 05:00:00','2015-02-02 14:05:04','2015-02-02 14:05:04'),(3136,'29251233','5/18/2015',NULL,'5/18/2015',NULL,'First Day of Instruction, Summer Term 1',NULL,NULL,NULL,NULL,NULL,NULL,'Academic','Academic Dates','2015-05-18 05:00:00','2015-05-18 05:00:00','2015-02-02 14:05:04','2015-02-02 14:05:04'),(3137,'29251299','6/13/2015',NULL,'6/13/2015',NULL,'End of Summer Session 1',NULL,NULL,NULL,NULL,NULL,NULL,'Academic','Academic Dates','2015-06-13 05:00:00','2015-06-13 05:00:00','2015-02-02 14:05:04','2015-02-02 14:05:04'),(3138,'29251300','6/15/2015',NULL,'6/15/2015',NULL,'First Day of Instruction, Summer Term 2',NULL,NULL,NULL,NULL,NULL,NULL,'Academic','Academic Dates','2015-06-15 05:00:00','2015-06-15 05:00:00','2015-02-02 14:05:04','2015-02-02 14:05:04'),(3139,'29077152','7/3/2015',NULL,'7/3/2015',NULL,'Independence Day (observed)',NULL,NULL,NULL,NULL,NULL,NULL,'Holiday','Holidays','2015-07-03 05:00:00','2015-07-03 05:00:00','2015-02-02 14:05:04','2015-02-02 14:05:04'),(3140,'29251301','8/6/2015',NULL,'8/6/2015',NULL,'End of Summer Session 2',NULL,NULL,NULL,NULL,NULL,NULL,'Academic','Academic Dates','2015-08-06 05:00:00','2015-08-06 05:00:00','2015-02-02 14:05:04','2015-02-02 14:05:04'),(3141,'29251304','8/7/2015',NULL,'8/7/2015',NULL,'Final Exams Begin',NULL,NULL,NULL,NULL,NULL,NULL,'Academic','Academic Dates','2015-08-07 05:00:00','2015-08-07 05:00:00','2015-02-02 14:05:04','2015-02-02 14:05:04'),(3142,'21388401','5/15/2016',NULL,'5/15/2016',NULL,'Commencement','http://oc.illinois.edu/commencement/',NULL,NULL,NULL,NULL,NULL,'Academic','Academic Dates','2016-05-15 05:00:00','2016-05-15 05:00:00','2015-02-02 14:05:04','2015-02-02 14:05:04'),(3143,'21388402','5/14/2017',NULL,'5/14/2017',NULL,'Commencement','http://oc.illinois.edu/commencement/',NULL,NULL,NULL,NULL,NULL,'Academic','Academic Dates','2017-05-14 05:00:00','2017-05-14 05:00:00','2015-02-02 14:05:04','2015-02-02 14:05:04'),(3144,'21388403','5/13/2018',NULL,'5/13/2018',NULL,'Commencement','http://oc.illinois.edu/commencement/',NULL,NULL,NULL,NULL,NULL,'Academic','Academic Dates','2018-05-13 05:00:00','2018-05-13 05:00:00','2015-02-02 14:05:04','2015-02-02 14:05:04'),(3145,'21388405','5/12/2019',NULL,'5/12/2019',NULL,'Commencement','http://oc.illinois.edu/commencement/',NULL,NULL,NULL,NULL,NULL,'Academic','Academic Dates','2019-05-12 05:00:00','2019-05-12 05:00:00','2015-02-02 14:05:05','2015-02-02 14:05:05'),(3146,'21388406','5/17/2020',NULL,'5/17/2020',NULL,'Commencement','http://oc.illinois.edu/commencement/',NULL,NULL,NULL,NULL,NULL,'Academic','Academic Dates','2020-05-17 05:00:00','2020-05-17 05:00:00','2015-02-02 14:05:05','2015-02-02 14:05:05'),(3148,'32318764','2/5/2015','4:00 pm','2/5/2015',NULL,'Microbiology Seminar:  Dr. Nicholas Renzette, University of Massachusetts:  \"Human Cytomegalovirus (HCMV) Evolution in Human Hosts\"',NULL,NULL,NULL,NULL,'dtsevele@illinois.edu','333-1736','Seminar','Microbiology Department','2015-02-05 22:00:00','2015-02-05 06:00:00','2015-02-02 14:10:04','2015-02-02 14:10:04'),(3149,'32275855','2/6/2015','12:00 pm','2/6/2015',NULL,'Biochemistry Seminar: Dr. Eric Jan (University of British Columbia), \"Translational Recoding by a Viral Internal Ribosome Entry Site\"','http://biochem.ubc.ca/person/eric-jan/',NULL,NULL,NULL,'caraday@illinois.edu','217-333-2013','Seminar','Biochemistry Department Seminars','2015-02-06 18:00:00','2015-02-06 06:00:00','2015-02-02 14:10:04','2015-02-02 14:10:04'),(3151,'31952786','2/11/2015','4:00 pm','2/11/2015',NULL,'Zehua Bao (Zhao Lab) - Genome engineering in Saccharomyces cerevisiae using CRISPR/Cas.',NULL,NULL,NULL,NULL,NULL,NULL,'Seminar','Biochemistry Department Graduate Seminars','2015-02-11 22:00:00','2015-02-11 06:00:00','2015-02-02 14:10:04','2015-02-02 14:10:04'),(3154,'32318765','2/12/2015','4:00 pm','2/12/2015',NULL,'Microbiology Seminar:  Dr. Christopher Brooke, NIAD/NIH Laboratory of Viral Diseases:  \"It takes a village:  incomplete gene packaging and cooperativity during influenza virus evolution\"',NULL,NULL,NULL,NULL,'dtsevele@illinois.edu','333-1736','Seminar','Microbiology Department','2015-02-12 22:00:00','2015-02-12 06:00:00','2015-02-02 14:10:04','2015-02-02 14:10:04'),(3156,'32111410','2/16/2015','4:00 pm','2/16/2015','5:00 pm','Prof.  Emily Balskus, Harvard University, \"Gut Reactions: Exploring the Chemistry of the Human Microbiota\"','http://scholar.harvard.edu/balskus/home',NULL,NULL,NULL,'holda@illinois.edu','244-5450','Lecture','Training Program at the Chemistry Biology Interface - Seminars','2015-02-16 22:00:00','2015-02-16 23:00:00','2015-02-02 14:10:04','2015-02-02 14:10:04'),(3159,'32318766','2/19/2015','4:00 pm','2/19/2015',NULL,'Microbiology Seminar:  Dr. Tijana Ivanovic, Harvard University:  \"Viral membrane fusion:  leading the way with influenza, virion by virion\"',NULL,NULL,NULL,NULL,'dtsevele@illinois.edu','333-1736','Seminar','Microbiology Department','2015-02-19 22:00:00','2015-02-19 06:00:00','2015-02-02 14:10:04','2015-02-02 14:10:04'),(3164,'31969074','2/27/2015','12:00 pm','2/27/2015','1:00 pm','Prof. Daniel G. Nocera, Harvard University, \"The Artificial Leaf\"','http://nocera.harvard.edu/DanielGNocera',NULL,NULL,NULL,'holda@illinois.edu','244-5450','Lecture','Training Program at the Chemistry Biology Interface - Seminars','2015-02-27 18:00:00','2015-02-27 19:00:00','2015-02-02 14:10:05','2015-02-02 14:10:05'),(3170,'32318769','3/5/2015','4:00 pm','3/5/2015',NULL,'Microbiology Seminar:  Dr. Jack Gilbert, Argonne National Laboratory -- \"Adventures in our Microbial World\"',NULL,NULL,NULL,NULL,'dtsevele@illinois.edu','333-1736','Seminar','Microbiology Department','2015-03-05 22:00:00','2015-03-05 06:00:00','2015-02-02 14:10:05','2015-02-02 14:10:05'),(3184,'32414428','3/31/2015','2:30 pm','3/31/2015',NULL,'FINAL DEFENSE:  Irisbel Guzman Sanchez (Gruebele lab) - KINETICS AND THERMODYNAMICS OF PROTEIN-RNA INTERACTIONS AND PROTEIN FOLDING IN VITRO AND IN CELLS',NULL,NULL,NULL,NULL,NULL,NULL,'Seminar','Biochemistry Department Graduate Seminars','2015-03-31 19:30:00','2015-03-31 05:00:00','2015-02-02 14:10:07','2015-02-02 14:10:07'),(3199,'32318943','4/16/2015','4:00 pm','4/16/2015',NULL,'Microbiology Seminar:  Dr. Donald Court, NIH Center For Cancer Research -- \"In vivo genetic engineering by homologous recombination technology and biology\"',NULL,NULL,NULL,NULL,'dtsevele@illinois.edu','333-1736','Seminar','Microbiology Department','2015-04-16 21:00:00','2015-04-16 05:00:00','2015-02-02 14:10:08','2015-02-02 14:10:08'),(3210,'31225359','5/7/2015',NULL,'5/19/2015',NULL,'IT No Change Period in effect',NULL,NULL,NULL,NULL,'consult@illinois.edu','244-7000','Academic','Academic Dates','2015-05-07 05:00:00','2015-05-19 05:00:00','2015-02-02 14:10:09','2015-02-02 14:10:09'),(3211,'32065078','5/12/2015','4:00 pm','5/12/2015','5:00 pm','CBI/Biochemistry Seminar: Dr. Randy Schekman (University of California at Berkeley) \"TBD\"','http://mcb.berkeley.edu/labs/schekman/',NULL,NULL,NULL,'holda@illinois.edu','217-244-5450','Seminar','Biochemistry Department Seminars','2015-05-12 21:00:00','2015-05-12 22:00:00','2015-02-02 14:10:09','2015-02-02 14:10:09'),(3213,'31879451','5/25/2015',NULL,'5/25/2015',NULL,'Memorial Day',NULL,NULL,NULL,NULL,NULL,NULL,'Holiday','Holidays','2015-05-25 05:00:00','2015-05-25 05:00:00','2015-02-02 14:10:09','2015-02-02 14:10:09'),(3214,'32370589','8/28/2015','1:00 pm','8/28/2015','5:00 pm','11th Annual CBI TP Symposium: Prof. Laura P.W. Ranum, University of Florida, \"title TBA\" & CBI TP Trainees TBD','http://neurogenetics.med.ufl.edu/faculty/dr-laura-p-w-ranum/',NULL,NULL,NULL,'holda@illinois.edu','244-5450','Symposium','Training Program at the Chemistry Biology Interface - Seminars','2015-08-28 18:00:00','2015-08-28 22:00:00','2015-02-02 14:10:09','2015-02-02 14:10:09'),(3215,'32399587','8/28/2015','4:00 pm','8/28/2015',NULL,'No Biochemistry Seminar today in lieu of 11th Annual CBI TP Symposium.  Keynote address by Prof. Laura Ranum (University of Florida)','http://illinois.edu/calendar/detail/4077/32370589',NULL,NULL,NULL,'holda@illinois.edu','217-244-5450','Seminar','Biochemistry Department Seminars','2015-08-28 21:00:00','2015-08-28 05:00:00','2015-02-02 14:10:09','2015-02-02 14:10:09'),(3216,'32011478','9/9/2015','12:00 pm','9/9/2015',NULL,'Cell &  Developmental Biology Seminar:   Dr. David Pellman, Dana-Farber Cancer Center, Pediatric Oncology, \"TBA\"',NULL,NULL,NULL,NULL,'erodgers@life.illinois.edu; kumarp@life.illinois.edu','217-265-5511','Seminar','Cell and Developmental Biology (CDB) Departmental Seminars','2015-09-09 17:00:00','2015-09-09 05:00:00','2015-02-02 14:10:09','2015-02-02 14:10:09'),(3217,'32294278','9/18/2015',NULL,'9/18/2015',NULL,'No Biochemistry Seminar Today in lieu of Chemistry G. F. Smith Memorial Lecture.  Keynote address by Prof. Christian Amatore (Ecole Normale Superieure-Paris) \"TBA\"','http://www.chimie.ens.fr/?q=umr-8640/electrochimie',NULL,NULL,NULL,NULL,NULL,'Seminar','Biochemistry Department Seminars','2015-09-18 05:00:00','2015-09-18 05:00:00','2015-02-02 14:10:09','2015-02-02 14:10:09'),(3218,'32436035','10/2/2015','12:00 pm','10/2/2015',NULL,'Biochemistry Seminar: Dr. Jamie H. D. Cate (University of California, Berkeley), \"TBD\"','http://mcb.berkeley.edu/faculty/all/catej',NULL,NULL,NULL,'caraday@illinois.edu','217-333-2013','Seminar','Biochemistry Department Seminars','2015-10-02 17:00:00','2015-10-02 05:00:00','2015-02-02 14:10:10','2015-02-02 14:10:10'),(3219,'32333049','10/10/2015',NULL,'10/10/2015',NULL,'Biochemistry Seminar: Wraight Memorial - A Symposium Honoring the Life and Work of Dr. Colin Wraight','https://mcb.illinois.edu/faculty/profile/cwraight/',NULL,NULL,NULL,'caraday@illinois.edu','217-333-2013','Seminar','Biochemistry Department Seminars','2015-10-10 05:00:00','2015-10-10 05:00:00','2015-02-02 14:10:10','2015-02-02 14:10:10'),(3220,'32275856','10/29/2015','4:00 pm','10/29/2015','5:00 pm','Ada Doisy Lectures in BIOCHEMISTRY: Drs.Suzanne Walker (Harvard Medical School) & Ian A. Wilson (The Scripps Research Institute) \"TBD\"',NULL,NULL,NULL,NULL,'caraday@illinois.edu','217.333.2013','Seminar','Biochemistry Department Seminars','2015-10-29 21:00:00','2015-10-29 22:00:00','2015-02-02 14:10:10','2015-02-02 14:10:10'),(3221,'32275857','10/30/2015','12:00 pm','10/30/2015','1:00 pm','Ada Doisy Lectures in BIOCHEMISTRY: Drs.Suzanne Walker (Harvard Medical School) & Ian A. Wilson (The Scripps Research Institute) \"TBD\"',NULL,NULL,NULL,NULL,'caraday@illinois.edu','217.333.2013','Seminar','Biochemistry Department Seminars','2015-10-30 17:00:00','2015-10-30 18:00:00','2015-02-02 14:10:10','2015-02-02 14:10:10'),(3222,'32129790','4/24/2015','12:00 pm','4/24/2015',NULL,'Biochemistry Seminar: Dr. Michelle C. Barton (The University of Texas MD), \"TRIM24: unexpected functions of a histone reader\"','http://faculty.mdanderson.org/Michelle_Barton/',NULL,NULL,NULL,'caraday@illinois.edu','217-333-2013','Seminar','Biochemistry Department Seminars','2015-04-24 17:00:00','2015-04-24 05:00:00','2015-02-02 15:05:04','2015-02-02 15:05:04'),(3224,'32024553','2/9/2015','12:00 pm','2/9/2015','1:00 pm','CDB Student & Postdoc Seminar: 